,Headline,Date,Symbol,Company Name
0, stocks to watch  adani group  l t  techm  reliance ind  rec  bpcl ,"31 Jan 2023, 07:27 AM IST",reliance,reliance industries
1, lotus chocolate hits upper circuit as reliance makes open offer to buy stake ,"06 Jan 2023, 03:11 PM IST",reliance,reliance industries
2, mcap of eight of top 10 firms jumps   1 35 lakh cr  sbi  reliance major winners ,"01 Jan 2023, 10:20 AM IST",reliance,reliance industries
3, lotus chocolate hits upper circuit as reliance retail to buy majority stake ,"30 Dec 2022, 12:15 PM IST",reliance,reliance industries
4, mcap of 10 most valued firms erodes by   1 68 lakh cr  reliance biggest drag ,"25 Dec 2022, 10:34 AM IST",reliance,reliance industries
5, what s making icici securities see a new 52 week high for reliance industries  ,"24 Dec 2022, 11:40 PM IST",reliance,reliance industries
6, stocks to watch  landmark cars  abans holdings  reliance  yes bank  jk cement ,"23 Dec 2022, 07:28 AM IST",reliance,reliance industries
7, stocks to watch  sula vineyards  reliance  paytm  adani ent  bandhan bank ,"22 Dec 2022, 07:33 AM IST",reliance,reliance industries
8, day trading guide  reliance  federal bank to hdfc bank   6 stocks to buy today ,"20 Dec 2022, 06:02 AM IST",reliance,reliance industries
9, stocks to watch  wipro  hpcl  reliance  adani ports  shriram transport  zee ," 16 Dec 2022, 07:36 AM IS",reliance,reliance industries
10, reliance hit most as top 5 out of 10 firms lose   1 67 lakh crore in m cap ,"11 Dec 2022, 03:15 PM IST",reliance,reliance industries
11, reliance industries creates most wealth for investors in last 5 years ,"09 Dec 2022, 01:08 PM IST",reliance,reliance industries
12, stocks to watch  kaynes technologies  nykaa  ndtv  jspl  reliance ," 22 Nov 2022, 01:20 PM IS",reliance,reliance industries
13, sbi   reliance  the king is dead  long live the king  ," 16 Nov 2022, 02:33 PM IS",reliance,reliance industries
14, stocks to watch  sbi  reliance  indigo  maruti  dr reddy s  powergrid ,"07 Nov 2022, 08:02 AM IST",reliance,reliance industries
15, stocks to watch  infosys  mindtree  reliance  hdfc life  tata steel ,"14 Oct 2022, 07:32 AM IST",reliance,reliance industries
16, stocks to watch  wipro  hcl  adani wilmar  reliance power  sail ,"13 Oct 2022, 07:32 AM IST",reliance,reliance industries
17, reliance power share jumps after blackrock fund buys stake ,"07 Oct 2022, 11:19 AM IST",reliance,reliance industries
18, stocks to watch  airtel  tcs  reliance  zee entertainment  maruti  hero motocorp ,"03 Oct 2022, 07:38 AM IST",reliance,reliance industries
19, mcap of 7 of top 10 firms lose   1 16 lakh crore  reliance industries worst hit ,"02 Oct 2022, 10:33 AM IST",reliance,reliance industries
20, stocks to watch  harsha engineers  kotak  reliance  ongc  coal india ,"26 Sep 2022, 07:37 AM IST",reliance,reliance industries
21, stocks to watch  adani ports  upl  tata power  bpcl  reliance  indusind bank ,"16 Sep 2022, 07:29 AM IST",reliance,reliance industries
22, stocks to watch  zee  adani transmission  reliance  tata consumer  vedanta ,"13 Sep 2022, 07:39 AM IST",reliance,reliance industries
23, stocks to watch  bank of baroda  paytm  spicejet  reliance  l t ,"05 Sep 2022, 07:36 AM IST",reliance,reliance industries
24, top defence stocks to bet on amid india s self reliance in defence manufacturing ,"02 Sep 2022, 10:38 AM IST",reliance,reliance industries
25, stocks to watch  reliance  nhpc  vodafone idea  ntpc  irctc ,"29 Aug 2022, 07:41 AM IST",reliance,reliance industries
26, stocks to watch  ongc  reliance  spicejet  itc  bpcl ,"19 Aug 2022, 07:29 AM IST",reliance,reliance industries
27, reliance industries shares trade ex dividend today  key things to know ,"18 Aug 2022, 09:32 AM IST",reliance,reliance industries
28, stocks to watch  ongc  lic  hdfc bank  reliance  infra  godrej industries ,"16 Aug 2022, 07:45 AM IST",reliance,reliance industries
29, reliance industries fixes record date for dividend for the fy 2021 22 ,"07 Aug 2022, 08:22 PM IST",reliance,reliance industries
30, stocks to watch  ongc  reliance  bank of india  adani green energy  itc ,"03 Aug 2022, 07:41 AM IST",reliance,reliance industries
31, how 5g spectrum win can drive reliance industries  stock ,"02 Aug 2022, 12:48 PM IST",reliance,reliance industries
32, stocks to watch  reliance  itc  zomato  union bank of india  upl ,"02 Aug 2022, 07:30 AM IST",reliance,reliance industries
33, stocks to watch  reliance  jsw steel  infosys  icici bank  yes bank ,"25 Jul 2022, 07:55 AM IST",reliance,reliance industries
34, stocks to watch  bank of maharashtra  heidelbergcement  reliance  ntpc ,"19 Jul 2022, 07:36 AM IST",reliance,reliance industries
35, stocks to watch  titan  bharti airtel  reliance  equitas sfb  power grid ,"07 Jul 2022, 07:42 AM IST",reliance,reliance industries
36, reliance share price tanks over 7   is this fall a good buying opportunity  ,"02 Jul 2022, 09:50 AM IST",reliance,reliance industries
37, stocks to watch  reliance industries  m m  lic  coal india  bpcl  jindal steel ,"13 Jun 2022, 07:55 AM IST",reliance,reliance industries
38, stocks to watch  reliance industries  hdfc  banks  iifl finance  bajaj auto ,"10 Jun 2022, 07:46 AM IST",reliance,reliance industries
39, reliance industries shares inch closer to record high  should you accumulate  ,"03 Jun 2022, 11:51 AM IST",reliance,reliance industries
40, stocks to watch  nhpc  reliance  yes bank  eicher motors ,"02 Jun 2022, 07:34 AM IST",reliance,reliance industries
41, reliance industries shares post biggest one day gain in 18 months ,"20 May 2022, 03:33 PM IST",reliance,reliance industries
42, stocks to watch  reliance industries  hcl tech  lti  mindtree  tata power ,"09 May 2022, 08:15 AM IST",reliance,reliance industries
43, reliance industries shares at record high  market cap crosses   19 lakh crore ,"27 Apr 2022, 10:11 AM IST",reliance,reliance industries
44, stocks to watch  icici bank  hdfc bank  reliance  railtel ,"25 Apr 2022, 07:50 AM IST",reliance,reliance industries
45, reliance shares to fii s behaviour  top 5 triggers for stock market this week ,"24 Apr 2022, 07:02 AM IST",reliance,reliance industries
46, reliance industries  firing on all cylinders  as stock hits new high ,"21 Apr 2022, 02:26 PM IST",reliance,reliance industries
47, reliance industries shares surge  less than   100 away from all time high ,"19 Apr 2022, 02:14 PM IST",reliance,reliance industries
48, sensex trades flat  tata steel  reliance  sbi among top gainers ,"19 Apr 2022, 11:23 AM IST",reliance,reliance industries
49, stocks to watch  tata motors  hdfc bank  reliance  m m ,"04 Apr 2022, 07:39 AM IST",reliance,reliance industries
50, stocks to watch  future retail  vedanta  ongc  reliance ,"01 Apr 2022, 08:54 AM IST",reliance,reliance industries
51, stocks to watch  axis bank  reliance  tata steel  godrej properties ,"31 Mar 2022, 07:47 AM IST",reliance,reliance industries
52, stocks to watch  reliance industries  axis bank  kotak mahindra bank  omcs ,"25 Mar 2022, 07:56 AM IST",reliance,reliance industries
53, stocks to watch  reliance industries  future retail  aurobindo pharma  sbi ,"21 Mar 2022, 07:28 AM IST",reliance,reliance industries
54, reliance capital shares surge as adani  poonawalla  others bid to acquire ,"14 Mar 2022, 10:53 AM IST",reliance,reliance industries
55, stocks to watch  reliance industries  future retail  tcs  vedanta  omcs ,"03 Mar 2022, 07:54 AM IST",reliance,reliance industries
56, stocks to watch  reliance industries  vodafone idea  tata motors  maruti suzuki ,"02 Mar 2022, 08:07 AM IST",reliance,reliance industries
57, stocks to watch  reliance industries  future retail  telcos  indian oil  ongc ,"18 Feb 2022, 07:53 AM IST",reliance,reliance industries
58, reliance industries shares tumble 4   m cap tanks by   68 404 cr ,"24 Jan 2022, 06:07 PM IST",reliance,reliance industries
59, stocks to watch  reliance  vodafone idea  pnb  icici bank ,"24 Jan 2022, 08:10 AM IST",reliance,reliance industries
60, stocks to watch  reliance  mindtree  tata motors  hcl tech  welspun enterprises ,"14 Jan 2022, 08:06 AM IST",reliance,reliance industries
61, stocks to watch  reliance  tcs  kotak mahindra  csb bank  indigo ,"10 Jan 2022, 08:09 AM IST",reliance,reliance industries
62, stocks to watch  reliance  future  rbl bank  sbi card  m m ,"27 Dec 2021, 08:07 AM IST",reliance,reliance industries
63, stocks to watch  reliance industries  zee  yes bank  dish tv  itc ,"22 Dec 2021, 08:06 AM IST",reliance,reliance industries
64, stocks to watch  reliance industries  l t  hindustan zinc ,"08 Dec 2021, 07:44 AM IST",reliance,reliance industries
65, reliance industries shares find favour post jio tariff hike  what brokerages say ,"29 Nov 2021, 11:01 AM IST",reliance,reliance industries
66, stocks to watch  paytm  reliance  tata chemicals  adani green ,"29 Nov 2021, 07:47 AM IST",reliance,reliance industries
67, stocks to watch  reliance  itc  latent view  jsw energy ,"26 Nov 2021, 07:29 AM IST",reliance,reliance industries
68, a reliance day on markets today as sensex rebounds 450 points ,"25 Nov 2021, 04:53 PM IST",reliance,reliance industries
69, stocks to watch  airtel  reliance  spicejet  vedanta ,"24 Nov 2021, 08:00 AM IST",reliance,reliance industries
70, stocks to watch  future group  reliance  iex  sbi  vodafone idea ,"23 Nov 2021, 07:58 AM IST",reliance,reliance industries
71, stocks to watch  maruti  reliance  pnb  sun pharma  paytm ,"22 Nov 2021, 07:55 AM IST",reliance,reliance industries
72, stocks to watch  reliance  tvs  sbi ,"09 Nov 2021, 07:13 AM IST",reliance,reliance industries
73, stocks to watch  reliance industries  icici bank  nbfcs  bpcl ,"25 Oct 2021, 08:04 AM IST",reliance,reliance industries
74, stocks to watch  reliance  zee  bharti airtel  jsw steel  tvs motors ,"22 Oct 2021, 08:03 AM IST",reliance,reliance industries
75, stocks to watch  reliance  future retail  pnb housing  mindtree  asian paints ,"21 Oct 2021, 08:02 AM IST",reliance,reliance industries
76, stocks to watch  reliance  nestle india  acc  l t tech  deepak fertilisers ,"20 Oct 2021, 08:10 AM IST",reliance,reliance industries
77, stocks to watch  reliance  sbi  yes bank  l t infotech  telcos ,"19 Oct 2021, 07:56 AM IST",reliance,reliance industries
78, reliance industries shares hit record high  above   2500  good time to buy  ,"27 Sep 2021, 01:24 PM IST",reliance,reliance industries
79, stocks to watch  astrazeneca india  reliance infra  indigo  hdfc bank  ntpc ,"27 Sep 2021, 08:06 AM IST",reliance,reliance industries
80, stocks to watch  ril  reliance infra  srei infra  zeel  shree cement ,"15 Sep 2021, 08:15 AM IST",reliance,reliance industries
81, reliance industries shares extend rally after a breakout  experts see more gain ,"06 Sep 2021, 12:00 PM IST",reliance,reliance industries
82, sensex  nifty open at fresh record high  l t and reliance industries top gainers ,"06 Sep 2021, 10:13 AM IST",reliance,reliance industries
83, reliance industries  ril  share hits record high  experts give  buy  tag ,"03 Sep 2021, 01:20 PM IST",reliance,reliance industries
84, just dial board approves allotment of 2 crore shares to reliance retail ,"02 Sep 2021, 11:44 AM IST",reliance,reliance industries
85, technical pick  reliance industries can rally up to 9  from current levels ,"Feb 14, 2023, 04:27 PM IST",reliance,reliance industries
86, budget 2023  airtel  reliance jio in focus as govt to set up 100 labs for 5g use cases ,"Feb 1, 2023, 03:13 PM IST",reliance,reliance industries
87, tcs shares  motilal oswal sees   3950 target in 2023  should you buy  ,"04 Feb 2023, 12:06 PM IST",tcs,tata consultancy services
88, from ril  tcs to adani  top stocks to move to t 1  what faster settlement means ,"25 Jan 2023, 10:56 AM IST",tcs,tata consultancy services
89, tcs shares trade ex dividend post declaring special dividend  stock rises ,"16 Jan 2023, 09:18 AM IST",tcs,tata consultancy services
90, stocks to watch  hdfc bank  wipro  tcs  sun pharma  dmart  l t finance ,"16 Jan 2023, 07:31 AM IST",tcs,tata consultancy services
91, tcs to trade ex dividend on monday  record and payment dates here ,"16 Jan 2023, 06:35 AM IST",tcs,tata consultancy services
92, mcap of 7 of top 10 most valued firms jump over   1 lakh cr  tcs  infosys shine ,"15 Jan 2023, 11:10 AM IST",tcs,tata consultancy services
93, dividend paying stock  tcs to trade ex dividend next week to pay   75 per scrip ,"14 Jan 2023, 02:02 PM IST",tcs,tata consultancy services
94, why european market rally may fuel tcs  tata motors share   explained ,"14 Jan 2023, 07:44 AM IST",tcs,tata consultancy services
95, what s making icici sec see a good upside for tcs in a target frame of 3 months  ,"12 Jan 2023, 06:55 PM IST",tcs,tata consultancy services
96, tcs declares record dividend  how it compares with previous years ,"10 Jan 2023, 10:44 AM IST",tcs,tata consultancy services
97, tcs shares plunge on lower than expected q3 profit  should you buy hold  ,"10 Jan 2023, 09:20 AM IST",tcs,tata consultancy services
98, stocks to watch  tcs  hdfc  ongc  jsw steel  paytm  tata motors ,"10 Jan 2023, 07:29 AM IST",tcs,tata consultancy services
99, tcs q3 earnings  here is what to what to expect from the stock today ,"09 Jan 2023, 09:41 PM IST",tcs,tata consultancy services
100, why it stocks are rising ahead of tcs q3 results  ,"09 Jan 2023, 03:00 PM IST",tcs,tata consultancy services
101, tcs share price jumps 3  ahead of q3 earnings ,"09 Jan 2023, 11:34 AM IST",tcs,tata consultancy services
102, tcs to announce q3 earnings today  here is what to expect ,"09 Jan 2023, 08:29 AM IST",tcs,tata consultancy services
103, 8 of top 10 firms lose   1 lakh crore in mcap  infosys  tcs biggest losers ,"08 Jan 2023, 10:30 AM IST",tcs,tata consultancy services
104, stocks to focus  maruti  tcs  adani power  torrent power  tata motors  iex ,"02 Jan 2023, 07:27 AM IST",tcs,tata consultancy services
105, tata technologies  the next tcs  ," 23 Dec 2022, 02:54 PM IS",tcs,tata consultancy services
106, stocks to watch  tcs  ndtv  iex  adani power  idfc  ongc ,"01 Dec 2022, 07:35 AM IST",tcs,tata consultancy services
107, stocks to watch  l t  ndtv  tcs  hcl tech  m m  kotak bank ,"29 Nov 2022, 07:31 AM IST",tcs,tata consultancy services
108, infosys  tcs shares  why bnp paribas is bullish on these 2 indian it stocks ,"24 Nov 2022, 01:13 PM IST",tcs,tata consultancy services
109, tcs shares trade ex dividend  stock rises ,"17 Oct 2022, 01:10 PM IST",tcs,tata consultancy services
110, stock to watch  tcs  delta corp  infosys  suzlon  adani enterprises ,"12 Oct 2022, 07:52 AM IST",tcs,tata consultancy services
111, tcs shares  should you buy hold the it stock after q2 results  ,"11 Oct 2022, 10:35 AM IST",tcs,tata consultancy services
112, stocks to watch  tcs  adani energy  infosys  india cements  bajaj auto ,"11 Oct 2022, 07:33 AM IST",tcs,tata consultancy services
113, tcs could gap up to infy adr  up 2 9  at open on nasdaq ,"10 Oct 2022, 09:07 PM IST",tcs,tata consultancy services
114, how tcs shares are likely to perform today after q2 results ,"11 Oct 2022, 06:12 AM IST",tcs,tata consultancy services
115, mcap of 7 of top 10 most valued firms rise   1 lakh cr  ril  tcs top gainers ,"09 Oct 2022, 11:18 AM IST",tcs,tata consultancy services
116, stocks to watch  airtel  tcs  reliance  zee entertainment  maruti  hero motocorp ,"03 Oct 2022, 07:38 AM IST",tcs,tata consultancy services
117, tech giant tcs to consider 2nd interim dividend on 10 oct  what to expect in q2  ,"02 Oct 2022, 05:27 PM IST",tcs,tata consultancy services
118, tcs shares hit fresh 52 week low ,"26 Sep 2022, 11:44 AM IST",tcs,tata consultancy services
119, tcs  infosys shares trade near 1 year lows  should you buy the it stocks  ,"22 Sep 2022, 11:31 AM IST",tcs,tata consultancy services
120, goldman downgrades infosys  tcs to  sell  but upgrades one it stock ,"14 Sep 2022, 02:41 PM IST",tcs,tata consultancy services
121, stocks to watch  indigo  zee entertainment  airtel  tcs  maruti suzuki  mindtree ,"08 Sep 2022, 07:32 AM IST",tcs,tata consultancy services
122, stocks to watch  infosys  tvs electronics  tcs  gillette india  ntpc ,"23 Aug 2022, 07:39 AM IST",tcs,tata consultancy services
123, stocks to watch  paytm  adani  tcs  spicejet  l t  nhpc ,"22 Aug 2022, 07:40 AM IST",tcs,tata consultancy services
124, infosys  tcs lead gainers as 8 of top 10 firms add   98 235 crore in market cap ,"07 Aug 2022, 03:10 PM IST",tcs,tata consultancy services
125, mcap of eight of top 10 firms jumps over   1 91 lakh crore  tcs top gainer ,"31 Jul 2022, 11:11 AM IST",tcs,tata consultancy services
126, tcs shares trade ex dividend today  what investors should know ,"14 Jul 2022, 11:02 AM IST",tcs,tata consultancy services
127, tcs  record date for interim dividend this week  details inside ,"13 Jul 2022, 03:19 PM IST",tcs,tata consultancy services
128, tcs shares  why motilal oswal sees potential upside despite q1 profit miss ,"10 Jul 2022, 02:44 PM IST",tcs,tata consultancy services
129, tcs q1 results  it major set to kick off earnings season  shares fall ,"08 Jul 2022, 02:05 PM IST",tcs,tata consultancy services
130, stocks to watch  tcs  m m  tata power  vedanta  dr reddy s  hindustan zinc ,"08 Jul 2022, 08:19 AM IST",tcs,tata consultancy services
131, stocks to watch  hdfc  tata steel long  kotak mahindra bank  indusind bank  tcs ,"05 Jul 2022, 07:50 AM IST",tcs,tata consultancy services
132, 9 of top 10 most valued firms add   2 51 lakh cr in m cap  tcs top gainer ,"26 Jun 2022, 02:58 PM IST",tcs,tata consultancy services
133, tcs  infosys shares trade near 52 week lows  good levels to buy  ,"20 Jun 2022, 01:53 PM IST",tcs,tata consultancy services
134, market crash  top 10 firms lose   3 91 lakh cr in m cap  tcs  ril biggest laggards ,"19 Jun 2022, 11:31 AM IST",tcs,tata consultancy services
135, stocks to watch  metropolis healthcare  adani enterprises  sbi cards  tcs ,"07 Jun 2022, 07:30 AM IST",tcs,tata consultancy services
136, india s it sector downgraded by jp morgan  tcs shares slump 5  ,"19 May 2022, 02:41 PM IST",tcs,tata consultancy services
137, tcs  3 indian largecap it stocks downgraded by jpmorgan ,"19 May 2022, 10:39 AM IST",tcs,tata consultancy services
138, tcs shares muted after q4 earnings  but why some brokerages remain positive  ,"15 Apr 2022, 11:15 AM IST",tcs,tata consultancy services
139, infosys vs tcs  which it stock is the top pick post q4 results  ,"14 Apr 2022, 11:49 AM IST",tcs,tata consultancy services
140, tcs shares rise post q4 results  what brokerages say on the it stock ,"12 Apr 2022, 09:26 AM IST",tcs,tata consultancy services
141, stocks to watch  tcs  telcos  zee entertainment  ruchi soya  adani green ,"12 Apr 2022, 08:00 AM IST",tcs,tata consultancy services
142, stocks to watch  tcs  tata motors  tata steel  axis bank  vodafone idea ,"11 Apr 2022, 07:55 AM IST",tcs,tata consultancy services
143, m cap of 4 of top 10 most valued firms dips over   1 lakh cr  tcs  infosys drag ,"10 Apr 2022, 03:40 PM IST",tcs,tata consultancy services
144, tcs  infosys results to us inflation data  top 5 triggers for market this week ,"10 Apr 2022, 09:04 AM IST",tcs,tata consultancy services
145, stocks to watch  zomato  tcs  vedanta  sbi cards ,"05 Apr 2022, 07:32 AM IST",tcs,tata consultancy services
146, stocks to watch  tcs  future retail  zomato  kotak mahindra bank  ruchi soya ,"24 Mar 2022, 07:38 AM IST",tcs,tata consultancy services
147, tcs share buyback offer closes today  what should retail investors do  ,"23 Mar 2022, 12:10 PM IST",tcs,tata consultancy services
148, stocks to watch  infosys  tcs  paytm  vodafone idea  adani ports ,"23 Mar 2022, 07:56 AM IST",tcs,tata consultancy services
149, stocks to watch  eveready  dish tv  tcs  indigo ,"09 Mar 2022, 08:21 AM IST",tcs,tata consultancy services
150, tcs  share buyback opens tomorrow  what investors need to know ,"08 Mar 2022, 02:08 PM IST",tcs,tata consultancy services
151, stocks to watch  ongc  hindalco  tcs  sun tv ,"08 Mar 2022, 08:00 AM IST",tcs,tata consultancy services
152, stocks to watch  reliance industries  future retail  tcs  vedanta  omcs ,"03 Mar 2022, 07:54 AM IST",tcs,tata consultancy services
153, stocks to watch  tcs  vodafone idea  vedanta  future retail  adani group ,"24 Feb 2022, 08:13 AM IST",tcs,tata consultancy services
154, tcs shares down 6  in 5 days  should you buy the it stock now  ,"22 Feb 2022, 12:27 PM IST",tcs,tata consultancy services
155, sensex cracks 1 000 points as russia ukraine crisis deepens  tcs  l t top losers ,"22 Feb 2022, 10:42 AM IST",tcs,tata consultancy services
156, stocks to watch  bharti airtel  vedanta  tcs  hdfc bank  l t finance holdings ,"22 Feb 2022, 08:09 AM IST",tcs,tata consultancy services
157, m cap of 5 of top 10 most valued firms adds   86 000 cr  tcs biggest gainer ,"20 Feb 2022, 10:55 AM IST",tcs,tata consultancy services
158, tcs share buyback record date next week  key things retail investors should know ,"16 Feb 2022, 09:17 AM IST",tcs,tata consultancy services
159, tcs share buyback  a good opportunity for retail investors  ,"14 Feb 2022, 12:58 PM IST",tcs,tata consultancy services
160, mcap of nine of top 10 cos erodes by over   1 lakh crore  tcs biggest drag ,"13 Feb 2022, 10:56 AM IST",tcs,tata consultancy services
161, stocks to watch  tcs  infosys  wipro  tata motors  kotak mahindra bank  yes bank ,"13 Jan 2022, 08:16 AM IST",tcs,tata consultancy services
162, stocks to watch  tcs  infosys  wipro  delta corp  dlf  federal bank ,"12 Jan 2022, 08:03 AM IST",tcs,tata consultancy services
163, tcs shares surge ahead of q3 results  buyback proposal ,"10 Jan 2022, 12:39 PM IST",tcs,tata consultancy services
164, stocks to watch  reliance  tcs  kotak mahindra  csb bank  indigo ,"10 Jan 2022, 08:09 AM IST",tcs,tata consultancy services
165, stocks to watch  hdfc bank  mahindra logistics  paras defence  tcs ,"28 Dec 2021, 08:01 AM IST",tcs,tata consultancy services
166, stocks to watch  hero motocorp  indian oil  indigo  tcs ,"24 Dec 2021, 08:05 AM IST",tcs,tata consultancy services
167, indian share markets trade lower  hdfc bank and tcs top losers ,"09 Dec 2021, 10:45 AM IST",tcs,tata consultancy services
168, mcap of 7 of 10 most valued firms jump over   1 29 lakh cr  tcs biggest gainer ,"05 Dec 2021, 10:25 AM IST",tcs,tata consultancy services
169, had you invested   1 lakh in tcs in 2011  this is how much you would have today ,"01 Dec 2021, 10:59 AM IST",tcs,tata consultancy services
170, emkay recommends these it stocks to buy  upgrades tcs  mphasis  ratings ,"30 Nov 2021, 11:23 AM IST",tcs,tata consultancy services
171, stocks to watch  bandhan bank  tcs  kotak ,"03 Nov 2021, 08:04 AM IST",tcs,tata consultancy services
172, infosys over tcs  what brokerages say post q2 results ,"14 Oct 2021, 10:21 AM IST",tcs,tata consultancy services
173, tcs slumps 7  after company misses q2 earnings estimates ,"11 Oct 2021, 10:44 AM IST",tcs,tata consultancy services
174, sensex  nifty open flat  tcs dips 6  post q2 results ,"11 Oct 2021, 10:22 AM IST",tcs,tata consultancy services
175, tcs investors lose   1 lakh cr in minutes as shares slump  should you buy  ,"11 Oct 2021, 09:48 AM IST",tcs,tata consultancy services
176, rbi monetary policy to steer markets  rate sensitive stocks  tcs  zee in focus ,"08 Oct 2021, 08:29 AM IST",tcs,tata consultancy services
177, stocks to watch  nazara technologies  tcs   srei ,"07 Oct 2021, 07:32 AM IST",tcs,tata consultancy services
178, mcap of eight of top 10 firms jumps over   1 90 lakh cr  tcs  ril top gainers ,"29 Aug 2021, 11:33 AM IST",tcs,tata consultancy services
179, infosys  wipro to tcs   why these it stocks are at record high  ,"25 Aug 2021, 02:55 PM IST",tcs,tata consultancy services
180, tcs shares hit record high  market cap zooms to   13 lakh crore ,"17 Aug 2021, 10:24 AM IST",tcs,tata consultancy services
181, mcap of 8 of top 10 valued firms zooms over   1 6 lakh cr  tcs biggest gainer ,"15 Aug 2021, 12:51 PM IST",tcs,tata consultancy services
182, m cap of nine most valued companies jump over   2 22 lakh cr  tcs tops chart ,"08 Aug 2021, 12:27 PM IST",tcs,tata consultancy services
183, it stocks advance for third day  tcs hits 9 month high ,"Feb 17, 2023, 06:00 AM IST",tcs,tata consultancy services
184, chart check  breakout from descending trendline could take tcs towards rs 4 000 level ,"Feb 13, 2023, 11:55 AM IST",tcs,tata consultancy services
185, tata consultancy services scores usd 700 million deal to digitize uk insurer s products ,"Feb 8, 2023, 04:09 PM IST",tcs,tata consultancy services
186, budget 2023  ex deputy vp of hdfc bank recommends these 4 stocks to buy today ,"30 Jan 2023, 01:31 PM IST",hdfcbank,hdfc bank
187, 4 out of top 10 biggies m cap adds   82 481 cr last week  hdfc bank top gainer ,"22 Jan 2023, 11:13 AM IST",hdfcbank,hdfc bank
188, hdfc bank shares a long term  buy   analysts bullish post q3 ,"16 Jan 2023, 09:20 AM IST",hdfcbank,hdfc bank
189, hdfc bank to tata steel  iifl securities recommends these 5 stocks for this week ,"16 Jan 2023, 01:40 PM IST",hdfcbank,hdfc bank
190, stocks to watch  hdfc bank  wipro  tcs  sun pharma  dmart  l t finance ,"16 Jan 2023, 07:31 AM IST",hdfcbank,hdfc bank
191, icici bank vs axis bank vs hdfc bank  which stock to buy at current juncture  ,"05 Jan 2023, 09:00 AM IST",hdfcbank,hdfc bank
192, hdfc bank advances and deposits grow 19  for december quarter ,"04 Jan 2023, 03:49 PM IST",hdfcbank,hdfc bank
193, day trading guide  hdfc bank  federal bank  6 other stocks to buy today   dec 28 ,"28 Dec 2022, 07:01 AM IST",hdfcbank,hdfc bank
194, axis bank  hdfc bank to ril  experts recommend 5 heavyweight stocks to buy ,"26 Dec 2022, 11:26 AM IST",hdfcbank,hdfc bank
195, day trading guide  reliance  federal bank to hdfc bank   6 stocks to buy today ,"20 Dec 2022, 06:02 AM IST",hdfcbank,hdfc bank
196, frenzy like moves in small banks may cool off  hdfc bank  kotak bank to catch up ,"14 Dec 2022, 11:39 AM IST",hdfcbank,hdfc bank
