,Headline,Date,Symbol,Company Name
2802, bharat forge shares hit fresh 52 week high  should you buy  ,"13 Dec 2022, 02:40 PM IST",bharatforg,bharat forge
2803, bharat forge shares fall after q2 prints  should you buy this auto stock  ,"14 Nov 2022, 03:07 PM IST",bharatforg,bharat forge
2804, bharat forge share  experts see 30  upside in defense stock  do you own  ,"17 Mar 2022, 10:40 AM IST",bharatforg,bharat forge
2805, stocks in news  srei infra  vedanta  angel one  bharat forge  railtel ,"Feb 17, 2023, 07:20 AM IST",bharatforg,bharat forge
2806, bharat forge shares fall more than 4  after q3 results ,"Feb 15, 2023, 01:24 PM IST",bharatforg,bharat forge
2807, hot stocks  brokerages view on eicher motors  grasim  bharat forge  nykaa  finolex ,"Feb 15, 2023, 10:38 AM IST",bharatforg,bharat forge
2808, bharat forge to trade sideways to bullish ,"Feb 14, 2023, 09:10 AM IST",bharatforg,bharat forge
2809, stock radar  bharat forge could hit fresh record highs in 2 3 months  here s why ,"Feb 2, 2023, 06:59 AM IST",bharatforg,bharat forge
2810, stock radar  buy bharat forge for a target of rs 1030  says ajit mishra ,"Feb 1, 2023, 10:00 PM IST",bharatforg,bharat forge
2811, bharat forge shares shed nearly 3  after sharp drop in q3 net profit ,"February 14, 2023 02:22 PM IST",bharatforg,bharat forge
2812, fundamental picks  nhpc  powergrid among hdfc securities  top bets ,"26 Jan 2023, 03:56 AM IST",nhpc,nhpc
2813, stocks to watch  lic  adani power  emami  jk cement  nykaa  nhpc ,"14 Nov 2022, 07:37 AM IST",nhpc,nhpc
2814, stocks to watch  reliance  nhpc  vodafone idea  ntpc  irctc ,"29 Aug 2022, 07:41 AM IST",nhpc,nhpc
2815, stocks to watch  paytm  adani  tcs  spicejet  l t  nhpc ,"22 Aug 2022, 07:40 AM IST",nhpc,nhpc
2816, stocks to watch  nhpc  reliance  yes bank  eicher motors ,"02 Jun 2022, 07:34 AM IST",nhpc,nhpc
2817, nhpc s growth drought is finally coming to an end ,"February 10, 2023 09:41 AM IST",nhpc,nhpc
2818, large cap stock astral declares 1 3 bonus shares  posts 15  revenue growth in q3 ,"07 Feb 2023, 07:23 PM IST",astral,astral
2819, stocks in focus  astral  bse ltd  icici pru and more ,"Feb 8, 2023, 08:19 AM IST",astral,astral
2820, stocks in news  airtel  bse  adani green  ambuja cements  astral ,"Feb 8, 2023, 07:05 AM IST",astral,astral
2821, tata elxsi  6 other midcap stocks upgraded to largecap in amfi rejig ,"04 Jan 2023, 11:26 AM IST",tataelxsi,tata elxsi
2822, stocks to watch  adani ports  dabur  l t infotech  acc  tata elxsi ,"15 Jul 2022, 07:43 AM IST",tataelxsi,tata elxsi
2823, adani power  tata elxsi  jspl among stocks added to msci index ,"13 May 2022, 11:11 AM IST",tataelxsi,tata elxsi
2824, stocks to watch  gland pharma  infosys  tata elxsi  welspun ,"21 Apr 2022, 07:41 AM IST",tataelxsi,tata elxsi
2825, multibagger stock  why tata elxsi share price is skyrocketing   explained ,"29 Mar 2022, 09:04 AM IST",tataelxsi,tata elxsi
2826, tata elxsi shares jump 20  in 2 days to all time high  here is why ,"28 Mar 2022, 06:29 PM IST",tataelxsi,tata elxsi
2827, tata elxsi  jspl among 5 stocks on radar for possible inclusion in msci index ,"23 Mar 2022, 09:49 AM IST",tataelxsi,tata elxsi
2828, tata elxsi vs l t technology services  which it stock is better  ," 28 Mar 2022, 06:29 PM IS",tataelxsi,tata elxsi
2829, stocks in focus  ceat  tata elxsi and more ,"Jan 27, 2023, 08:49 AM IST",tataelxsi,tata elxsi
2830, stocks in news  tata motors  dr reddy s  adani enterprises  bajaj fin  vedanta  ceat  tata elxsi ,"Jan 27, 2023, 07:34 AM IST",tataelxsi,tata elxsi
2831, stocks to watch  hul  adani ent  hindustan zinc  ltts  pvr  ausfb ,"20 Jan 2023, 07:29 AM IST",ltts,l & technology services
2832, stocks to watch  hcl tech  hfcl  icici lombard  polycab  jupiter wagons ,"19 Oct 2022, 07:54 AM IST",polycab,polycab india
2833, polycab to havells  experts bet high on these stocks after copper price tumble ,"06 Jul 2022, 09:28 AM IST",polycab,polycab india
2834, cash market   polycab is showing good strength ,"February 10, 2023 06:57 AM IST",polycab,polycab india
2835, auto ancillary stock cummins india declares dividend of   12  pat up 50  in q3 ,"08 Feb 2023, 09:59 PM IST",cumminsind,cummins india
2836, big movers on d st  what should investors do with cummins india  kpit tech and m m financial  ,"Feb 10, 2023, 08:52 AM IST",cumminsind,cummins india
2837, cummins india jumps 10  to hit record high on q3 results  dividend announcement ,"Feb 9, 2023, 12:43 PM IST",cumminsind,cummins india
2838, buzzing stocks  adani power  cummins india  hindalco industries  and others in news today ,"February 09, 2023 06:48 AM IST",cumminsind,cummins india
2839, bandhan bank q3 results muted  what should investors do  ,"22 Jan 2023, 04:41 PM IST",bandhanbnk,bandhan bank
2840, bandhan bank shares could rerate as  valuations attractive   upto 37  rally seen ,"09 Jan 2023, 01:22 PM IST",bandhanbnk,bandhan bank
2841, stocks to watch  sula vineyards  reliance  paytm  adani ent  bandhan bank ,"22 Dec 2022, 07:33 AM IST",bandhanbnk,bandhan bank
2842, bandhan bank share price up 2  on receiving   916 crore credit from govt ,"13 Dec 2022, 11:53 AM IST",bandhanbnk,bandhan bank
2843, bandhan bank shares climb over 9  in 5 days  experts suggest buying ,"04 Dec 2022, 09:40 PM IST",bandhanbnk,bandhan bank
2844, are bandhan bank and m m stocks next itc of their segments   explained ,"05 Nov 2022, 09:58 AM IST",bandhanbnk,bandhan bank
2845, bandhan bank shares near 52 week low but nifty bank close to 52 week high  buy  ,"04 Nov 2022, 10:00 AM IST",bandhanbnk,bandhan bank
2846, bandhan bank nosedives 7  in 1 day  should you buy the stock at dip  ,"26 Sep 2022, 10:38 PM IST",bandhanbnk,bandhan bank
2847, stocks to watch   tcs  wipro  bandhan bank  dmart  hdfc ,"11 Jul 2022, 07:30 AM IST",bandhanbnk,bandhan bank
2848, why icici bank  bandhan bank are jefferies  top bank stock picks post rbi policy ,"11 Apr 2022, 09:36 AM IST",bandhanbnk,bandhan bank
2849, hdfc offloads over 3  stake in bandhan bank for   1 522 cr via block deal ,"09 Apr 2022, 06:15 AM IST",bandhanbnk,bandhan bank
2850, stocks to watch  zee  bandhan bank  titan  maruti  hdfc bank  godrej consumer ,"07 Apr 2022, 08:04 AM IST",bandhanbnk,bandhan bank
2851, bandhan bank shares up 23  in a month  brokerages see more upside ,"06 Apr 2022, 10:27 AM IST",bandhanbnk,bandhan bank
2852, stocks to watch  tata steel  marico  bandhan bank  tvs motor ,"06 Apr 2022, 08:01 AM IST",bandhanbnk,bandhan bank
2853, bandhan bank shares surge over 7  today  why jefferies has  buy  tag ,"15 Mar 2022, 10:03 AM IST",bandhanbnk,bandhan bank
2854, stocks to watch  bandhan bank  tcs  kotak ,"03 Nov 2021, 08:04 AM IST",bandhanbnk,bandhan bank
2855, stocks to watch  kfin technologies  tata power  jsw energy  uco bank  airtel ,"29 Dec 2022, 07:28 AM IST",ucobank,uco bank
2856, iob to uco bank  4 banking stocks hit 52 week high despite weakness in markets ,"16 Dec 2022, 02:13 PM IST",ucobank,uco bank
2857, stocks to watch  adani enterprises  hero motocorp  indian bank  uco bank  vi ,"04 Nov 2022, 07:56 AM IST",ucobank,uco bank
2858, uco bank shares surge post exit from pca framework  should you buy  ,"09 Sep 2021, 11:48 AM IST",ucobank,uco bank
2859, markets likely to be wobbly  textile stocks  uco bank in focus ,"09 Sep 2021, 08:36 AM IST",ucobank,uco bank
2860, stocks to watch  axis bank  sbi life  hero motocorp  jspl  uco bank  ril ,"09 Sep 2021, 09:09 AM IST",ucobank,uco bank
2861, stocks to watch  coal india  paytm  mrf  indigo  hcl  voltas ,"09 Nov 2022, 07:58 AM IST",mrf,mrf
2862, mrf misses q2 profit estimates as input costs weigh  declares interim dividend ,"08 Nov 2022, 02:24 PM IST",mrf,mrf
2863, stocks to watch  hero motocorp  zomato  m m  mrf  hindalco ,"10 Feb 2022, 07:43 AM IST",mrf,mrf
2864, mrf declares 2nd interim dividend of rs 3 per share  check record date   other details here ,"Feb 9, 2023, 02:39 PM IST",mrf,mrf
2865, pfc shares trade ex dividend today  stock falls ,"01 Sep 2022, 10:49 AM IST",pfc,power finance corporation
2866, stocks to watch  hindalco  lupin  pfc  gail ,"14 Mar 2022, 07:31 AM IST",pfc,power finance corporation
2867, stocks to watch  tata steel  zee  pfc  sun pharma  ongc ,"12 Nov 2021, 07:10 AM IST",pfc,power finance corporation
2868, stocks to watch  hdfc ltd  shriram finance  lic  ongc  coal india ,"26 Dec 2022, 07:37 AM IST",shriramfin,shriram finance
2869, shriram finance declares   15 per share dividend  record date fixed ,"25 Dec 2022, 03:50 PM IST",shriramfin,shriram finance
2870, it stocks mindtree  mphasis trade ex dividend today ,"05 Jul 2022, 10:55 AM IST",mphasis,mphasis
2871, mindtree vs mphasis  which it stock is better  ,"21 Mar 2022, 04:36 PM IST",mphasis,mphasis
2872, emkay recommends these it stocks to buy  upgrades tcs  mphasis  ratings ,"30 Nov 2021, 11:23 AM IST",mphasis,mphasis
2873, stock radar  buy mphasis for a target of rs 2240  says shivangi sarda ,"Feb 12, 2023, 10:00 PM IST",mphasis,mphasis
2874, idfc first bank share price jumps after q3fy23 results  buy  sell or hold  ,"23 Jan 2023, 10:45 AM IST",idfcfirstb,idfc first bank
2875, ashok leyland and idfc first bank among top 9 midcap picks by motilal oswal ,"10 Jan 2023, 09:58 AM IST",idfcfirstb,idfc first bank
2876, yes bank  pnb to idfc first bank  experts bullish on these below   100 stocks ,"09 Jan 2023, 08:06 AM IST",idfcfirstb,idfc first bank
2877, idfc first bank shares rise 85  in 6 months  expert predict 100  return in 2023 ,"31 Dec 2022, 08:08 AM IST",idfcfirstb,idfc first bank
2878, idfc first bank stock gains over 101  in 4 months  should you buy after q2  ,"24 Oct 2022, 11:45 PM IST",idfcfirstb,idfc first bank
2879, idfc first bank shares hit 52 week high  yes bank share rises 10  in 2 days ,"06 Oct 2022, 11:51 AM IST",idfcfirstb,idfc first bank
2880, idfc first bank near year high  yes bank jumps  what banking shares are surging ,"04 Oct 2022, 11:11 AM IST",idfcfirstb,idfc first bank
2881, idfc first bank shares rally after highest ever profit in q1  should you buy  ,"01 Aug 2022, 10:25 AM IST",idfcfirstb,idfc first bank
2882, stocks to watch  sbi  idfc first bank  dish tv  hul  powergrid  indigo ,"31 Dec 2021, 08:01 AM IST",idfcfirstb,idfc first bank
2883, idfc first bank jumps over 5  after clarification on exposure to adani group companies ,"Feb 2, 2023, 02:04 PM IST",idfcfirstb,idfc first bank
2884, stocks to watch  hul  asian paints  bajaj auto  tata communications ,"20 Jan 2022, 08:02 AM IST",tatacomm,tata communications
2885, stocks to watch  gsk  raymond  greenply  aditya birla capital ,"17 May 2022, 07:42 AM IST",abcapital,aditya birla capital
2886, state bank of india  sbi  to raise   10 000 crore through infrastructure bond ,"29 Dec 2022, 12:07 PM IST",bankindia,bank of india
2887, federal bank  canara bank to bank of india  5 bank shares hit 52 week high today ,"04 Nov 2022, 02:35 PM IST",bankindia,bank of india
2888, stocks to watch  ongc  reliance  bank of india  adani green energy  itc ,"03 Aug 2022, 07:41 AM IST",bankindia,bank of india
2889, stocks to watch  reliance  itc  zomato  union bank of india  upl ,"02 Aug 2022, 07:30 AM IST",bankindia,bank of india
2890, state bank of india  sbi  to soon turn ex dividend stock  details here ,"21 May 2022, 07:45 AM IST",bankindia,bank of india
2891, adani green market cap is now more than state bank of india  sbi  ,"09 May 2022, 09:34 AM IST",bankindia,bank of india
2892, stocks to watch  bank of india  tech mahindra  eveready  gmdc ,"26 Apr 2022, 08:02 AM IST",bankindia,bank of india
2893, stocks to watch  infosys  tata steel  union bank of india  tvs motor ,"13 Apr 2022, 07:50 AM IST",bankindia,bank of india
2894, sbi shares  emkay global sees 40  rise in state bank of india stock in 12 month ,"26 Mar 2022, 01:50 PM IST",bankindia,bank of india
2895, stocks to watch  bank of india  airtel  cadila  frl  zee  maruti suzuki ,"01 Oct 2021, 07:15 AM IST",bankindia,bank of india
2896, climate concerns moving centre stage at reserve bank of india ,"Feb 9, 2023, 06:32 AM IST",bankindia,bank of india
2897, reserve bank of india asks country s banks for details of exposure to adani group  say sources ,"Feb 2, 2023, 11:05 AM IST",bankindia,bank of india
2898, cash market   a low risk trade in bank of india ,"February 08, 2023 06:27 AM IST",bankindia,bank of india
2899, nmdc prospects improve on earnings upgrade post rollback of export duties ,"21 Nov 2022, 03:33 PM IST",nmdc,nmdc
2900, nmdc shares trade ex demerger  should you buy  ,"28 Oct 2022, 12:23 PM IST",nmdc,nmdc
2901, nmdc shares rally 15  as stock trades ex demerger ,"27 Oct 2022, 11:45 AM IST",nmdc,nmdc
2902, edelweiss sees nmdc  jsw steel benefit in medium term  check its recommendations ,"27 Aug 2022, 12:47 PM IST",nmdc,nmdc
2903, stocks to watch  hdfc twins  indigo  glenmark  hero moto  nmdc ,"04 Jul 2022, 07:56 AM IST",nmdc,nmdc
2904, nmdc shares slump 5  on iron ore price tumble  should you buy  sell or hold  ,"15 Feb 2022, 12:19 PM IST",nmdc,nmdc
2905, ongc to nmdc  here are 5 stocks value investors should closely track ,"29 Nov 2021, 10:40 AM IST",nmdc,nmdc
2906, capacity ramp up  improving realisation augur well for nmdc ,"Feb 17, 2023, 06:24 AM IST",nmdc,nmdc
2907, stocks in news  vodafone idea  biocon  ongc  nmdc  grasim  nbcc ,"Feb 15, 2023, 07:12 AM IST",nmdc,nmdc
2908, indian bank stocks  continue to record high as balance sheet strengthens ,"10 Nov 2022, 01:05 PM IST",indianb,indian bank
2909, stocks to watch  adani enterprises  hero motocorp  indian bank  uco bank  vi ,"04 Nov 2022, 07:56 AM IST",indianb,indian bank
2910, jefferies ups target price of this indian bank stock  suggests as its top pick ,"24 Aug 2022, 01:34 PM IST",indianb,indian bank
2911, stocks to watch  indian oil  bank of baroda  indian bank  zee entertainment ,"01 Aug 2022, 07:36 AM IST",indianb,indian bank
2912, goldman sachs sees this indian bank shares hitting  100 billion market cap ,"06 Jul 2022, 02:05 PM IST",indianb,indian bank
2913, stocks to watch  gsk  sbi  tvs motor  indian bank  p sb ,"07 Feb 2022, 07:43 AM IST",indianb,indian bank
2914, how dalmia bharat benefits from acquiring jaypee s assets for   5 663 cr ,"13 Dec 2022, 11:05 AM IST",dalbharat,dalmia bharat
2915, from tech mahindra to dalmia bharat  11 stocks to trade ex dividend this week ,"06 Nov 2022, 02:54 PM IST",dalbharat,dalmia bharat
2916, dalmia bharat sugar fixes record date for dividend  check key takeaways ,"14 Jul 2022, 10:45 PM IST",dalbharat,dalmia bharat
2917, paytm share price  another global brokerage  double  upgrades stock s rating ,"08 Feb 2023, 01:25 PM IST",paytm,one 97 communications
2918, paytm shares rally for third straight trading day  what s driving the stock  ,"08 Feb 2023, 09:44 AM IST",paytm,one 97 communications
2919, paytm share price rallies for 2nd day in row  hits 20  upper circuit  buy sell  ,"07 Feb 2023, 12:15 PM IST",paytm,one 97 communications
2920, paytm shares jump over 7  after surprise q3 operating profit  narrowing loss ,"06 Feb 2023, 10:50 AM IST",paytm,one 97 communications
2921, mutual funds  retail investors take a liking to paytm shares  raise stakes in q3 ,"21 Jan 2023, 09:07 PM IST",paytm,one 97 communications
2922, stocks to watch  ongc  ntpc  siemens  dabur  paytm  bom ,"17 Jan 2023, 07:28 AM IST",paytm,one 97 communications
2923, morgan stanley buys paytm shares despite stake sale by alibaba ,"13 Jan 2023, 02:04 PM IST",paytm,one 97 communications
2924, paytm shares nosedive 6  on alibaba block deal  but there s a catch ,"12 Jan 2023, 07:31 PM IST",paytm,one 97 communications
2925, stocks to watch  tcs  hdfc  ongc  jsw steel  paytm  tata motors ,"10 Jan 2023, 07:29 AM IST",paytm,one 97 communications
2926, bandhan  paytm and 4 other stocks downgraded to midcaps in amfi rejig ,"04 Jan 2023, 04:03 PM IST",paytm,one 97 communications
2927, from paytm to biocon  12 nifty100 stocks are biggest wealth destroyers in 2022 ,"27 Dec 2022, 04:45 PM IST",paytm,one 97 communications
2928, stocks to watch  sula vineyards  reliance  paytm  adani ent  bandhan bank ,"22 Dec 2022, 07:33 AM IST",paytm,one 97 communications
2929, nykaa  paytm s surprise corporate actions spur scrutiny ," 16 Dec 2022, 10:59 AM IS",paytm,one 97 communications
2930, stocks to watch  paytm  hdfc  vedanta  adani transmission  tata power ,"14 Dec 2022, 07:38 AM IST",paytm,one 97 communications
2931, paytm announces   850 crore share buyback ,"13 Dec 2022, 09:44 PM IST",paytm,one 97 communications
2932, some analysts question paytm s surprise buyback plan ,"13 Dec 2022, 02:08 PM IST",paytm,one 97 communications
2933, paytm shares rally ahead of buyback proposal  what to expect  ,"13 Dec 2022, 09:55 AM IST",paytm,one 97 communications
2934, paytm board to consider buyback of shares today  details here ,"13 Dec 2022, 08:49 AM IST",paytm,one 97 communications
2935, stocks to watch  paytm  dalmia  icici bank  tata motors  hcl tech ,"13 Dec 2022, 07:44 AM IST",paytm,one 97 communications
2936, paytm board must address concerns before buyback  iias ,"13 Dec 2022, 06:34 AM IST",paytm,one 97 communications
2937, paytm board to weigh buyback tomorrow after historic slump ,"12 Dec 2022, 03:25 PM IST",paytm,one 97 communications
2938, will paytm buyback clear clouds on looming concerns  here s what experts say ,"12 Dec 2022, 02:59 PM IST",paytm,one 97 communications
2939, paytm can t use ipo proceeds for buyback  firm s liquidity to be used  report ,"11 Dec 2022, 11:20 AM IST",paytm,one 97 communications
2940, paytm shares climb the most in a week on buyback proposal ,"09 Dec 2022, 10:02 AM IST",paytm,one 97 communications
2941, stocks to  watch  paytm  hul  yes bank  sun pharma  ptc india ,"09 Dec 2022, 07:33 AM IST",paytm,one 97 communications
2942, paytm board to consider share buyback next week ,"08 Dec 2022, 09:50 PM IST",paytm,one 97 communications
2943, paytm shares rise 17  in 5 days  potential to reach   1 100   1 300 ahead ,"04 Dec 2022, 06:11 AM IST",paytm,one 97 communications
2944, stocks to watch  paytm  adani transmission  hero motocorp  coal india  ongc ,"28 Nov 2022, 07:40 AM IST",paytm,one 97 communications
2945, paytm is performing much better than payu  citi bets to buy ,"27 Nov 2022, 03:56 PM IST",paytm,one 97 communications
2946, from the biggest ipo to rock bottom  why is paytm sliding  ,"24 Nov 2022, 03:54 PM IST",paytm,one 97 communications
2947, paytm slips 11  on macquarie s risk alert on ril financial foray ,"23 Nov 2022, 01:06 AM IST",paytm,one 97 communications
2948, paytm hits record low after macquarie flags risks from ambani s financial foray ,"22 Nov 2022, 02:50 PM IST",paytm,one 97 communications
2949, pre ipo investors are selling paytm shares  but who are buying them  ,"18 Nov 2022, 01:27 PM IST",paytm,one 97 communications
2950, paytm share price tumbles nearly 10  as softbank seeks to cut stake ,"17 Nov 2022, 09:53 AM IST",paytm,one 97 communications
2951, stocks to watch  sbi  paytm  tata motors  coal india  hindustan zinc ,"17 Nov 2022, 07:38 AM IST",paytm,one 97 communications
2952, paytm investors seem not in a hurry to sell  analysts ,"16 Nov 2022, 09:49 AM IST",paytm,one 97 communications
2953, paytm shares rise as q2 revenue improves  should you buy  ,"09 Nov 2022, 10:00 AM IST",paytm,one 97 communications
2954, stocks to watch  coal india  paytm  mrf  indigo  hcl  voltas ,"09 Nov 2022, 07:58 AM IST",paytm,one 97 communications
2955, stocks to watch  electronics mart  hdfc bank  bajaj auto  paytm  zee ,"17 Oct 2022, 07:46 AM IST",paytm,one 97 communications
2956, paytm shares rise 32  from may record lows  jp morgan sees stock hitting   1k ,"04 Oct 2022, 10:23 PM IST",paytm,one 97 communications
2957, paytm share price  jp morgan sees big upside in one97 communications stocks ,"01 Oct 2022, 10:05 AM IST",paytm,one 97 communications
2958, this unicorn achieved what paytm  zomato and policy bazaar couldn t ,"27 Sep 2022, 09:19 AM IST",paytm,one 97 communications
2959, stocks to watch  bank of baroda  paytm  spicejet  reliance  l t ,"05 Sep 2022, 07:36 AM IST",paytm,one 97 communications
2960, stocks to watch  paytm  adani  tcs  spicejet  l t  nhpc ,"22 Aug 2022, 07:40 AM IST",paytm,one 97 communications
2961, why rbi s digital lending norms may not impact paytm  goldman sachs explains ,"11 Aug 2022, 08:01 PM IST",paytm,one 97 communications
2962, paytm shares surge to near 6 month high post q1  should you buy  sell or hold  ,"08 Aug 2022, 01:13 PM IST",paytm,one 97 communications
2963, stocks to watch  sbi  bpcl  paytm  tata motors  shipping corp ,"08 Aug 2022, 08:00 AM IST",paytm,one 97 communications
2964, why did paytm shares fall after 4 days winning streak ,"05 Aug 2022, 04:12 PM IST",paytm,one 97 communications
2965, paytm shares rise over 22  in 4 days ahead of q1 results  should you buy  ,"04 Aug 2022, 09:45 PM IST",paytm,one 97 communications
2966, zomato  paytm to policybazaar  investors lost whopping money in these tech ipos ,"30 Jul 2022, 11:49 AM IST",paytm,one 97 communications
2967, paytm  nykaa  other newly listed stocks trade way below their record highs ,"08 Jul 2022, 12:12 PM IST",paytm,one 97 communications
2968, paytm share price surges on fourth straight day  stock rises 24  in two weeks ,"28 Jun 2022, 11:39 AM IST",paytm,one 97 communications
2969, paytm shares surge after q4 results  what should investors do  ,"23 May 2022, 10:39 AM IST",paytm,one 97 communications
2970, stocks to watch  paytm  bhel  sun pharma  jk tyre ,"23 May 2022, 08:02 AM IST",paytm,one 97 communications
2971, paytm share price  retail investors  canada pension plan raise stake in q4 ,"22 Apr 2022, 11:29 AM IST",paytm,one 97 communications
2972, stocks to watch  hcl tech  itc  barbeque nation  paytm ,"22 Apr 2022, 09:16 AM IST",paytm,one 97 communications
2973, paytm shares regain   700 levels  rises 16  in two sessions ,"12 Apr 2022, 10:28 AM IST",paytm,one 97 communications
2974, paytm share price rises over 20  in one week  what analysts say ,"07 Apr 2022, 10:37 AM IST",paytm,one 97 communications
2975, how investors could have avoided losses in paytm and zomato ,"29 Mar 2022, 05:21 PM IST",paytm,one 97 communications
2976, stocks to watch  infosys  tcs  paytm  vodafone idea  adani ports ,"23 Mar 2022, 07:56 AM IST",paytm,one 97 communications
2977, paytm  naukri to irctc  these 5 stocks bleed up to 58  this year ,"22 Mar 2022, 11:00 AM IST",paytm,one 97 communications
2978, stocks to watch  paytm  zomato  punjab national bank ,"16 Mar 2022, 07:34 AM IST",paytm,one 97 communications
2979, stocks to watch  ril  wipro  hdfc bank  paytm ,"15 Mar 2022, 07:36 AM IST",paytm,one 97 communications
2980, paytm shares slump to all time low after rbi s curbs on payment bank ,"14 Mar 2022, 09:45 AM IST",paytm,one 97 communications
2981, zomato  paytm  nykaa crushed in volatile market  but this tech stock is solid ,"10 Mar 2022, 08:19 PM IST",paytm,one 97 communications
2982, paytm rebounds 9  in 2 days from life time low  good time to buy  ,"10 Mar 2022, 01:54 PM IST",paytm,one 97 communications
2983, zomato  paytm  nykaa to get included in nifty next 50 index  details here ,"25 Feb 2022, 11:34 AM IST",paytm,one 97 communications
2984, paytm shares  another brokerage gives  buy  tag with over 64  upside target ,"21 Feb 2022, 10:22 AM IST",paytm,one 97 communications
2985, invested in zomato  paytm  nykaa shares  what to do as they hit all time lows ,"16 Feb 2022, 12:30 PM IST",paytm,one 97 communications
2986, should you buy paytm shares  buy calls outnumber sell for first time since ipo ,"08 Feb 2022, 12:14 PM IST",paytm,one 97 communications
2987, paytm shares rise after q3 results  should you buy  ,"07 Feb 2022, 11:54 AM IST",paytm,one 97 communications
2988, stocks to watch  indigo  paytm  tata steel  eveready ,"04 Feb 2022, 08:06 AM IST",paytm,one 97 communications
2989, paytm  zomato  nykaa shares drop to record low  is the  unicorn  craze over  ,"28 Jan 2022, 10:37 AM IST",paytm,one 97 communications
2990, zomato  paytm shares fall to lowest since listing  what should investors do  ,"24 Jan 2022, 10:28 AM IST",paytm,one 97 communications
2991, paytm shares hit an all time low today  should you buy the stock now  ,"19 Jan 2022, 02:45 PM IST",paytm,one 97 communications
2992, paytm shares rebound today after falling to half of ipo issue price ,"14 Jan 2022, 11:39 AM IST",paytm,one 97 communications
2993, paytm shares down 47  from issue price  should you start buying now  ,"11 Jan 2022, 12:40 PM IST",paytm,one 97 communications
2994, stocks to watch  paytm  axis bank  fortis healthcare  mindspace reit  timex ,"11 Jan 2022, 08:11 AM IST",paytm,one 97 communications
2995, paytm shares  after morgan stanley  another top broker assigns  overweight  tag ,"04 Jan 2022, 11:20 AM IST",paytm,one 97 communications
2996, stocks to watch  bajaj finance  ntpc  paytm  federal bank  bpcl ,"30 Dec 2021, 07:40 AM IST",paytm,one 97 communications
2997,  fino bank s shares suffered due to paytm ipo debacle  ,"28 Dec 2021, 06:23 AM IST",paytm,one 97 communications
2998, battered paytm receives its first bullish rating from a top broker ,"23 Dec 2021, 12:21 AM IST",paytm,one 97 communications
2999, stocks to watch  itc  axis bank  paytm  airtel  nbfcs ,"15 Dec 2021, 08:05 AM IST",paytm,one 97 communications
3000, india stock markets seen volatile  paytm  dr reddy s in focus ,"10 Dec 2021, 08:14 AM IST",paytm,one 97 communications
3001, paytm share price falls sharply post q2 results  then recover ,"29 Nov 2021, 10:31 AM IST",paytm,one 97 communications
3002, markets may see a rebound  ril  telcos  paytm in focus ,"29 Nov 2021, 07:59 AM IST",paytm,one 97 communications
3003, stocks to watch  paytm  reliance  tata chemicals  adani green ,"29 Nov 2021, 07:47 AM IST",paytm,one 97 communications
3004, jm financial initiates sell rating on paytm  cuts target price to   1 240 a share ,"27 Nov 2021, 02:02 PM IST",paytm,one 97 communications
3005, paytm shares rollercoaster ride continues  all eyes on quarterly earnings ,"26 Nov 2021, 12:50 PM IST",paytm,one 97 communications
