,Headline,Date,Symbol,Company Name
1388, dividend paying stock  coal india s record date for final dividend this week ,"10 Aug 2022, 02:11 PM IST",coalindia,coal india
1389, from coal india to varun beverages  13 stocks to turn ex dividend next week ,"07 Aug 2022, 05:53 PM IST",coalindia,coal india
1390, board of maharatna company coal india fixes record date for dividend ,"31 Jul 2022, 10:32 PM IST",coalindia,coal india
1391, stocks to watch  hul  ril  coal india  upl  airtel ,"01 Jul 2022, 07:26 AM IST",coalindia,coal india
1392, stocks to watch  vodafone idea  gail  dcb bank  sbi  coal india ,"23 Jun 2022, 07:35 AM IST",coalindia,coal india
1393, stocks to watch  icici bank  axis bank  coal india  cipla  dilip buildcon ,"20 Jun 2022, 07:56 AM IST",coalindia,coal india
1394, stocks to watch  reliance industries  m m  lic  coal india  bpcl  jindal steel ,"13 Jun 2022, 07:55 AM IST",coalindia,coal india
1395, stocks to watch  coal india  indigo  vodafone idea  infosys ,"26 May 2022, 07:48 AM IST",coalindia,coal india
1396, stocks to watch  ntpc  dr reddy s  grasim industries  indian hotels  coal india ,"25 May 2022, 07:58 AM IST",coalindia,coal india
1397, stocks to watch  acc  l t infotech  p sb  coal india ,"20 Apr 2022, 07:41 AM IST",coalindia,coal india
1398, stocks to watch  nazara tech  coal india  tube investments ,"07 Mar 2022, 07:36 AM IST",coalindia,coal india
1399, stocks to watch  sbi  coal india  future retail  eicher motors  telcos ,"14 Feb 2022, 08:00 AM IST",coalindia,coal india
1400, sensex jumps 500 pts as it   auto rally  bajaj finserv  coal india top gainers ,"09 Feb 2022, 10:40 AM IST",coalindia,coal india
1401, sensex rises 500 pts  nifty tops 17 5k  eicher motors  coal india surge 3  ,"03 Jan 2022, 10:42 AM IST",coalindia,coal india
1402, coal india shares slip ahead of record date for interim dividend ,"06 Dec 2021, 10:29 AM IST",coalindia,coal india
1403, stocks to watch  maruti  future retail  coal india  ntpc ,"01 Dec 2021, 07:31 AM IST",coalindia,coal india
1404, stocks to watch  coal india  cadila  union bank  hero motocorp ,"25 Nov 2021, 07:33 AM IST",coalindia,coal india
1405, markets likely to be volatile  hero motocorp  coal india  vodafone in focus ,"12 Nov 2021, 09:14 AM IST",coalindia,coal india
1406, stocks in news  adani enterprises  sun pharma  vodafone idea  coal india ,"Feb 1, 2023, 07:06 AM IST",coalindia,coal india
1407, stocks to watch  adani total  airtel  adani power  l t  tata steel ,"09 Feb 2023, 07:20 AM IST",tatasteel,tata steel
1408, tata steel shares  should you buy the metal stock after surprise loss in q3  ,"07 Feb 2023, 08:02 AM IST",tatasteel,tata steel
1409, stocks to watch  tata steel  adani transmission  p g  lic housing  cil ,"07 Feb 2023, 07:26 AM IST",tatasteel,tata steel
1410, hdfc bank to tata steel  iifl securities recommends these 5 stocks for this week ,"16 Jan 2023, 01:40 PM IST",tatasteel,tata steel
1411, from hindalco  tata steel to jspl  which metal stocks to buy  sell and hold  ,"11 Jan 2023, 04:12 PM IST",tatasteel,tata steel
1412, tata steel  hindalco among 4 metal stocks to  buy   this one to  sell  ,"04 Jan 2023, 09:07 AM IST",tatasteel,tata steel
1413, tata steel  hindalco upgraded to buy as jefferies now positive on indian metals ,"02 Jan 2023, 09:07 AM IST",tatasteel,tata steel
1414, tata steel  jspl  sail  jsw steel  which metal stocks to buy hold  ,"30 Dec 2022, 09:31 AM IST",tatasteel,tata steel
1415, sanjiv bhasin stock picks for this week  tata steel  ongc        ,"04 Dec 2022, 12:29 PM IST",tatasteel,tata steel
1416, stocks to watch  archean chemicals  five star business  zomato  ongc  tata steel ,"24 Nov 2022, 07:36 AM IST",tatasteel,tata steel
1417, stocks to watch  airtel  axis bank  tata steel  l t  supreme ind  adani power ,"01 Nov 2022, 07:56 AM IST",tatasteel,tata steel
1418, stocks to watch  infosys  mindtree  reliance  hdfc life  tata steel ,"14 Oct 2022, 07:32 AM IST",tatasteel,tata steel
1419, stocks to watch  zee entertainment  spicejet  tata steel  jsw energy  hdfc bank ,"06 Oct 2022, 07:49 AM IST",tatasteel,tata steel
1420, stocks to watch  maruti suzuki  adani green  marico  britannia  tata steel ,"04 Oct 2022, 07:34 AM IST",tatasteel,tata steel
1421, tata group s metal stock hits lower circuit after tata steel merger news ,"23 Sep 2022, 01:12 PM IST",tatasteel,tata steel
1422, stock to watch  tamilnad mercantile bank  tata steel  vedanta  adani wilmar ,"15 Sep 2022, 07:46 AM IST",tatasteel,tata steel
1423, stocks to watch  adani enterprises  jsw steel  tata steel  axis bank  hcl ,"05 Aug 2022, 07:30 AM IST",tatasteel,tata steel
1424, tata steel shares rally for second day after stock split ,"29 Jul 2022, 11:13 AM IST",tatasteel,tata steel
1425, tata steel shares  should you buy  sell or hold after stock split ,"28 Jul 2022, 10:31 AM IST",tatasteel,tata steel
1426, tata steel shares surge as stock trades ex split  what investors should know ,"28 Jul 2022, 09:16 AM IST",tatasteel,tata steel
1427, tata steel shares to turn ex split tomorrow  should you invest  ,"27 Jul 2022, 09:57 PM IST",tatasteel,tata steel
1428, stocks to watch  tech mahindra  axis bank  tata steel  glaxosmithkline ,"26 Jul 2022, 07:38 AM IST",tatasteel,tata steel
1429, tata steel shares to turn ex split this week  10 key points ,"27 Jul 2022, 09:29 PM IST",tatasteel,tata steel
1430, tata steel shares to trade ex split this week  record date  key details to know ,"25 Jul 2022, 10:08 AM IST",tatasteel,tata steel
1431, tata steel s record date for 1 10 stock split next week  details inside ,"22 Jul 2022, 11:35 AM IST",tatasteel,tata steel
1432, board of tata steel fixes record date for stock split  check key takeaways ,"08 Jul 2022, 11:13 PM IST",tatasteel,tata steel
1433, icici securities sees good upside for tata steel in 3 months  should you buy  ,"08 Jul 2022, 06:30 PM IST",tatasteel,tata steel
1434, stocks to watch  hdfc  tata steel long  kotak mahindra bank  indusind bank  tcs ,"05 Jul 2022, 07:50 AM IST",tatasteel,tata steel
1435, stocks to watch  sbi  tata steel  route mobile  j k bank ,"29 Jun 2022, 07:32 AM IST",tatasteel,tata steel
1436, stocks to watch  ril  ongc  yes bank  lic  tata steel  icici pru life ,"21 Jun 2022, 07:57 AM IST",tatasteel,tata steel
1437, tata steel shares turn ex dividend today  5 things you should know ,"15 Jun 2022, 08:29 AM IST",tatasteel,tata steel
1438, tata steel associate stock hits upper circuit on fourth day in a row ,"14 Jun 2022, 01:50 PM IST",tatasteel,tata steel
1439, tata steel shares near 52 week low  good time to buy after 26  dip in 2 months  ,"10 Jun 2022, 12:54 PM IST",tatasteel,tata steel
1440, tata steel  sail  jsw steel shares hit lower circuit  details here ,"23 May 2022, 09:59 AM IST",tatasteel,tata steel
1441, sail  nalco to tata steel  why metal stocks are nosediving   explained ,"13 May 2022, 09:55 AM IST",tatasteel,tata steel
1442, tata steel shares are axis securities  top stock pick for the week ,"09 May 2022, 01:50 PM IST",tatasteel,tata steel
1443, tata steel shares surge post q4  stock split announcement  should you buy  ,"04 May 2022, 09:18 AM IST",tatasteel,tata steel
1444, stocks to watch  tata steel  titan  future retail  spicejet  kotak mahindra bank ,"04 May 2022, 08:00 AM IST",tatasteel,tata steel
1445, sensex tanks 600 pts as metal  fmcg stocks bleed  tata steel  hul top losers ,"25 Apr 2022, 11:21 AM IST",tatasteel,tata steel
1446, sensex trades flat  tata steel  reliance  sbi among top gainers ,"19 Apr 2022, 11:23 AM IST",tatasteel,tata steel
1447, sensex trades higher  nifty above 17 600  bharti airtel   tata steel top gainers ,"13 Apr 2022, 10:30 AM IST",tatasteel,tata steel
1448, stocks to watch  infosys  tata steel  union bank of india  tvs motor ,"13 Apr 2022, 07:50 AM IST",tatasteel,tata steel
1449, sail to tata steel  why steel stocks are skyrocketing   explained ,"11 Apr 2022, 12:51 PM IST",tatasteel,tata steel
1450, stocks to watch  tcs  tata motors  tata steel  axis bank  vodafone idea ,"11 Apr 2022, 07:55 AM IST",tatasteel,tata steel
1451, tata steel  jsw steel among top metal stock picks by phillipcapital ,"07 Apr 2022, 03:21 PM IST",tatasteel,tata steel
1452, stocks to watch  tata steel  marico  bandhan bank  tvs motor ,"06 Apr 2022, 08:01 AM IST",tatasteel,tata steel
1453, stocks to watch  axis bank  reliance  tata steel  godrej properties ,"31 Mar 2022, 07:47 AM IST",tatasteel,tata steel
1454, sensex trades flat  tata steel  maruti   hdfc bank among top losers ,"08 Mar 2022, 10:45 AM IST",tatasteel,tata steel
1455, sensex trades on a volatile note  tata steel  l t and icici bank top losers ,"16 Feb 2022, 11:00 AM IST",tatasteel,tata steel
1456, sensex flat tracking weak global cues  tata steel  hindalco top gainers ,"04 Feb 2022, 10:47 AM IST",tatasteel,tata steel
1457, stocks to watch  indigo  paytm  tata steel  eveready ,"04 Feb 2022, 08:06 AM IST",tatasteel,tata steel
1458, d street cheers budget as sensex zooms 848 pts  tata steel  sun pharma jump 7  ,"01 Feb 2022, 04:51 PM IST",tatasteel,tata steel
1459, sensex trades flat  tata steel gains 4  while wipro dips 5  post q3 results ,"13 Jan 2022, 10:37 AM IST",tatasteel,tata steel
1460, sensex jumps 700 points as metal  it stocks rally  tata steel   hcl tech surge ,"21 Dec 2021, 10:29 AM IST",tatasteel,tata steel
1461, sensex recoups early losses as energy  metal stocks rally  ril  tata steel jump ,"29 Nov 2021, 10:44 AM IST",tatasteel,tata steel
1462, stocks to watch  tata steel  zee  pfc  sun pharma  ongc ,"12 Nov 2021, 07:10 AM IST",tatasteel,tata steel
1463, india stock markets may remain under pressure  tata steel  zomato  zee in focus ,"11 Nov 2021, 08:38 AM IST",tatasteel,tata steel
1464, sensex lower tracking global cues  tata steel  indusind bank top losers ,"10 Nov 2021, 11:07 AM IST",tatasteel,tata steel
1465, markets likely to be volatile  zee  tata steel  srei group stocks in focus ,"07 Oct 2021, 08:22 AM IST",tatasteel,tata steel
1466, sensex hits record high  nifty tops 16 800  tata steel and m m top gainers ,"30 Aug 2021, 10:10 AM IST",tatasteel,tata steel
1467, sensex opens marginally higher  tata steel  ongc and hindalco top gainers ,"24 Aug 2021, 10:17 AM IST",tatasteel,tata steel
1468, sensex jumps 400 points  nifty above 16 550  hcl tech   tata steel top gainers ,"23 Aug 2021, 10:06 AM IST",tatasteel,tata steel
1469, sensex ends 300 points lower  tata steel and jsw steel slump 8  ,"20 Aug 2021, 04:33 PM IST",tatasteel,tata steel
1470, stocks to watch  canara bank  tata steel  hal  hdfc bank  future retail ,"18 Aug 2021, 08:26 AM IST",tatasteel,tata steel
1471, sensex opens flat  m m  tata steel   ongc among top gainers ,"16 Aug 2021, 10:44 AM IST",tatasteel,tata steel
1472, stocks to watch  hero motocorp  tata steel  itc  irctc  ndmc ,"13 Aug 2021, 08:35 AM IST",tatasteel,tata steel
1473, markets may remain volatile  tata steel  eicher motors  hero moto in focus ,"12 Aug 2021, 08:13 AM IST",tatasteel,tata steel
1474, sensex opens flat  tata steel  jsw steel  hindalco among top gainers ,"11 Aug 2021, 10:46 AM IST",tatasteel,tata steel
1475, why jpmorgan is bullish on tata steel  sail despite weak china demand ,"Feb 16, 2023, 03:04 PM IST",tatasteel,tata steel
1476, stocks in news  nestle  indigo  zydus  ntpc  tata steel  ptc industries ,"Feb 16, 2023, 07:08 AM IST",tatasteel,tata steel
1477, tata steel to raise rs 4 000 crore via bonds ,"Feb 15, 2023, 05:04 PM IST",tatasteel,tata steel
1478, tata steel stock falls 5  after surprise net loss in q3  should you buy  sell or hold  ,"Feb 7, 2023, 03:53 PM IST",tatasteel,tata steel
1479, hot stocks  global brokerages on lic housing  medplus health  paytm  varun beverages and tata steel post q3 ,"Feb 7, 2023, 11:09 AM IST",tatasteel,tata steel
1480, sensex  nifty open flat  tata steel falls 3   adani ent gains 3  ,"Feb 7, 2023, 09:46 AM IST",tatasteel,tata steel
1481, a bearish trade on tata steel and a sideways strategy on an auto ancillary stock ,"Feb 8, 2023, 01:16 AM IST",tatasteel,tata steel
1482, tata steel q3 reports rs 2502 cr net loss  total income declines to rs 57 354 16 cr ,"Feb 7, 2023, 12:32 AM IST",tatasteel,tata steel
1483, stocks in news  tata steel  adani transmission  airtel  muthoot finance ,"Feb 7, 2023, 07:18 AM IST",tatasteel,tata steel
1484, stocks in news  indigo  paytm  itc  tata steel  tata power ,"Feb 6, 2023, 07:13 AM IST",tatasteel,tata steel
1485, hindustan zinc shares  capex plans could dim appeal of dividend payouts ,"20 Jan 2023, 11:48 AM IST",hindzinc,hindustan zinc
1486, stocks to watch  hul  adani ent  hindustan zinc  ltts  pvr  ausfb ,"20 Jan 2023, 07:29 AM IST",hindzinc,hindustan zinc
1487, hindustan zinc declares third interim dividend of   5 493 cr  fixes record date ,"19 Jan 2023, 11:21 PM IST",hindzinc,hindustan zinc
1488, hindustan zinc to consider interim dividend today  check record date ,"19 Jan 2023, 08:41 AM IST",hindzinc,hindustan zinc
1489, post declaring   15 5 interim dividend  hindustan zinc shares trade ex dividend ,"23 Nov 2022, 09:23 AM IST",hindzinc,hindustan zinc
1490, stocks to watch  sbi  paytm  tata motors  coal india  hindustan zinc ,"17 Nov 2022, 07:38 AM IST",hindzinc,hindustan zinc
1491, stocks to watch  ntpc  hindustan zinc  cipla  bajaj hindusthan sugar ,"17 Aug 2022, 08:15 AM IST",hindzinc,hindustan zinc
1492, hindustan zinc shares trade ex dividend  stock rises  key things to know ,"20 Jul 2022, 12:55 PM IST",hindzinc,hindustan zinc
1493, stocks to watch  tcs  m m  tata power  vedanta  dr reddy s  hindustan zinc ,"08 Jul 2022, 08:19 AM IST",hindzinc,hindustan zinc
1494, stocks to watch  reliance industries  l t  hindustan zinc ,"08 Dec 2021, 07:44 AM IST",hindzinc,hindustan zinc
1495, hindustan zinc board to consider interim dividend next week ,"03 Dec 2021, 07:45 AM IST",hindzinc,hindustan zinc
1496, govt opposes vedanta s proposal to sell international assets to hindustan zinc ,"Feb 7, 2023, 05:06 PM IST",hindzinc,hindustan zinc
1497, hot stocks  brokerages on maruti suzuki  tvs motors  pidilite industries post q3 results ,"Jan 25, 2023, 10:22 AM IST",pidilitind,pidilite industries
1498, stock radar  buy ltimindtree for a target of rs 4800  vaishali parekh ,"Feb 2, 2023, 10:00 PM IST",ltim,ltimindtree
1499, day trading guide for monday  tata motors  itc among stocks to buy today jan 30 ,"30 Jan 2023, 07:22 AM IST",tatamotors,tata motors
1500, why tata motors shares surge over 7  despite weakness in markets   explained ,"27 Jan 2023, 11:59 AM IST",tatamotors,tata motors
1501, stocks to watch  adani enterprises  bajaj finance  maruti suzuki  tata motors ,"27 Jan 2023, 07:34 AM IST",tatamotors,tata motors
1502, stocks to watch  bharti airtel  tvs motor  tata motors  jet airways ,"25 Jan 2023, 07:22 AM IST",tatamotors,tata motors
1503, tata motors share price gains after voluntary delisting from nyse ,"24 Jan 2023, 11:09 AM IST",tatamotors,tata motors
1504, stocks to watch  axis bank  maruti suzuki  zomato  tata motors  nykaa ,"24 Jan 2023, 07:24 AM IST",tatamotors,tata motors
1505, why european market rally may fuel tcs  tata motors share   explained ,"14 Jan 2023, 07:44 AM IST",tatamotors,tata motors
1506, stocks to watch  sah polymers  hul  ongc  tata motors  eicher motors ,"12 Jan 2023, 07:29 AM IST",tatamotors,tata motors
1507, stocks to watch  ntpc  adani ports  tata motors  axis bank  adani wilmar ,"11 Jan 2023, 07:28 AM IST",tatamotors,tata motors
1508, tata motors share price up 6  on rise in jlr wholesale volumes ,"10 Jan 2023, 11:10 AM IST",tatamotors,tata motors
1509, stocks to watch  tcs  hdfc  ongc  jsw steel  paytm  tata motors ,"10 Jan 2023, 07:29 AM IST",tatamotors,tata motors
1510, tata motors among 7 auto stocks to buy as jefferies sees strong returns in 2023 ,"05 Jan 2023, 08:45 AM IST",tatamotors,tata motors
1511, day trading guide for tuesday  tata motors  infosys among 6 stocks to buy today ,"03 Jan 2023, 06:54 AM IST",tatamotors,tata motors
1512, stocks to focus  maruti  tcs  adani power  torrent power  tata motors  iex ,"02 Jan 2023, 07:27 AM IST",tatamotors,tata motors
1513, stocks to watch  l t  upl  jsw energy  tata motors  sun pharma  ptc india ,"19 Dec 2022, 07:56 AM IST",tatamotors,tata motors
1514, stocks to watch  irctc  poonawala fin  sbi  vedanta  tata motors ,"15 Dec 2022, 07:32 AM IST",tatamotors,tata motors
1515, stocks to watch  paytm  dalmia  icici bank  tata motors  hcl tech ,"13 Dec 2022, 07:44 AM IST",tatamotors,tata motors
1516, stocks to watch  hdfc  jsw energy  ptc india  adani green  tata motors ,"06 Dec 2022, 07:35 AM IST",tatamotors,tata motors
1517, sensex rejig  tata motors enters s p bse sensex  dr reddy dropped ,"18 Nov 2022, 09:45 PM IST",tatamotors,tata motors
1518, stocks to watch  sbi  paytm  tata motors  coal india  hindustan zinc ,"17 Nov 2022, 07:38 AM IST",tatamotors,tata motors
1519, what should investors do with tata motors shares post q2 results  ,"10 Nov 2022, 09:38 AM IST",tatamotors,tata motors
1520, stocks to watch  tata motors  adani ports  coal india  lupin  axis bank ,"10 Nov 2022, 08:01 AM IST",tatamotors,tata motors
1521, stocks to watch  tracxn tech  indusind  ndtv  havells  sjvn  tata motors ,"20 Oct 2022, 07:55 AM IST",tatamotors,tata motors
1522, tata motors sees huge bearish formation ,"10 Oct 2022, 08:56 PM IST",tatamotors,tata motors
1523, tata motors shares fall as jlr wholesale volumes disappoint  jpmorgan downgrades ,"10 Oct 2022, 12:01 PM IST",tatamotors,tata motors
1524, tata motors shares  prabhudas lilladher sees upside in medium term ,"05 Oct 2022, 01:17 PM IST",tatamotors,tata motors
1525, as tata motors brings electric to small cars  what it means for the auto stock  ,"29 Sep 2022, 01:00 PM IST",tatamotors,tata motors
1526, stocks to watch  sbi  bpcl  paytm  tata motors  shipping corp ,"08 Aug 2022, 08:00 AM IST",tatamotors,tata motors
1527, tata motors shares  why brokerages are bullish post q1 despite widening loss ,"28 Jul 2022, 09:20 AM IST",tatamotors,tata motors
1528, stocks to watch  tata motors  biocon  colgate palmolive  iifl  hero motocorp ,"28 Jul 2022, 07:52 AM IST",tatamotors,tata motors
1529, here s how tata motors shares will react after q1 earnings ,"27 Jul 2022, 07:22 PM IST",tatamotors,tata motors
1530, stocks to watch  adani power  tata motors  biocon  marico  ntpc ,"06 Jul 2022, 07:45 AM IST",tatamotors,tata motors
1531, tata motors  maruti suzuki to m m  auto stocks in top gear  should you buy  ,"24 Jun 2022, 09:52 AM IST",tatamotors,tata motors
1532, stocks to watch  airtel  tata motors  hdfc  zomato  tata power  lic ,"17 Jun 2022, 08:15 AM IST",tatamotors,tata motors
1533, tata motors shares jump 8  as q4 loss narrows  brokerages remain bullish ,"13 May 2022, 09:45 AM IST",tatamotors,tata motors
1534, stocks to watch  sbi  tech mahindra  ril  bank of baroda  airtel  tata motors ,"13 May 2022, 07:44 AM IST",tatamotors,tata motors
1535, inflation a headwind for tata motors in q1 ,"13 May 2022, 01:09 AM IST",tatamotors,tata motors
1536, stocks to watch  l t  tata motors  pnb  vodafone idea  hindalco  ultratech ,"12 May 2022, 07:59 AM IST",tatamotors,tata motors
1537, tata motors shares  jefferies sees upto 40  upside on strong focus on evs ,"06 May 2022, 08:25 AM IST",tatamotors,tata motors
1538, stocks to watch  ril  hdfc  maruti  wipro  yes bank  tata motors  adani group ,"02 May 2022, 08:00 AM IST",tatamotors,tata motors
1539, tata motors  tvs motors to maruti suzuki   is it a good time to buy auto stocks  ,"24 Apr 2022, 01:16 PM IST",tatamotors,tata motors
1540, sensex zooms 500 pts  nifty above 17 100  ril  tata motors  maruti suzuki up 3  ,"20 Apr 2022, 10:35 AM IST",tatamotors,tata motors
1541, tata motors shares could see over 40  upside as brokerages bullish ,"12 Apr 2022, 03:27 PM IST",tatamotors,tata motors
1542, stocks to watch  tcs  tata motors  tata steel  axis bank  vodafone idea ,"11 Apr 2022, 07:55 AM IST",tatamotors,tata motors
1543, tata motors  ev plans makes jefferies bullish on the stock ,"08 Apr 2022, 12:02 PM IST",tatamotors,tata motors
1544, stocks to watch  tata motors  hdfc bank  reliance  m m ,"04 Apr 2022, 07:39 AM IST",tatamotors,tata motors
1545, stocks to watch  reliance industries  vodafone idea  tata motors  maruti suzuki ,"02 Mar 2022, 08:07 AM IST",tatamotors,tata motors
1546, stocks to watch  m m  bharti airtel  ril  future retail  tata motors  sbi ,"28 Feb 2022, 08:00 AM IST",tatamotors,tata motors
1547, sensex trades lower tracking mixed global cues  tata motors   sbi top losers ,"08 Feb 2022, 10:55 AM IST",tatamotors,tata motors
1548, should you buy  sell  hold tata motors shares  what brokerages say on q3 results ,"01 Feb 2022, 08:59 AM IST",tatamotors,tata motors
1549, stocks to watch  sun pharma  tata motors  bpcl  exide ,"31 Jan 2022, 07:50 AM IST",tatamotors,tata motors
1550, stocks to watch  reliance  mindtree  tata motors  hcl tech  welspun enterprises ,"14 Jan 2022, 08:06 AM IST",tatamotors,tata motors
1551, stocks to watch  tcs  infosys  wipro  tata motors  kotak mahindra bank  yes bank ,"13 Jan 2022, 08:16 AM IST",tatamotors,tata motors
1552, why tata motors shares have got a downgrade from clsa ,"04 Jan 2022, 12:11 PM IST",tatamotors,tata motors
1553, stocks to watch  future retail  maruti suzuki  tata motors  fmcg shares ,"04 Jan 2022, 07:59 AM IST",tatamotors,tata motors
1554, tata motors shares surge after sales data  should you buy at current level  ,"03 Jan 2022, 12:44 PM IST",tatamotors,tata motors
1555, stocks to watch  ril  tata motors  maruti  m m  future retail  rbl bank ,"03 Jan 2022, 08:06 AM IST",tatamotors,tata motors
1556, stocks to watch  future  airtel  itc  tata motors ,"20 Dec 2021, 07:48 AM IST",tatamotors,tata motors
1557, sensex tanks over 500 pts  nifty below 17 100  tata motors  maruti   titan dip ,"17 Dec 2021, 10:25 AM IST",tatamotors,tata motors
1558, stocks to watch  tata motors  ril  telcos  hcl tech  infosys ,"09 Dec 2021, 08:00 AM IST",tatamotors,tata motors
1559, stocks to watch  ril  hcl tech  kotak mahindra bank  tata motors ,"07 Dec 2021, 08:01 AM IST",tatamotors,tata motors
1560, tata motors shares set to rally sharply  poised for breakout  suggest charts ,"16 Nov 2021, 01:52 PM IST",tatamotors,tata motors
1561, tata motors shares surge despite wider q2 loss  should you buy  ,"02 Nov 2021, 10:22 AM IST",tatamotors,tata motors
1562, tata motors shares plunge ahead of q2 results today ,"01 Nov 2021, 09:32 AM IST",tatamotors,tata motors
1563, markets may rise  hdfc  tata motors in focus ,"01 Nov 2021, 08:34 AM IST",tatamotors,tata motors
1564, jefferies raises target price on tata motors after punch suv launch ,"21 Oct 2021, 09:05 AM IST",tatamotors,tata motors
1565, why tata motors shares jumped over 20  today ,"13 Oct 2021, 06:18 PM IST",tatamotors,tata motors
1566, markets likely to be cautious  ril  zee  infosys  tata motors in focus ,"13 Oct 2021, 08:34 AM IST",tatamotors,tata motors
1567, sensex opens in green  tata motors and bajaj auto top gainers ,"12 Oct 2021, 10:07 AM IST",tatamotors,tata motors
1568, indian stock markets seen choppy  maruti  tata motors  zee  telcos in focus ,"12 Oct 2021, 08:38 AM IST",tatamotors,tata motors
1569, stocks to watch  zee entertainment  tata motors  vodafone idea  future group ,"12 Oct 2021, 08:07 AM IST",tatamotors,tata motors
1570, tata motors shares rally over 21  in 5 days  icici securities sees more upside ,"11 Oct 2021, 12:55 PM IST",tatamotors,tata motors
1571, stocks to watch  m m  ntpc  tata motors ,"08 Oct 2021, 07:02 AM IST",tatamotors,tata motors
1572, sensex zooms 488 pts  nifty ends near 17 800  tata motors  titan surge ,"07 Oct 2021, 05:54 PM IST",tatamotors,tata motors
1573, tata motors jumps 14  as morgan stanley upgrades stock to overweight ,"07 Oct 2021, 03:26 PM IST",tatamotors,tata motors
1574, tata motors share price  analyst sees 25  upside from current levels ,"07 Oct 2021, 11:06 AM IST",tatamotors,tata motors
1575, sensex up 350 pts  nifty above 17 600  divi s lab  tata motors among top gainers ,"04 Oct 2021, 10:10 AM IST",tatamotors,tata motors
1576, stocks to watch  hdfc bank  kotak mahindra bank  tata motors  sbi card ,"22 Sep 2021, 07:53 AM IST",tatamotors,tata motors
1577, stocks to watch  bharti airtel  future retail  idbi bank  tata motors ,"30 Aug 2021, 08:39 AM IST",tatamotors,tata motors
1578, sensex ends 318 points higher  power grid  tech mahindra and tata motors surge ,"12 Aug 2021, 04:52 PM IST",tatamotors,tata motors
1579, market trading guide  tata motors and dlf among 9 stock recommendations for monday ,"Feb 12, 2023, 05:38 PM IST",tatamotors,tata motors
1580, tata motors  itc top performers of nifty this year  two adani stocks lose most ,"Feb 3, 2023, 10:15 AM IST",tatamotors,tata motors
1581, hot stocks  brokerages on laurus labs  tata motors  srf  l t  and pnb ,"Jan 31, 2023, 11:05 AM IST",tatamotors,tata motors
1582, stocks in news  adani enterprises  ntpc  l t  tech mahindra  hdfc bank  tata motors  vedanta ,"Jan 30, 2023, 08:19 AM IST",tatamotors,tata motors
1583, tata motors among 5 stock ideas that can rally up to 35   yes securities ,"Jan 28, 2023, 10:49 AM IST",tatamotors,tata motors
1584, tata motors shares jump over 8  after q3 results  should you buy  sell or hold  ,"Jan 27, 2023, 11:58 AM IST",tatamotors,tata motors
1585, hot stocks  brokerages on bajaj auto  dr reddy s laboratories  tata motors and cipla post q3 results ,"Jan 27, 2023, 10:34 AM IST",tatamotors,tata motors
1586, stocks in news  tata motors  dr reddy s  adani enterprises  bajaj fin  vedanta  ceat  tata elxsi ,"Jan 27, 2023, 07:34 AM IST",tatamotors,tata motors
1587, tata motors gains pace thanks to margin   volume growth ,"Jan 27, 2023, 07:01 AM IST",tatamotors,tata motors
1588, tata motors q3 results  net profit at rs 3 043 crore  net sales at rs 88 489 crore ,"Jan 25, 2023, 08:33 PM IST",tatamotors,tata motors
1589, big movers on d st  what should investors do with maruti suzuki  tata motors and tvs motor company  ,"Jan 25, 2023, 08:39 AM IST",tatamotors,tata motors
