,Headline,Date,Symbol,Company Name
4238, stocks in news  vodafone idea  biocon  ongc  nmdc  grasim  nbcc ,"Feb 15, 2023, 07:12 AM IST",nbcc,nbcc india
4239, why hinduja global solutions shares plunged 20  despite announcing dividend ,"07 Jan 2022, 03:11 PM IST",hgs,hinduja global solutions
4240, jk paper  west coast  andhra paper at fresh highs  know why  ,"16 Mar 2022, 12:27 PM IST",jkpaper,jk paper
4241, jk paper stock teases near record highs  ventura securities bullish ahead ,"15 Mar 2022, 08:12 AM IST",jkpaper,jk paper
4242, big movers on d st  what should investors do with apar industries  cg power and paytm  ,"Feb 8, 2023, 08:35 AM IST",aparinds,apar industries
4243, big movers on d st  what should investors do with apar industries  indian hotels  and sona blw precision  ,"Feb 2, 2023, 08:41 AM IST",aparinds,apar industries
4244, apar industries  strong demand outlook keeps investor interest alive ,"February 09, 2023 04:35 PM IST",aparinds,apar industries
4245, one largecap and one midcap chemical stock to buy  as per jm financial ,"02 Jan 2023, 01:09 PM IST",jmfinancil,jm financial
4246, jm financial initiates coverage on nykaa shares with  buy  rating ,"21 Dec 2021, 03:54 PM IST",jmfinancil,jm financial
4247, jm financial initiates sell rating on paytm  cuts target price to   1 240 a share ,"27 Nov 2021, 02:02 PM IST",jmfinancil,jm financial
4248, triveni engineering share buyback s record date this week  key things to know ,"20 Dec 2022, 11:30 AM IST",triveni,triveni engineering & industries
4249, triveni engg  dhampur to dwarikesh  why sugar stocks are on fire   explained ,"06 Apr 2022, 01:27 PM IST",triveni,triveni engineering & industries
4250, cash market   triveni is ripe for a breakout ,"February 14, 2023 06:30 AM IST",triveni,triveni engineering & industries
4251, diagnostic firm shares dr lal pathlabs  metropolis surge on china covid concern ,"21 Dec 2022, 10:11 AM IST",metropolis,metropolis healthcare
4252, metropolis healthcare s non covid business growth is encouraging ,"10 Nov 2022, 12:58 PM IST",metropolis,metropolis healthcare
4253, stocks to watch  metropolis healthcare  adani enterprises  sbi cards  tcs ,"07 Jun 2022, 07:30 AM IST",metropolis,metropolis healthcare
4254, hot stocks  brokerage views on nykaa  metropolis healthcare  gujarat gas  medanta and zee entertainment ,"Feb 14, 2023, 11:07 AM IST",metropolis,metropolis healthcare
4255, multibagger stock bls international services declares dividend  pat up 60  in q3 ,"06 Feb 2023, 10:29 PM IST",bls,bls international services
4256, bls international services turn ex bonus  shares rise by 10  ,"08 Dec 2022, 01:50 PM IST",bls,bls international services
4257, multibagger stock talk  financial services firm buys stake in bls international ,"13 Jul 2022, 08:10 PM IST",bls,bls international services
4258, hot stocks   bet on cera sanitaryware  action construction equipment  gravita india for short term ,"February 08, 2023 06:27 AM IST",cera,cera sanitaryware
4259, india cements and canara bank among top trading bets for short term  here s why ,"23 Nov 2022, 01:48 PM IST",indiacem,india cements
4260, india cements added to list of stocks under f o ban on nse today ,"17 Oct 2022, 07:41 AM IST",indiacem,india cements
4261, stocks to watch  tcs  adani energy  infosys  india cements  bajaj auto ,"11 Oct 2022, 07:33 AM IST",indiacem,india cements
4262, india cements  pvr among stocks under f o ban  indiabulls housing out ,"21 Sep 2022, 07:45 AM IST",indiacem,india cements
4263, pvr  india cements among 4 stocks under f o ban on nse today ,"19 Sep 2022, 07:40 AM IST",indiacem,india cements
4264, india cements share price near 52 week lows after q4 results  what analysts say  ,"27 May 2022, 02:24 PM IST",indiacem,india cements
4265, stocks to watch  wipro  sbi  indusind  ceat ,"21 Jul 2022, 07:34 AM IST",ceatltd,ceat
4266, stocks in focus  ceat  tata elxsi and more ,"Jan 27, 2023, 08:49 AM IST",ceatltd,ceat
4267, stocks in news  tata motors  dr reddy s  adani enterprises  bajaj fin  vedanta  ceat  tata elxsi ,"Jan 27, 2023, 07:34 AM IST",ceatltd,ceat
4268, february stock ideas  icici bank  praj industries among top 10 stocks that can rally up to 59  ,"Feb 7, 2023, 10:43 AM IST",prajind,praj industries
4269, is the eclerx services buyback at 25  premium lucrative  ,"20 Dec 2022, 10:59 AM IST",eclerx,eclerx services
4270, eclerx buyback 2022  it major announces record date for buyback of shares ,"15 Dec 2022, 02:19 PM IST",eclerx,eclerx services
4271, stocks to watch  shipping corporation of india  britannia  hul  mmtc ,"11 Mar 2022, 08:26 AM IST",sci,shipping corporation of india
4272, symphony approves share buyback of   200 cr  records highest ever sales in q3 ,"08 Feb 2023, 04:36 PM IST",symphony,symphony
4273, symphony surges over 12  after board approves rs 200 crore  buyback ,"Feb 8, 2023, 03:33 PM IST",symphony,symphony
4274, beml s record date for demerger of land assets this week  key things to know ,"07 Sep 2022, 01:19 PM IST",beml,beml
4275, beml to fix record date for shares issue by beml land assets in board meet today ,"24 Aug 2022, 12:50 PM IST",beml,beml
4276, beml shares end 16  up ahead of fixing record date for 1 1 shares issue ,"11 Aug 2022, 04:26 PM IST",beml,beml
4277, beml declares interim dividend  fixes record date ,"22 Mar 2022, 01:29 PM IST",beml,beml
4278, stocks in focus  railtel  beml and more ,"Feb 17, 2023, 09:00 AM IST",beml,beml
4279, beml rises nearly 5  on rs 378 crore order win ,"February 13, 2023 09:28 AM IST",beml,beml
4280, inox leisure  pvr shares hit life time high  do you own  ,"28 Jul 2022, 11:41 AM IST",inoxleisur,inox leisure
4281, pvr  inox leisure shares surge  good time to buy now  ,"27 Sep 2021, 01:20 PM IST",inoxleisur,inox leisure
4282, quess corp declares   8 per share dividend  stock hits a new 52 week low ,"10 Nov 2022, 10:46 PM IST",quess,quess corp
4283, quess corp stock tanks as ceo s sudden exit overshadows strong q3 ,"14 Feb 2022, 01:08 PM IST",quess,quess corp
4284, jbm auto board approves stock split  shares rise ,"08 Dec 2021, 02:53 PM IST",jbma,jbm auto
4285, trade spotlight   how to trade in jbm auto  campus activewear  gujarat pipavav port today  ,"February 13, 2023 06:38 AM IST",jbma,jbm auto
4286, why intellect design s share price is falling ,"02 Nov 2022, 10:20 AM IST",intellect,intellect design arena
4287, hot stocks  intellect design arena  mahanagar gas  poonawalla fincorp can give up to 10  return in short term ,"February 09, 2023 07:37 AM IST",intellect,intellect design arena
4288, cash market   start of fresh upside initiated by a breakout in intellect design ,"February 09, 2023 06:49 AM IST",intellect,intellect design arena
4289, adani wilmar shares  rating upgraded by edelweiss  check target price ,"12 Jan 2023, 11:39 AM IST",edelweiss,edelweiss financial services
4290, policybazaar shares down 52  in 2022  edelweiss initiates coverage with  buy  ,"23 Dec 2022, 11:27 AM IST",edelweiss,edelweiss financial services
4291, vedanta s high dividend payout to continue  says edelweiss  raises target price ,"06 Dec 2022, 10:01 AM IST",edelweiss,edelweiss financial services
4292, top midcaps  smallcap stock picks by brokerage firm edelweiss ,"01 Dec 2022, 03:47 PM IST",edelweiss,edelweiss financial services
4293, dlf  macrotech among top 3 realty stocks to buy  as recommended by edelweiss ,"30 Nov 2022, 11:40 AM IST",edelweiss,edelweiss financial services
4294, specialty chemical stock down 36  in 2022  edelweiss has  buy  tag ,"18 Nov 2022, 03:27 PM IST",edelweiss,edelweiss financial services
4295,  lots to cheer  in vedanta stock  says edelweiss  sees strong upside ,"16 Sep 2022, 03:40 PM IST",edelweiss,edelweiss financial services
4296, edelweiss sees nmdc  jsw steel benefit in medium term  check its recommendations ,"27 Aug 2022, 12:47 PM IST",edelweiss,edelweiss financial services
4297, multibagger mining stock rallies 134  this year  edelweiss sees more upside ,"25 Aug 2022, 01:46 PM IST",edelweiss,edelweiss financial services
4298, specialty chemical stock may rally over 55  as edelweiss bullish post q1 results ,"11 Aug 2022, 03:32 PM IST",edelweiss,edelweiss financial services
4299, why this metal stock is edelweiss  sole  buy  tag in the sector ,"09 Aug 2022, 03:26 PM IST",edelweiss,edelweiss financial services
4300,  real estate stocks attractive for medium term   edelweiss  its top 2 picks ,"03 Aug 2022, 03:29 PM IST",edelweiss,edelweiss financial services
4301, top picks  midcap  smallcap stocks to buy as recommended by edelweiss ,"12 Jul 2022, 01:38 PM IST",edelweiss,edelweiss financial services
4302, multibagger stock hits 52 week high  edelweiss remain bullish ,"10 Jul 2022, 03:40 PM IST",edelweiss,edelweiss financial services
4303, edelweiss sees 30  upside in this healthcare stock  should you buy  ,"23 Jun 2022, 12:24 PM IST",edelweiss,edelweiss financial services
4304, top picks  edelweiss recommends these 2 metal stocks to buy ,"06 May 2022, 03:13 PM IST",edelweiss,edelweiss financial services
4305, multibagger stock down 7  in 5 days  edelweiss has  buy  tag post q4 results ,"04 May 2022, 12:39 PM IST",edelweiss,edelweiss financial services
4306, edelweiss bullish on this multibagger stock post q4 results  raises target price ,"28 Apr 2022, 08:21 AM IST",edelweiss,edelweiss financial services
4307, top picks  edelweiss recommends these 2 metal stocks to buy ,"22 Apr 2022, 04:39 PM IST",edelweiss,edelweiss financial services
4308, these bank stocks are edelweiss  top picks in the sector ,"18 Apr 2022, 03:27 PM IST",edelweiss,edelweiss financial services
4309,  tata power shares may level off   says edelweiss  remains positive on the stock ,"18 Apr 2022, 10:40 AM IST",edelweiss,edelweiss financial services
4310, multibagger stock rallies 76  in 2022 so far  edelweiss sees more upside ,"05 Apr 2022, 03:26 PM IST",edelweiss,edelweiss financial services
4311, multibagger psu metal stock up 160  this year so far  edelweiss sees more upside ,"30 Mar 2022, 02:18 PM IST",edelweiss,edelweiss financial services
4312, itc share price  edelweiss wealth sees 80  upside in long term ,"23 Mar 2022, 07:34 AM IST",edelweiss,edelweiss financial services
4313, nifty metal index surges 4   edelweiss suggests these 2 metal stocks to buy ,"28 Feb 2022, 01:37 PM IST",edelweiss,edelweiss financial services
4314, this multibagger stock is up 143  in a year  edelweiss sees more upside ,"17 Feb 2022, 01:26 PM IST",edelweiss,edelweiss financial services
4315, this multibagger chemical stock gets  buy  tag from edelweiss post q3 results ,"01 Feb 2022, 10:07 AM IST",edelweiss,edelweiss financial services
4316, edelweiss gives  buy  tag to this multibagger realty stock  raises target price ,"10 Jan 2022, 12:04 PM IST",edelweiss,edelweiss financial services
4317, these 2 metal stocks are edelweiss  top picks in the sector ,"03 Dec 2021, 02:35 PM IST",edelweiss,edelweiss financial services
4318, this multibagger stock is up 135  in a year  edelweiss bullish post q2 results ,"12 Nov 2021, 01:29 PM IST",edelweiss,edelweiss financial services
4319, birlasoft  icici bank among edelweiss  top diwali stock picks ,"30 Oct 2021, 09:33 AM IST",edelweiss,edelweiss financial services
4320, why edelweiss is bullish on this electronic goods maker stock ,"05 Oct 2021, 10:47 AM IST",edelweiss,edelweiss financial services
4321, this it stock has gained 50  in 3 months  edelweiss sees more upside ,"23 Sep 2021, 04:12 PM IST",edelweiss,edelweiss financial services
4322, stocks to watch  axis bank  bpcl  edelweiss  infosys  sbi cap ,"07 Sep 2021, 08:21 AM IST",edelweiss,edelweiss financial services
4323, edelweiss    400 cr ncd issue to offer yield of 9 7  ,"13 Aug 2021, 12:47 AM IST",edelweiss,edelweiss financial services
4324, brightcom group to consider bonus shares issue next week ,"17 Jan 2022, 11:55 AM IST",bcg,brightcom group
4325, technical stock picks  ventura securities bullish on gujarat ambuja exports ,"14 Mar 2022, 03:05 PM IST",gael,gujarat ambuja exports
4326, kfin technologies shares dip after flat debut  buy  sell or hold  ,"29 Dec 2022, 11:07 AM IST",kfintech,kfin technologies
4327, kfin technologies shares make a flat market debut ,"29 Dec 2022, 10:12 AM IST",kfintech,kfin technologies
4328, stocks to watch  kfin technologies  tata power  jsw energy  uco bank  airtel ,"29 Dec 2022, 07:28 AM IST",kfintech,kfin technologies
4329, kfin technologies ipo s shares listing likely this week  check gmp ,"27 Dec 2022, 02:06 PM IST",kfintech,kfin technologies
4330, kfin technologies  ipo worth   2 400 crore gets sebi nod ,"10 Nov 2022, 02:18 PM IST",kfintech,kfin technologies
4331, kfintech s insta brokerage feature will instantly release distributor commissions  details here ,"16 Feb 2022, 07:25 PM IST",kfintech,kfin technologies
4332, sebi slaps   1 5 cr fine on kfin technologies in taurus mutual fund case ,"22 Dec 2021, 07:51 PM IST",kfintech,kfin technologies
4333, rain industries shares  why this chemical stock is falling   explained ,"10 Sep 2022, 12:48 PM IST",rain,rain industries
4334, sis ltd s board approves share buyback  details inside ,"29 Jun 2022, 04:09 PM IST",sis,sis
4335, delta corp added to list of 5 stocks under f o ban on nse today ,"18 Jan 2023, 07:45 AM IST",deltacorp,delta corp
4336, delta corp  indiabulls housing finance stocks under f o ban on nse today ,"14 Oct 2022, 07:36 AM IST",deltacorp,delta corp
4337, stock to watch  tcs  delta corp  infosys  suzlon  adani enterprises ,"12 Oct 2022, 07:52 AM IST",deltacorp,delta corp
4338, escorts  delta corp added among 6 stocks under f o ban on nse today ,"20 Sep 2022, 07:34 AM IST",deltacorp,delta corp
4339, delta corp stock under f o ban on nse today ,"09 Sep 2022, 07:42 AM IST",deltacorp,delta corp
4340, delta corp continues to be part of nse s f o ban stock list ,"08 Sep 2022, 07:46 AM IST",deltacorp,delta corp
4341, delta corp part of nse s f o ban stock list for today ,"05 Sep 2022, 07:39 AM IST",deltacorp,delta corp
4342, delta corp  balrampur chini part of nse s f o ban stock list for today ,"11 Aug 2022, 07:46 AM IST",deltacorp,delta corp
4343, delta corp among 3 stocks under f o ban on nse today ,"08 Aug 2022, 07:47 AM IST",deltacorp,delta corp
4344, delta corp added to the list of 2 stocks under f o ban on nse ,"27 Jul 2022, 07:44 AM IST",deltacorp,delta corp
4345, delta corp stock under f o ban on nse today ,"15 Jul 2022, 07:38 AM IST",deltacorp,delta corp
4346, stocks to watch  hcl tech  axis bank  shilpa medicare  mindtree  delta corp ,"13 Jul 2022, 07:53 AM IST",deltacorp,delta corp
4347, delta corp part of nse s f o ban stock list for today ,"13 Jul 2022, 07:40 AM IST",deltacorp,delta corp
4348, sun tv under f o ban on nse today  delta corp out ,"30 Jun 2022, 07:48 AM IST",deltacorp,delta corp
4349, delta corp under f o ban on nse  rbl bank  indiabulls housing out ,"28 Jun 2022, 07:46 AM IST",deltacorp,delta corp
4350, delta corp added to the list of 4 stocks under f o ban on nse today ,"24 Jun 2022, 07:45 AM IST",deltacorp,delta corp
4351, rbl bank continues to be among stocks under f o ban on nse  delta corp out ,"21 Jun 2022, 07:45 AM IST",deltacorp,delta corp
4352, delta corp continues to be among stocks under f o ban on nse today ,"20 Jun 2022, 08:09 AM IST",deltacorp,delta corp
4353, delta corp  2 other stocks under f o ban on nse today ,"17 Jun 2022, 07:56 AM IST",deltacorp,delta corp
4354, rakesh jhunjhunwala books profit in delta corp shares  details here ,"15 Jun 2022, 01:11 PM IST",deltacorp,delta corp
4355, rbl bank  delta corp among stocks under f o ban on nse today ,"15 Jun 2022, 07:46 AM IST",deltacorp,delta corp
4356, rakesh jhunjhunwala cuts stake in delta corp  details here ,"01 Jun 2022, 04:09 PM IST",deltacorp,delta corp
4357, indiabulls housing stock under f o ban on nse today  delta corp out ,"25 May 2022, 07:46 AM IST",deltacorp,delta corp
4358, delta corp  pnb continue to be under nse s f o ban stock list ,"20 May 2022, 08:19 AM IST",deltacorp,delta corp
4359, delta corp added to the list of 4 stocks under f o ban on nse today ,"19 May 2022, 07:41 AM IST",deltacorp,delta corp
4360, delta corp among 2 stocks under f o ban on nse today ,"12 Apr 2022, 07:33 AM IST",deltacorp,delta corp
4361, indiabulls housing  delta corp among 3 stocks under f o ban on nse today ,"22 Mar 2022, 08:16 AM IST",deltacorp,delta corp
4362, stocks to watch  tcs  infosys  wipro  delta corp  dlf  federal bank ,"12 Jan 2022, 08:03 AM IST",deltacorp,delta corp
4363, delta corp  rbl bank among stocks under f o ban on nse today ,"10 Jan 2022, 07:37 AM IST",deltacorp,delta corp
4364, delta corp  persistent systems among stocks available for f o trading from today ,"01 Oct 2021, 09:39 AM IST",deltacorp,delta corp
4365, stocks to watch  shipping corporation of india  britannia  hul  mmtc ,"11 Mar 2022, 08:26 AM IST",mmtc,mmtc
4366, stocks to watch  bhel  bpcl  mmtc  cadila  hdfc bank  indigo  spicejet ,"27 Aug 2021, 08:22 AM IST",mmtc,mmtc
4367, rustomjee group firm keystone realtors  shares list at premium over ipo price ,"24 Nov 2022, 10:01 AM IST",rustomjee,keystone realtors
4368, stock to watch  keystone realtors  adani transmission  indigo  hfcl  sbi ,"24 Nov 2022, 07:37 AM IST",rustomjee,keystone realtors
4369, mahindra lifespace developers drops 4  after two day winning run  forms bearish harami pattern ,"February 07, 2023 03:37 PM IST",mahlife,mahindra lifespace developers
4370, stocks to watch  axis bank  l t  5paisa capital  ptc india  ircon ,"08 Dec 2022, 07:30 AM IST",ircon,ircon international
4371, from irfc  rvnl to ircon  why railways stocks have been rallying  ,"29 Nov 2022, 02:11 PM IST",ircon,ircon international
4372, why analysts are bullish on irctc  ircon  here are the triggers ,"26 Aug 2021, 10:38 AM IST",ircon,ircon international
4373, itc to maruti suzuki  religare lists out 6 budget 2023 stocks to buy ,"01 Feb 2023, 06:31 AM IST",religare,religare enterprises
4374, stocks to watch  bharat dynamics  dish tv  nxtdigital  religare enterprises ,"01 Jun 2022, 08:33 AM IST",religare,religare enterprises
4375, mapmyindia shares see profit booking post listing  should you buy  ,"21 Dec 2021, 11:14 AM IST",mapmyindia,c.e . info systems
4376, mapmyindia shares list at strong premium on market debut ,"21 Dec 2021, 10:14 AM IST",mapmyindia,c.e . info systems
4379, mapmyindia ipo  gmp signals strong ce info systems share listing ,"20 Dec 2021, 01:36 PM IST",mapmyindia,c.e . info systems
4380, mapmyindia ipo share allotment today  how to check application status online ,"16 Dec 2021, 07:53 AM IST",mapmyindia,c.e . info systems
4381, mapmyindia ipo  what gmp reflects as all eyes set on share allotment date ,"14 Dec 2021, 01:53 PM IST",mapmyindia,c.e . info systems
4382, mapmyindia ipo  what gmp signals on last date of subscription  ,"13 Dec 2021, 10:21 AM IST",mapmyindia,c.e . info systems
4383, mapmyindia ipo  latest gmp  subscription status  should you apply  ,"11 Dec 2021, 10:15 AM IST",mapmyindia,c.e . info systems
4384, sobha  ajmera realty to macrotech   why real estate stocks are rallying today  ,"07 Jul 2022, 12:43 PM IST",sobha,sobha
4385, stocks to watch  banks   nbfcs  m m  sonata software  ntpc  dr reddy s  sobha ,"08 Apr 2022, 07:52 AM IST",sobha,sobha
4386, budget 2023 raises farm credit target to rs 20l cr  venky s  avanti feeds rally up to 5  ,"Feb 1, 2023, 04:23 PM IST",avantifeed,avanti feeds
4387, meghmani finechem  hal  linde india among stocks that surged 20  this week ,"27 Aug 2021, 03:11 PM IST",mfl,meghmani finechem
4388, glenmark life sciences shares make tepid debut  should you buy now  ,"06 Aug 2021, 12:03 PM IST",gls,glenmark life sciences
4389, glenmark life sciences shares make a tepid debut ,"06 Aug 2021, 10:25 AM IST",gls,glenmark life sciences
4390, stocks to watch  just dial  dabur  adani enterprises  irb infra  ptc india ,"20 Dec 2022, 07:46 AM IST",justdial,dial
4391, just dial board approves allotment of 2 crore shares to reliance retail ,"02 Sep 2021, 11:44 AM IST",justdial,dial
4392, mfs dial down exposure to d street s top banking bet  should you be worried  ,"Feb 15, 2023, 10:53 AM IST",justdial,dial
4393, why mtar technologies share price is falling ,"05 Jul 2022, 05:59 PM IST",mtartech,mtar technologies
4394, syrma sgs technology shares extend gains on second day despite weak markets ,"29 Aug 2022, 12:13 PM IST",syrma,syrma sgs technology
4395, syrma sgs technology climbs 42  in the debut trade against the issue price ,"26 Aug 2022, 06:27 PM IST",syrma,syrma sgs technology
4396, syrma sgs technology shares rise after strong debut  buy  sell or hold  ,"26 Aug 2022, 11:38 AM IST",syrma,syrma sgs technology
4397, stocks to watch  syrma sgs  hdfc bank  ioc  titan  lic ,"26 Aug 2022, 07:28 AM IST",syrma,syrma sgs technology
4398, rolex rings to cartrade  one year lock in of these 5 stocks to end soon ,"28 Jul 2022, 09:28 AM IST",rolexrings,rolex rings
4399, rolex rings surges 38 8  on debut ,"09 Aug 2021, 10:16 AM IST",rolexrings,rolex rings
4400, rolex rings shares make a strong market debut ,"09 Aug 2021, 10:10 AM IST",rolexrings,rolex rings
4401, rolex rings ipo  what gmp is signaling ahead of listing of shares ,"07 Aug 2021, 10:50 AM IST",rolexrings,rolex rings
4402, rolex rings shares  what gmp is signaling ahead of listing ,"06 Aug 2021, 10:46 AM IST",rolexrings,rolex rings
4403, rolex rings ipo  what gmp is signaling about the public issue ,"05 Aug 2021, 07:38 AM IST",rolexrings,rolex rings
4404, stocks to watch  wipro  hcl  adani wilmar  reliance power  sail ,"13 Oct 2022, 07:32 AM IST",rpower,reliance power
4405, reliance power share jumps after blackrock fund buys stake ,"07 Oct 2022, 11:19 AM IST",rpower,reliance power
4406, ghcl stock at fresh highs  ventura securities see strong upside ahead ,"15 Mar 2022, 08:30 AM IST",ghcl,ghcl
4407, trade spotlight   how to trade in jbm auto  campus activewear  gujarat pipavav port today  ,"February 13, 2023 06:38 AM IST",gppl,gujarat pipavav port
4408, gujarat pipavav port stock price rises after 89  jumps in q3 profit  nomura expects 51  upside ,"February 09, 2023 09:56 AM IST",gppl,gujarat pipavav port
4409, hot stocks  global brokerages on sbi life  power grid  sunteck realty  and policybazaar ,"Feb 3, 2023, 10:43 AM IST",sunteck,sunteck realty
4410, cms info systems shares fall 17  in a month  jefferies has  buy  tag ,"07 Mar 2022, 10:33 AM IST",cmsinfo,cms info systems
4411, cms info systems makes tepid debut  should you hold or accumulate  ,"31 Dec 2021, 01:21 PM IST",cmsinfo,cms info systems
4412, cms info systems shares surge after tepid market debut ,"31 Dec 2021, 10:42 AM IST",cmsinfo,cms info systems
4413, cms info systems ipo share listing today  experts predict  weak  debut ,"31 Dec 2021, 05:56 AM IST",cmsinfo,cms info systems
4414, paradeep phosphates shares make positive debut  should you buy  sell or hold  ,"27 May 2022, 11:01 AM IST",paradeep,paradeep phosphates
4415, paradeep phosphates shares rise on stock market debut ,"27 May 2022, 10:02 AM IST",paradeep,paradeep phosphates
4416, karnataka bank shares give multibagger return in 2022  axis sec sees more rally ,"15 Nov 2022, 03:24 PM IST",ktkbank,karnataka bank
4417, karnataka bank shares trade around 3 year high  anand rathi has  buy  rating ,"03 Nov 2022, 11:21 AM IST",ktkbank,karnataka bank
4418, karnataka bank shares today locked in upper circuit after posting record profits ,"02 Nov 2022, 12:08 PM IST",ktkbank,karnataka bank
4419, stocks to watch  infosys  voda idea  karnataka bank  oil stocks  cadila ,"23 Aug 2021, 08:32 AM IST",ktkbank,karnataka bank
4420, stocks in focus  apollo tyres  birlasoft  sbi  itc  karnataka bank and more ,"Feb 3, 2023, 08:23 AM IST",ktkbank,karnataka bank
4421, stock of the day  sharda cropchem   attractive valuations  margin pressure set to ease ,"February 09, 2023 11:27 AM IST",shardacrop,sharda cropchem
4422, stocks to watch  ongc  arvind fashions  glenmark pharma  ashok leyland ,"11 Feb 2022, 07:33 AM IST",arvindfasn,arvind fashions
4423, vijaya diagnostic makes tepid stock market debut  shares list at 2  premium ,"14 Sep 2021, 10:15 AM IST",vijaya,vijaya diagnostic centre
4424, ami organics shares list at strong premium  vijaya diagnostic sees tepid debut ,"14 Sep 2021, 10:24 AM IST",vijaya,vijaya diagnostic centre
4425, vijaya diagnostic ipo listing date  what latest gmp signals ,"10 Sep 2021, 10:29 AM IST",vijaya,vijaya diagnostic centre
4426, vijaya diagnostic ipo share allotment today  how to check application status ,"08 Sep 2021, 08:42 AM IST",vijaya,vijaya diagnostic centre
4427, ami organics vs vijaya diagnostic ipos  latest gmp  how to check share status ,"07 Sep 2021, 08:05 AM IST",vijaya,vijaya diagnostic centre
4428, vijaya diagnostic ipo allotment  how to check application status online ,"06 Sep 2021, 12:30 PM IST",vijaya,vijaya diagnostic centre
4429, ami organics vs vijaya diagnostic ipos  what gmp signals before share allotment ,"07 Sep 2021, 09:57 AM IST",vijaya,vijaya diagnostic centre
4430, ami organics vs vijaya diagnostic ipos  what gmp signals about the public issues ,"03 Sep 2021, 03:15 PM IST",vijaya,vijaya diagnostic centre
4431, ami organics vs vijaya diagnostic ipos  gmp  other details that you should know ,"02 Sep 2021, 09:19 AM IST",vijaya,vijaya diagnostic centre
4432, vijaya diagnostic ipo  gmp remains steady ahead of subscription opening ,"31 Aug 2021, 10:53 AM IST",vijaya,vijaya diagnostic centre
4433, vijaya diagnostic ipo  gmp  price  other details in 10 points ,"30 Aug 2021, 10:13 AM IST",vijaya,vijaya diagnostic centre
4434, vijaya diagnostic ipo  what gmp signals ahead of subscription opening ,"28 Aug 2021, 01:50 PM IST",vijaya,vijaya diagnostic centre
4435, vijaya diagnostic ipo  gmp  price  other details that you should know ,"27 Aug 2021, 08:58 AM IST",vijaya,vijaya diagnostic centre
4436, stocks to watch  spicejet  ntpc  inox green  infibeam  nalco ,"27 Dec 2022, 07:54 AM IST",infibeam,infibeam avenues
