,Headline,Date
0, Trade setup for Thursday: Top 15 things to know before the opening bell,2023-03-22 22:05:00
1, Understanding Trading and Settlement Holidays: What investors need to know,2023-03-22 19:39:00
2," MC A10 closes in the green; Adani Enterprises, Adani Ports top drags",2023-03-22 18:49:00
3, Can Exxon and Chevron master oil trading? It won’t be easy,2023-03-22 17:23:00
4, GMO co-founder warns of 50% stock decline in next market phase,2023-03-22 17:14:00
5," Technical View | Sharp upmove unlikely until Nifty surpasses 17,200",2023-03-22 17:02:00
6," F&O Manual: Trade to hinge on FOMC outcome tomorrow, initiate non-directional strategy, say analysts",2023-03-22 17:00:00
7, Gainers & Losers: 10 stocks that moved the most on March 22,2023-03-22 16:06:00
8," Taking Stock | Sensex, Nifty end with moderate gains ahead of Fed rate decision",2023-03-22 16:41:00
9, Moneycontrol Pro Panorama | Banking crisis: Will Powell pause?,2023-03-22 15:09:00
10, Global Surfaces to debut on bourses tomorrow: What could be the listing premium?,2023-03-22 15:07:00
11, ‘I am not a bear!’ says S Naren but explains why the market is in a moderate return environment,2023-03-22 14:53:00
12, Tax raids on firms emerge as latest headache for investors,2023-03-22 14:31:00
13, Emami surges 8% as board mulls share buyback,2023-03-22 13:41:00
14, Udayshivakumar Infra IPO sees 5.15 times buying on bidding Day 3,2023-03-22 17:14:00
15, Asian Energy shares zoom on order win worth Rs 165 crore,2023-03-22 14:04:00
16, HZL’s dividend bonanza does not resolve the larger issue,2023-03-22 13:06:00
17, Transmission sector set for Rs 2.4 lakh crore expansion as part of green power push,2023-03-22 13:09:00
18, CLSA's ratings upgrades trigger gains in life insurance stocks,2023-03-22 12:37:00
19," Motilal Oswal retains buy rating on Manappuram Finance, sees 26% upside",2023-03-22 12:26:00
20," FPIs’ net short positions surpass COVID sell-off, rally overdue, say experts",2023-03-22 12:08:00
21, Banking mutual funds turn sour; what’s the outlook for them amid the global turmoil?,2023-03-22 12:07:00
22, Bundesbank chief says rate-setters must be ‘more stubborn’ in inflation fight,2023-03-22 11:58:00
23, Chart of the Day: Fund managers sit on cash as visibility diminishes,2023-03-22 11:40:00
24, Does the gold rally have legs?,2023-03-22 11:32:00
25, Sobha share price tumbles as tax sleuths raid premises,2023-03-22 16:25:00
26, F&O Manual | Analysts foresee tepid trading as investors take cautious steps,2023-03-22 11:03:00
27," IOC pares early gains; board approves feasibility study for Rs 61,000 crore petchem foray",2023-03-22 10:56:00
28," Daily Voice | Don’t see an SVB-like collapse in India, be cautious in allocation to IT sector: Weekend Investing founder",2023-03-22 10:52:00
29, Sula Vineyards raises a toast to 44% upside by CLSA. Check out the details here,2023-03-22 10:25:00
30, What lies ahead after two weeks of banking stress,2023-03-22 10:19:00
31, Crop damage from unseasonal rains not expected to cause major inflationary impact: JM Financial,2023-03-22 10:12:00
32, Patel Engineering stock gains on bagging order worth Rs 511 crore along with JV Partner,2023-03-22 10:01:00
33, Gold Prices Today: Yellow metal may remain weak ahead of Fed meeting outcome,2023-03-22 09:54:00
34, Backstop fund for corporate bond market needs to be backed by market making,2023-03-22 09:52:00
35, Buzzing Stock | Why CLSA sees nearly 40% upside in M&M,2023-03-22 11:28:00
36," Hind Zinc to turn net debt from net cash after Rs 11,000-cr dividend payout: Analysts",2023-03-22 09:44:00
37, Why this high-quality midcap deserves a look,2023-03-22 09:39:00
38, Zydus Lifesciences shares gain following USFDA approval for Tofacitinib tablets,2023-03-22 09:32:00
39, Sonata Software shares gain 2% on $160-mn contract with US retailer,2023-03-22 09:25:00
40," Gold outshines equities in FY23 amid banking crisis, geopolitical tensions",2023-03-22 09:22:00
41, Tata Motors stock price rises on move to hike commercial vehicle prices,2023-03-22 09:22:00
42," Market Live: Receding bank crisis fears; Yellen vows to help | Will Nifty surpass 17,200 mark? | Opening Bell",2023-03-22 09:01:00
43," Market Live: Should You Buy AMC Stocks Now? | Tata Motors, Hind Zinc & Zomato In Focus | Eye on Fed",2023-03-22 08:28:00
44, IBC’s main fault was in setting expectations too high,2023-03-22 08:25:00
45, Systemic credit event in US shadow banks the biggest tail risk for markets,2023-03-22 08:16:00
46, India’s growth will not slow down: RBI Bulletin’s state of the economy report,2023-03-22 08:17:00
47, Chances of a 15% fall if global markets crack; stick to domestics now: Ajay Bagga,2023-03-22 08:27:00
48, Oil's two-day rally snaps near $75 ahead of FOMC decision,2023-03-22 07:54:00
49," Asia rallies as S&P 500 tops 200-DMA and oil surges, eye on FOMC tonight",2023-03-22 07:43:00
50," Closing Bell: Nifty around 17,150, Sensex up 140 points; auto, pharma, PSU banks gain",2023-03-22 16:01:00
51, Stock Market Today: Top 10 things to know before the market opens today,2023-03-22 07:16:00
52," Buzzing Stocks | Tata Motors, SBI Cards, Emami, and others in the news today",2023-03-22 07:10:00
53," Trade Spotlight | How you should trade in CSB Bank, HDFC AMC, HDFC Life today",2023-03-22 06:58:00
54," Hot Stocks | Anant Raj, Nucleus Software, Hariom Pipe Industries may fetch 14-17% return",2023-03-22 06:55:00
55, Saregama India shares spike but further technical uptrend possible only above Rs 360,2023-03-22 06:47:00
56, Commodity Futures | A trendline breakout in Copper,2023-03-22 06:39:00
57, Options Trade | A non-directional options strategy in Ambuja Cements,2023-03-22 06:38:00
58, Cash Market | ABB India breaks out of a classic cup-and-handle pattern,2023-03-22 06:37:00
59, Cash Market | A bullish engulfing at the previous low suggests an upside in Jubilant Foodworks,2023-03-22 06:36:00
60, Cash Market | CG Power shows high relative strength,2023-03-22 06:35:00
61, Wall Street ends green on bank bounce as Fed takes focus,2023-03-22 06:17:00
62, Trade setup for today: Top 15 things to know before the opening bell,2023-03-22 08:47:00
63, Temasek sells Rs 499.4 crore shares in Devyani International,2023-03-21 21:24:00
64,"US stocks pare gains after Powell's remarks; S&P 500, Dow Jones slump 1.6%",2023-03-23 02:19:00
65,"US hikes rates by 25 bps, key highlights from Fed statement",2023-03-23 00:14:00
66,"Deepa Goel sells 10.35 lakh shares in Dhampur Sugar via bulk deals, but buys in Dhampur Bio Organics",2023-03-22 21:29:00
67,"Volatility is here to stay in 2023, Carlyle’s Amit Jain",2023-03-22 20:51:00
68,"Bernstein downgrades two Indian IT companies, cites risk to FY24 growth outlook",2023-03-22 19:29:00
69,Brokerage recommends ‘Buy’ on Radhakishan Damani's DMart. Here's why,2023-03-22 18:39:00
70,Brokerage sees 37% upside in Interglobe Aviation stock. Do you own it?,2023-03-22 18:34:00
71,Quant Pick: Short covering can push Axis Bank stock towards  ₹950 in short term,2023-03-22 17:46:00
72,"Markets stay firm ahead of Fed policy; Auto, healthcare top picks",2023-03-22 16:36:00
73,Hindustan Zinc share price jumps 5% after announcement of 1300% dividend,2023-03-22 16:15:00
74,"This broking firm declares 4th interim dividend, FIIs stake up 5.98% in Q3: Buy sell or add?",2023-03-22 17:07:00
75,Emami shares rise 8% as board mulls buyback plan,2023-03-22 15:50:00
76,Angel One approves fourth interim dividend of  ₹9.60 per share; shares gain 3%,2023-03-22 13:49:00
77,Sobha shares slide over 6% as I-T dept raids real estate developer's office,2023-03-22 13:24:00
78,FOMC meeting: Experts decode US Fed's rate hike impact on Indian stock market,2023-03-22 12:51:00
79,This is why HSBC feels Zomato could rise 64%; should you buy?,2023-03-22 12:03:00
80,"SBI share price may give up to 40% return in long term, says Motilal Oswal",2023-03-22 11:48:00
81,Sumeet Nagar portfolio: Top 5 Stocks,2023-03-22 11:22:00
82,Shipping Corporation of India share jumps as PSU fixes record date for demerger,2023-03-22 10:01:00
83,"Hindustan Zinc dividend: Vedanta to earn  ₹7,132 crore, LIC to get  ₹296 crore",2023-03-22 09:00:00
84,"Global market: SGX Nifty, First Republic Bank to FOMC — key triggers for today",2023-03-22 07:56:00
85,"Stocks to Watch: M&M, LIC, L&T, Hindustan Zinc, Tata Motors",2023-03-22 07:21:00
86,Buy or sell: Vaishali Parekh recommends 3 stocks to buy today — March 22,2023-03-22 06:40:00
87,Day trading guide for today: 4 stocks to buy or sell on Wednesday — 22nd March,2023-03-22 05:57:00
88,Global stock markets rally on signs of stabilizing banking sector,2023-03-22 02:23:00
89,Trader interest in Adani stocks spurted in Nov,2023-03-22 06:17:00
90,JPMorgan owned the LME ‘Nickel’ that was actually bags of stones,2023-03-21 23:09:00
91,Miniratna CPSE Rail Vikas Nigam sets record date for interim dividend,2023-03-21 21:13:00
92,"Stock Radar: Buy Hindustan Unilever for a target of Rs 2700, says Ruchit Jain",2023-03-22 22:00:00
93,Ahead of Market: 10 things that will decide D-Street action on Thursday,2023-03-22 21:06:00
94,4 healthcare stocks slip to a new 52-week low. Do you own any?,2023-03-22 19:29:00
95,Global Surfaces shares debut likely tomorrow. What GMP indicates ahead of listing?,2023-03-22 21:02:00
96,Polar Capital Funds sells KIMS shares worth Rs 144 cr,2023-03-22 20:34:00
97,"Rising demand, higher freight rates augur well for GE Shipping",2023-03-22 20:12:00
98,GameStop soars 53% after reporting first profit in two years,2023-03-22 19:23:00
99,US stocks open flat ahead of Fed rate decision,2023-03-22 19:14:00
100,Market Trading Guide: SRF among 4 stock recommendations for Thursday,2023-03-22 19:46:00
101,Govt to sell 3.5% stake in Hindustan Aeronautics via OFS,2023-03-22 18:54:00
102,Tech View: Nifty forms small red candle. What should traders do on Thursday expiry,2023-03-22 17:42:00
103,Why Mark Mobius is not concerned about pricey valuations of Indian markets,2023-03-22 18:29:00
104,US Fed meet: Why it is important and what to expect from Jerome Powell amid banking crisis,2023-03-22 17:24:00
105,Fed meeting outcome today: 3 scenarios that can play out for Nifty bulls,2023-03-22 17:31:00
106,Value picks? 11 Street favourite stocks with less-than-industry PE levels,2023-03-22 17:16:00
107,"GameStop jumps after swinging to profit, ignites rally in meme stocks",2023-03-22 16:41:00
108,Rekha Jhunjhunwala and family is the richest among new billionaires in India,2023-03-22 16:37:00
109,Nithin Kamath's advice on 'risk-free' investments amid Credit Suisse and US banking crisis,2023-03-22 16:17:00
110,"Markets end higher ahead of key US Fed interest rate decision; Sensex rises 140 pts, Nifty tops 17,150",2023-03-22 16:58:00
111,"Angel One declares 4th interim dividend of Rs 9.6/share, fixes record date",2023-03-22 15:51:00
112,"Sensex rises for 2nd day, ends 140 pts higher; Nifty tops 17,150; all eyes on Fed policy outcome",2023-03-22 16:00:00
113,2023 M3M Hurun Global Rich List: Indian billionaires richest against their global peers in these 5 sectors,2023-03-22 15:44:00
114,International Finance Corp to buy 5.6% stake in JK Tyre for $30 million,2023-03-22 14:56:00
115,This smallcap stock zooms over 18%. Here's why,2023-03-22 14:47:00
116,"Hindustan Zinc's Rs 11,000 crore dividend to offer relief for Vedanta. But at what cost?",2023-03-22 14:16:00
117,Ace investor Rakesh Jhunjhunwala posthumously awarded Padma Shri,2023-03-22 20:13:00
118,"2023 M3M Hurun Global Rich List: Jeff Bezos lost more wealth than Adani, Ambani combined",2023-03-22 13:47:00
119,"Gautam Adani lost Rs 3,000 cr every week over last 1 yr, wealth down 60% from peak",2023-03-22 13:58:00
120,Sula Vineyards shares soar 9%. Here's why,2023-03-22 12:49:00
121,On a path to recovery; 5 mid-cap pharma stocks with an upside potential up to 41%,2023-03-22 14:33:00
122,Smallcaps that managed to keep their head above water. 4 stocks with “Strong Buy” & “Buy” reco that can rally up to 59%,2023-03-22 16:49:00
123,Traders guide; A capital good major and tyre maker making for breakout trade,2023-03-22 12:01:00
124,Blackstone sweetens delisting offer for R Systems International,2023-03-22 12:01:00
125,Hindustan Zinc stock rises 5% after declaring 1300% dividend,2023-03-22 12:41:00
126,A white good major ready to slip and infra major with sideways option,2023-03-22 11:32:00
127,Disappointing debutants! 10 of 11 recent IPOs trade below issue price,2023-03-22 11:13:00
128,These bank stocks can give 20-50% returns,2023-03-22 11:10:00
129,"20,000% gain! This multibagger stock has turned Rs 10,000 into Rs 20 lakh in 20 years",2023-03-22 11:47:00
130,Emami jumps 7% on share buyback plan,2023-03-22 10:59:00
131,Sobha shares plunge 4% as Income Tax department raids premises,2023-03-22 10:52:00
132,Triveni Turbine among 10 smallcap stocks that are near buy point,2023-03-22 10:46:00
133,"Hot Stocks: Brokerages view on Manappuram Finance, Bharti Airtel and Pidilite Industries",2023-03-22 10:15:00
134,IT stocks vs bank stocks: FII buy-sell data after bank crisis springs up a surprise,2023-03-22 10:06:00
135,"Sensex up 250 pts, Nifty above 17,150; Adani Green jumps 5%, HCL Tech 2%",2023-03-22 09:39:00
136,Stocks to buy today: 6 short-term trading ideas by experts for 22 March 2023,2023-03-22 09:36:00
137,"Sensex rises over 250 pts ahead of Fed policy outcome; Nifty above 17,150",2023-03-22 11:57:00
138,"F&O Ban: Biocon, IB Housing Finance under ban for trade on Wednesday",2023-03-22 09:06:00
139,"Buy or Sell: Stock ideas by experts for March 22, 2023",2023-03-22 09:03:00
140,Markets eke out gains ahead of US Fed rate decision; banking stocks rise,2023-03-23 00:00:00
141,Long-term prospects to strengthen investment in life insurance stocks,2023-03-22 00:00:00
142,"AIF applications pile up due to rejig at Sebi, even as regulator turns wary",2023-03-22 00:00:00
143,Charting the Fed rate-hike path its and impact on the stock market,2023-03-22 00:00:00
144,"Gold price tumbles Rs 480, silver declines Rs 345: HDFC Securities",2023-03-22 00:00:00
145,Anupam Rasayan hits 6-month high; zooms 40% in 5 weeks on strong outlook,2023-03-22 00:00:00
146,"Gautam Adani lost Rs 3,000 crore a week in 2022-23: M3M Hurun report",2023-03-22 00:00:00
147,"Sobha slips 5%, nears 52-week low on raid by Income-Tax department",2023-03-22 00:00:00
148,VST Tillers zooms 18% on achieving 5L production milestone at Malur unit,2023-03-22 00:00:00
149,Sula Vineyards jumps 9% as CLSA initiates coverage with 'Buy' rating,2023-03-22 00:00:00
150,Emami soars 7% as board to consider share buyback on March 24,2023-03-22 00:00:00
151,Hindustan Zinc surges 5% on announcing liberal interim dividend,2023-03-22 00:00:00
152,"Sensex rises 140 pts, Nifty holds 17,100 ahead of US Fed outcome; PSBs lead",2023-03-22 00:00:00
153,"Stocks to Watch: Tata Motors, IOC, Hind Zinc, Sonata Software, Bandhan Bank",2023-03-22 00:00:00
