,Headline,Date
0,Nifty Feb futures at premium against Nifty 50. What to expect on F&O expiry day?,"22 Feb 2023, 09:07 PM IST"
1,"FIIs flare bear market, sells  ₹580 cr in Indian stocks; DIIs turn net buyers","22 Feb 2023, 08:36 PM IST"
2,Only 1 Sensex stock ends in the green; 266 BSE stocks hit 52-week low,"22 Feb 2023, 08:24 PM IST"
3,Investors lose over  ₹6.97 lakh cr in 4 days selloff; can GDP data revive?,"22 Feb 2023, 05:52 PM IST"
4,Bloodbath on Street: Market post biggest losses in 5 months ahead of F&O expiry,"22 Feb 2023, 05:05 PM IST"
5,"Adani Group stocks post worst day in two weeks as investors lose  ₹51,294 crore","22 Feb 2023, 04:09 PM IST"
6,These 3 banking stocks give multibagger return in 6 months. Do you own?,"22 Feb 2023, 01:47 PM IST"
7,"Adani Enterprises tumbles 11%, other group stocks bleed after Wikipedia's claim","22 Feb 2023, 01:07 PM IST"
8,"Gujarat Fluoro, Deepak Nitrite, SRF: Which specialty chemical stocks to buy/hold","22 Feb 2023, 12:35 PM IST"
9,Three stocks that pay big final dividends. Add them to your watchlist,"22 Feb 2023, 11:31 AM IST"
10,"Nifty, Sensex down over 1% each: Factors pulling the market down","22 Feb 2023, 02:10 PM IST"
11,IRB Infra shares trade ex-split of 1:10; stock rises,"22 Feb 2023, 11:25 AM IST"
12,Delhivery shares tank on block deal buzz after rallying for 7 straight days,"22 Feb 2023, 10:03 AM IST"
13,How NSE's extension of stock market trading hours will help retail investors,"22 Feb 2023, 10:50 AM IST"
14,"Global market update: SGX Nifty, Asia follow weak cues from Wall Street","22 Feb 2023, 07:31 AM IST"
15,"Stocks to Watch: Adani Transmission, HDFC Bank, Zee, Paytm, IRB Infra","22 Feb 2023, 07:28 AM IST"
16,Vodafone Idea stock under F&O ban on NSE today. Details here,"22 Feb 2023, 07:29 AM IST"
17,"Day trading guide for Wednesday: Infosys, CG Pwr, IEX among stocks to buy today","22 Feb 2023, 06:53 AM IST"
18,Wall Street posts worst day of 2023 on higher-for-longer rate fears,"22 Feb 2023, 03:25 AM IST"
19,NSE extends trading hours for interest rate derivatives till 5pm,"22 Feb 2023, 02:38 AM IST"
20,Ahead of Market: 10 things that will decide D-St action on Thursday,"Feb 22, 2023, 09:13 PM IST"
21,US stocks edge higher as investors focus on Fed minutes,"Feb 22, 2023, 08:14 PM IST"
22,Trading Guide: Alembic Pharma among 5 stock recommendations for Thursday,"Feb 22, 2023, 07:24 PM IST"
23,"Baidu beats fourth-quarter revenue estimates, flags chatbot launch","Feb 22, 2023, 07:52 PM IST"
24,FDI equity inflows decline 15% to $36.75 bn in Apr-Dec FY23,"Feb 22, 2023, 07:30 PM IST"
25,MSCI’s India stock gauge enters correction amid Adani selloff,"Feb 22, 2023, 07:15 PM IST"
26,This smallcap cement stock climbs 5% after board approves stock split,"Feb 22, 2023, 06:39 PM IST"
27,"Blue Star, IRB Infra among 7 stocks that defied bearish mood on Street to hit 52-week highs","Feb 22, 2023, 06:11 PM IST"
28,Tech View: Nifty support shifts to Budget day low. What should traders do on Thursday expiry,"Feb 22, 2023, 05:40 PM IST"
29,"IBS Software acquires AFLS, enters air and ocean freight sector","Feb 22, 2023, 05:51 PM IST"
30,Sebi proposes to introduce 5 new categories under ESG funds,"Feb 22, 2023, 04:53 PM IST"
31,JM Financial initiates coverage on Delhivery with a target price of Rs 350,"Feb 22, 2023, 03:58 PM IST"
32,"Sensex tanks 928 pts, Nifty settles below 17,600; Adani Ent plunges 11%","Feb 22, 2023, 03:51 PM IST"
33,Five sectoral trends from India Inc's third quarter report card,"Feb 22, 2023, 03:45 PM IST"
34,UK overtakes India as the world’s sixth-biggest equity market,"Feb 22, 2023, 03:28 PM IST"
35,Adani Enterprises stock tanks over 12% as selling pressure intensifies,"Feb 22, 2023, 02:50 PM IST"
36,Indian mutual funds are favouring more cash; here’s why,"February 22, 2023 08:42 PM IST"
37,Mahindra CIE Automotive Q4 profit grows 153% to Rs 195 crore,"February 22, 2023 08:13 PM IST"
38,Hotel room rates shoot up as demand outpaces supply: Stocks to watch,"February 22, 2023 06:06 PM IST"
39,"Easing margin pressures, uptick in US sales saving grace for pharma firms in Q3","February 22, 2023 05:58 PM IST"
40,"SEBI ED urges India Inc to let go of ‘litigation mindset’, find other ways to resolve disputes","February 22, 2023 05:32 PM IST"
41,"Technical View | Nifty breaks long support trendline; 17,500 is crucial","February 22, 2023 05:15 PM IST"
42,"MC A10 index falls over 8% as Adani Enterprises weighs heavy; another Rs 50,000 crore gone","February 22, 2023 05:02 PM IST"
43,"Sensex tanks over 928 points, 250 stocks hit lower circuit","February 22, 2023 04:22 PM IST"
44,Gainers & Losers: 10 stocks that moved the most on February 22,"February 22, 2023 04:17 PM IST"
45,"OMCs face Rs 5,000 crore in under-recovery in Q4FY23: Nomura","February 22, 2023 04:01 PM IST"
46,"LIVE: Bajar Gupshup | Feb 22, 2023","February 22, 2023 03:57 PM IST"
47,"Taking Stock | Rate hike worries sink market; Sensex crashes 928 points, Nifty slips below 17,760","February 22, 2023 04:49 PM IST"
48,"Moneycontrol Pro Panorama | Markets show signs of fatigue, traders and investors cautious","February 22, 2023 02:41 PM IST"
49,Nifty breaks 200-day moving average but still maintains the Budget day low,"February 22, 2023 02:43 PM IST"
50,"See some steam for defence-related stocks, PSBs have topped out: Amit Jeswani","February 22, 2023 03:35 PM IST"
51,ITI shares rally 6% after Rajesh Rai takes charge as CMD,"February 22, 2023 02:04 PM IST"
52,3 big announcements in 3 days: What’s causing all the buzz in auto-ancillary sector?,"February 22, 2023 01:55 PM IST"
53,"F&O Buzzer: Adani Ports, Adani Enterprises sink as bears rack up positions","February 22, 2023 02:26 PM IST"
54,Commodities Live: Natural gas prices fall under $2.2/MMBTu. Prices at 28-month lows,"February 22, 2023 01:01 PM IST"
55,Market outlook ranges from hard to soft to a no landing scenario,"February 22, 2023 12:44 PM IST"
56,Why the IT sector calls for an upgrade now,"February 22, 2023 12:26 PM IST"
57,"Stock Market Live: Nifty skids below 17,700; All sectors in red led by PSU banks |Mid-day Mood Check","February 22, 2023 12:26 PM IST"
58,Heat wave is good news for Voltas shareholders; Jefferies sees 20% upside,"February 22, 2023 12:13 PM IST"
59,Why selective extension of trading hours is good for Indian market participants,"February 22, 2023 11:33 AM IST"
60,Rs 3.88 lakh crore of investor money gone! What spooked market today? Six factors,"February 22, 2023 03:52 PM IST"
