,Headline,Date
0, Trade setup for Friday: Top 15 things to know before the opening bell,2023-03-09 23:58:00
1," Aptus Value Housing Finance is 30% below IPO price, time to heed Ambit's contrarian call?",2023-03-09 20:21:00
2, Block Deals: Goldman Sachs among those that bought stake in Gokaldas Exports,2023-03-09 20:12:00
3," Analyst Call Tracker: Once a market darling, what is driving pessimism in Asian Paints?",2023-03-09 17:59:00
4, Power stocks: Hot picks for investors right now?,2023-03-09 17:45:00
5," MC A10 Index snaps six-day winning run, drops 3% led by Adani Enterprises",2023-03-09 17:16:00
6," Technical View | Nifty forms Bearish Engulfing pattern, 17,650 vital for upside",2023-03-09 17:16:00
7, Gainers & Losers: 10 stocks that moved the most on March 9,2023-03-09 16:35:00
8, JBM Auto stock hits 52-week high after announcement on EV fleet enhancement in Maharashtra budget,2023-03-09 15:58:00
9," Taking Stock | Market back to losing ways; Sensex down 542 points, Nifty slips below 17,600",2023-03-09 16:03:00
10," Stock Market Live: Nifty & Sensex reverse gains | Tata Steel, Bharti Airtel & Home First in focus",2023-03-09 15:28:00
11, Moneycontrol Pro Panorama | Electric Vehicles de-FAMEd!,2023-03-09 15:27:00
12, Manappuram Finance climbs for the 4th day. Will the uptrend continue?,2023-03-09 15:04:00
13," RITES shares gain over 5% to 3-month high, experts hope for more upside",2023-03-09 14:35:00
14," Auto ancillaries outrun OEMs amid flurry of deals, improved outlook",2023-03-09 13:45:00
15," Sebi extends deadline till March 15 to submit public comments on proposal on REITs, InvITs sponsors",2023-03-09 12:42:00
16," Home First Finance sees steepest fall in over 15 months after block deal, Bessemer Capital likely seller",2023-03-09 12:51:00
17, F&O Buzzer: Adani Group stocks tumble as traders book profits; Adani Enterprises hit hardest,2023-03-09 12:34:00
18, HDFC Securities initiates rating Syrma SGS Technology with a 'buy' tag,2023-03-09 11:53:00
19, Motilal Oswal cuts M&M FY24 earnings by 8% but maintains buy rating,2023-03-09 19:25:00
20," Surprising divergence in Feb auto volumes; tractor sales zoom ahead, two-wheeler putters along",2023-03-09 11:31:00
21, Time to stock up on Indian metals? Here are Jefferies top picks,2023-03-09 11:31:00
22, Religare Enterprises shares gain post one-time settlement with lenders,2023-03-09 11:00:00
23," F&O Manual | Bears harden the grip, some traders see steeper declines in Nifty",2023-03-09 10:48:00
24, SeQuent Scientific zooms 20% on terminating Tineta Pharma acquisition,2023-03-09 16:21:00
25, Gold Prices Today: Yellow metal to remain under pressure as Fed remains hawkish,2023-03-09 10:25:00
26, All you need to know about Warren Buffett’s latest annual letter to shareholders,2023-03-09 10:21:00
27, CLSA expects 31% upside in Bharti Airtel stock price driven by rising tariffs,2023-03-09 10:33:00
28, Alembic Pharma shares rise on FDA nod to depressive disorder pills,2023-03-09 10:05:00
29, Bharat Forge gains 1% as e-mobility arm kicks off its first electric bike unit,2023-03-09 15:45:00
30," Asian shares stutter, dollar buoyant as data supports hawkish Jerome Powell",2023-03-09 09:19:00
31, LIVE: Metal stocks may provide the required support | Adani Group remains in focus,2023-03-09 09:02:00
32, Thermal power capacity addition hits multi-year lows amid rising demand,2023-03-09 09:08:00
33, Chart of the Day: How we see other nations is very different from how they see us,2023-03-09 12:50:00
34," Market Live: Nifty set to reclaim 17,800; Bharat Forge, SBI, Adani Stocks in focus",2023-03-09 08:26:00
35, Data Patterns gains after floating QIP to raise Rs 450 crore,2023-03-09 10:00:00
36, Gokaldas Exports falls after block deal in 62.8 lakh shares; Clear Wealth Consultancy likely seller,2023-03-09 10:11:00
37," Closing Bell: Nifty ends below 17,600, Sensex falls 542 pts; auto, realty, IT worst hit",2023-03-09 16:02:00
38, Start-up Street: Outlook of venture capitalists poised for a change in 2023,2023-03-09 07:52:00
39, Stock Market Today: Top 10 things to know before the market opens today,2023-03-09 07:20:00
40," Daily Voice | Inflation, interest rates, general elections in 2024 would be key driving factors going ahead, says this head of investments",2023-03-09 07:13:00
41," Buzzing Stocks: Bharat Forge, Kirloskar Oil, Ramkrishna Forgings and others in news today",2023-03-09 07:08:00
42, Oil near flat as US crude stock draw contends with economic concerns,2023-03-09 07:02:00
43," Trade Spotlight | What's your strategy for PNB Housing Finance, BHEL, GE Shipping today?",2023-03-09 07:01:00
44," Hot Stocks | Bet on Bosch, Neuland Lab, NCC for up to 17% return in short term",2023-03-09 06:55:00
45, Commodity Futures | Natural Gas price is sustaining below trendline support,2023-03-09 06:42:00
46, Currency Options | A low-risk and high-probability options strategy in currency pair USDINR,2023-03-09 06:41:00
47, Cash Market | BHEL shows a breakout of a downsloping wedge pattern,2023-03-09 06:39:00
48, Options Trade | A non-directional options strategy in IndusInd Bank,2023-03-09 06:38:00
49, Cash Market | KRBL is ready for a breakout,2023-03-09 06:36:00
50,"AEL falls as promoters pledge shares, Care reduces outlook",2023-03-10 00:17:00
51,Gokaldas Exports drops over 3% as Goldman Sachs bought majority stake,2023-03-09 22:04:00
52,"Which life insurance stocks to buy in March? LIC, SBI Life, or ICICI Life",2023-03-09 21:39:00
53,"Multibagger stock declares 1:4 bonus issue & stock split, up 1000% in 1 year",2023-03-09 20:43:00
54,"Sebi extends deadline to submit public comments on proposal on REITs, InvITs sponsors",2023-03-09 19:15:00
55,US stock futures slip ahead of key jobs data: Markets wrap,2023-03-09 19:15:00
56,"After 4 days of buying, FIIs turn net sellers over Fed's hawkish tone",2023-03-09 18:38:00
57,Realty penny stock hit 5% upper circuit as Board declares 1:1 bonus shares,2023-03-09 18:01:00
58,"Summer stocks to buy: Jefferies bets on Havells, SI, other midcap stocks",2023-03-09 18:18:00
59,Why did small cap stock Sequent Scientific hit 20% upper circuit today?,2023-03-09 17:45:00
60,"IT stock sets record date for 4:1 bonus shares, scrip up 105% from 52-week-low",2023-03-09 17:25:00
61,"Markets halt 3-days rally: Sensex below 60k; M&M, RIL, Bajaj Finserv top losers",2023-03-09 17:17:00
62,Treasury yield curve inverts briefly: Will it impact India's GDP growth in FY24?,2023-03-09 16:12:00
63,NSE warns stock investors: A man robbing money with promise of assured returns,2023-03-09 15:29:00
64,This bank stock gives 113% return in 6 mths. ICICI Securities recommends ‘Buy’,2023-03-09 15:22:00
65,Auto stocks dip amid rising inflation and weak exports; what is the road ahead?,2023-03-09 14:49:00
66,"Tata Steel, Hindalco: Jefferies sees buying opportunity after underperformance",2023-03-09 13:35:00
67,PNB Housing shares hit 52-week high on second day in a row. Buy or sell?,2023-03-09 13:24:00
68,M&M shares dip over 2% after brokerage lowers FY24 EPS outlook by 8%,2023-03-09 13:11:00
69,"With 9% dividend yield in FY23, this stock beats PPF, EPF, bank FD returns",2023-03-09 12:28:00
70,"Gladiator stock: Near its 52-week high, HAL may gain up to 14%",2023-03-09 11:55:00
71,Multibagger stock: Manish Goel sees big upside despite 100% jump in a month,2023-03-09 13:02:00
72,Sirca Paints India among HDFC Securities top 3 fundamental picks,2023-03-09 10:48:00
73,Top performing midcap stocks of 2023 so far,2023-03-09 10:42:00
74,Adani Enterprises plunges after ASM framework; 5 group stocks hit upper circuit,2023-03-09 10:57:00
75,Gokaldas Exports share price slides 4% on equity block deal buzz,2023-03-09 11:06:00
76,Non-Convertible Debentures (NCDs): Are they attractive? Should you opt for it?,2023-03-09 09:50:00
77,"Data Patterns shares surge on QIP launch. Date, floor price, key details here",2023-03-09 09:47:00
78,Divgi TorqTransfer Systems IPO allotment date today. How to check status online,2023-03-09 08:10:00
79,Global market update: SGX Nifty to Dow Jones — top factors that may dictate D-St,2023-03-09 07:28:00
80,Buy or sell: Vaishali Parekh recommends 3 stocks to buy today — March 9,2023-03-09 06:36:00
81,Day trading guide for today: 4 stocks to buy or sell on Thursday — 9th March,2023-03-09 05:53:00
82,DMart shares down over 40% from all-time high: Buy on the dip?,2023-03-08 23:16:00
83,NSE imposes additional surveillance mechanism framework for these Adani stocks,2023-03-08 22:23:00
84,Shorter-dated US yields fall after initial jobless claims,2023-03-09 22:32:00
85,Ahead of Market: 10 things that will decide D-Street action on Friday,2023-03-09 21:35:00
86,These 4 midcap stocks record a new 52-week high,2023-03-09 20:11:00
87,"Japan revises GDP to nearly flat, showing fragile recovery",2023-03-09 21:13:00
88,Promoter entity sells 10% stake in Gokaldas Exports for Rs 235 crore in block deals,2023-03-09 21:01:00
89,Bira 91 raises $10 million from Japan's MUFG Bank,2023-03-09 20:44:00
90,Japan MPC meet: World markets await 'final' surprise from BOJ Governor Kuroda’s last meeting,2023-03-09 20:25:00
91,US venture capital firm exits Home First Fin via sale of 8% stake in open market,2023-03-09 20:20:00
92,Trading Guide: SBI Card among 3 stock recommendations for Friday,2023-03-09 19:45:00
93,"Wall Street climbs as jobless claims rise, payrolls data in focus",2023-03-09 22:22:00
94,"Up 950% in 1 Year: This multibagger stock announces stock split, bonus issue",2023-03-09 18:58:00
95,Murphy's Law test! Zee Entertainment can rally 63%: JM Financial,2023-03-09 17:06:00
96,Tech View: Nifty charts hint at bearish reversal. What should traders do on Friday,2023-03-09 17:00:00
97,Angel One's client base swells 52.2% YoY to 13.33 million in Feb'23,2023-03-09 16:30:00
98,"Sensex snaps 3-day winning streak, falls 542 pts on US rate jitters",2023-03-09 16:15:00
99,Kotak Bank has small exposure to Adani; issues afflicting group more valuations-oriented,2023-03-09 16:07:00
100,"Sensex resumes downtrend, slumps 542 pts; Nifty slips below 17,600; M&M falls 3%, RIL 2%",2023-03-09 15:50:00
101,More Adani group shares pledged,2023-03-09 15:49:00
102,ONGC's dividend per share expected to be in double-digits till FY26. Should you buy?,2023-03-09 15:34:00
103,Demat accounts to be frozen if nominee not added by March 31. Check how to apply,2023-03-09 15:15:00
104,"Sebi extends deadline till Mar 15 to submit public comments on proposal on REITs, InvITs sponsors",2023-03-09 14:18:00
105,"Reliance Jio arm buys Mimosa Networks for USD 60 million on debt, cash free basis",2023-03-09 13:06:00
106,Metal stocks climb up to 5% amid signs of recovery in China,2023-03-09 12:58:00
107,"Religare Finvest puts an end to legacy issues, completes one-time settlement with lenders",2023-03-09 12:45:00
108,"Midcap stocks with ‘strong buy’ & ‘buy’ reco which can rally over 25%, according to analysts",2023-03-09 12:16:00
109,Multibagger smallcap stock falls over 4% amid block deal,2023-03-09 12:01:00
110,Stocks which have beaten volatility and negative news flow: 7 large cap stocks with an upside potential up to 23%,2023-03-09 11:35:00
111,"Stock Radar: Buy Firstsource Solutions for a target of Rs 121-127, says Ruchit Jain",2023-03-09 11:35:00
112,Adani Enterprises stock down over 6% as CARE Ratings downgrades outlook to negative,2023-03-09 11:26:00
113,"Rs 5,900 crore-stroke? Consumer durable stocks feel heat of cost rise, demand meltdown",2023-03-09 11:28:00
114,Kirloskar Oil shares rise 4% after Kulkarni family sells 18% stake,2023-03-09 10:45:00
115,A defence stock for a long trade for next three to four sessions,2023-03-09 10:39:00
116,"Hot Stocks: Brokerage view on TCS, M&M and Bharti Airtel",2023-03-09 10:20:00
117,Reliance Jio's Radisys to buy Mimosa Networks for $60 million,2023-03-09 10:21:00
118,"Chart Check: 30% since February! Should you buy, sell or hold Sonata Software?",2023-03-09 10:13:00
119,Stocks to buy today: 9 short-term trading ideas by experts for 9 March 2023,2023-03-09 10:08:00
120,Adani bears thrown out? Rally on for 7th day as 5 stocks hit 5% upper circuit,2023-03-09 13:35:00
121,Trader's Guide: 2 stocks with 8% upside potential,2023-03-09 09:49:00
122,"Sensex flat, Nifty tests 17,750; Adani Ent up 5%",2023-03-09 09:45:00
123,"Sensex falls 200 pts on weak global cues; Nifty below 17,700",2023-03-09 10:11:00
124,Ashok Leyland among 8 preferred mid & smallcap stocks from Motilal Oswal,2023-03-09 09:00:00
125,"Buy or Sell: Stock ideas by experts for March 09, 2023",2023-03-09 08:48:00
126,Buffett Indicator falls below 100%. Is Nifty blinking buy now?,2023-03-09 08:45:00
127,"Stocks in focus: Bharat Forge, SBI and more",2023-03-09 08:42:00
128,Momentum pick: MGL hits 52-week high; can offer gains worth up to Rs 200/share,2023-03-09 08:39:00
129,"Asian shares stutter, dollar buoyant as data supports hawkish Powell",2023-03-09 08:04:00
130,"US stock market: US stocks mixed as investors eye upcoming jobs data, rate hikes",2023-03-09 07:49:00
131,Sebi mulls PCVs to offer long funding,2023-03-09 06:52:00
132,Getting the jitters: Indices slip nearly 1% on renewed rate hike fears,2023-03-09 00:00:00
133,"Valuation of India's premium to EMs and world market shrinks, shows data",2023-03-09 00:00:00
134,Sebi announces reward mechanism for informants providing tips on defaulters,2023-03-09 00:00:00
135,"Under heavy selling, Sensex snaps 3-day winning run; falls 540 points",2023-03-09 00:00:00
136,Four Adani Group stocks hit upper circuit today: All you need to know,2023-03-09 00:00:00
137,"How to approach IT stocks amid tighter monetary policy, recession fears?",2023-03-09 00:00:00
138,Aptus Value down 13% in 2 days as it denies merger talks with Cholamandalam,2023-03-09 00:00:00
139,"Sebi extends deadline till Mar 15 to submit comments on REITs, InvITs",2023-03-09 00:00:00
140,Stock of this electric bus manufacture has zoomed 68% in 10 trading days,2023-03-09 00:00:00
141,Treasury yield curve inverts: What it means and what does it signal?,2023-03-09 00:00:00
142,"Triveni, Renuka: Sugar stocks rebound, may further see up to 17% rise",2023-03-09 00:00:00
143,"Adani Enterprises, ACC: Time to sell Adani group stocks after a sharp run?",2023-03-09 00:00:00
144,SeQuent Scientific rallies 15% on terminating pact to acquire Tineta Pharma,2023-03-09 00:00:00
145,"NTPC rallies 7% in 4 days, nears 52-week high on strong growth outlook",2023-03-09 00:00:00
146,Jindal Saw hits over 5-year high; zooms 94% in 3 months on healthy outlook,2023-03-09 00:00:00
147,Gokaldas Exports dips 4% after 13% equity changes hands via block deal,2023-03-09 00:00:00
148,"Stocks to Watch: Bharat Forge, Shoppers Stop, Gokaldas, Lotus Chocolate",2023-03-09 00:00:00
149,"Sensex snaps 3-day winning run, falls 542 pts; Nifty gives up 17,600",2023-03-09 00:00:00
150,Sebi puts restrictions on cos opting share buyback via stock exchange route,2023-03-09 00:00:00
