,Headline,Date
0, Trade setup for Thursday: Top 15 things to know before the opening bell,2023-03-15 22:03:00
1, F&O Manual: Traders suggest to go short as momentum remains weak,2023-03-15 17:51:00
2," Technical View | Nifty closes at five-month low, may take support at 16,900-17,000 zone",2023-03-15 17:48:00
3, Breaking the shackles of inflation targets,2023-03-15 17:16:00
4, Does the historic fall in the 2-year treasury bill mean a big correction is coming soon?,2023-03-15 16:58:00
5, Gainers & Losers: 10 stocks that moved the most on March 15,2023-03-15 16:28:00
6," Indian Energy Exchange jumps over 4%, further momentum likely above 200-day EMA",2023-03-15 16:10:00
7," LIVE: Nifty slips beyond 17,000 mark | Metal share holds grip | IT sector in focus",2023-03-15 17:42:00
8," Taking Stock | Market loses further ground; Nifty below 17,000; Sensex falls 344 points",2023-03-15 16:36:00
9," KEC International gains 3% on orders worth Rs 1,028 cr across business verticals",2023-03-15 14:58:00
10, Moneycontrol Pro Panorama | Investing in a structurally weak market,2023-03-15 15:02:00
11," Seven facts about GQG Partners, the firm rescuing Adani companies from Hindenburg onslaught",2023-03-15 15:53:00
12, Dreamfolks Services rises 4% on pact with Visa Worldwide,2023-03-15 14:29:00
13," SVB collapse not a Bear Stearns moment, it’s more of an IL&amp;FS moment, says Mark Matthews",2023-03-15 18:36:00
14," Midcap Magic: Kaynes Technology, the Gundappa Vishwanath of electronics manufacturing, poised for long-term growth",2023-03-15 15:31:00
15, Reliance Jio may cut Bharti Airtel tariff premium to 33% with postpaid tariff hike: CLSA,2023-03-15 13:39:00
16, Commodities Live: Metals gain as USD holds down | Investors bet on China,2023-03-15 13:34:00
17, Cash Market | SRF shows a breakout of an inverse head and shoulder reversal pattern,2023-03-15 13:29:00
18, KPIT Tech gains 7 percent on alliance with Honda,2023-03-15 13:24:00
19," Udayshivakumar Infra to float IPO on March 20, aims to raise Rs 66 crore",2023-03-15 13:23:00
20," Global Surfaces IPO final day sees investors booking 12.21 times, QIB portion 9 times",2023-03-15 18:50:00
21, Citi sees 45% upside in Maruti Suzuki on market share gains,2023-03-15 12:42:00
22," Adrian Mowat on Silicon Valley Bank collapse, Fed expectations & view on India | MC Exclusive LIVE",2023-03-15 12:28:00
23, Voltas to consider price hikes in April; Nomura sees 25% upside,2023-03-15 12:26:00
24, This small-cap stock gains 11%; hits 52-week high on supply order from Middle East,2023-03-15 12:43:00
25, SVB fallout: Nazara Tech's subsidiaries transfer most of its cash deposits to external bank accounts,2023-03-15 17:34:00
26, HPCL spurts 1.30% on Chevron lubricants deal,2023-03-15 12:09:00
27," LTIM targets $1 billion in incremental revenue post-merger, what do brokerages say?",2023-03-15 12:26:00
28, Cipla shares gain as co to sell majority stake in Uganda subsidiary,2023-03-15 11:56:00
29, Nickel ‘alchemist’ Xiang Guangda aims to work his magic on batteries,2023-03-15 11:18:00
30, Paras Defence stock gains on signing pact with Israel's CONTROP,2023-03-15 11:10:00
31, Paint stocks: Should Asian Paints and Berger fear Grasim’s entry?,2023-03-15 11:07:00
32, NBCC (India) shares rise 3% after bagging Rs 500-cr order from Puducherry,2023-03-15 10:50:00
33, World's 5th largest multiplex chain now also a fast food giant: Should you bet on PVR-Inox?,2023-03-15 11:58:00
34," Sona BLW: Despite Blackstone’s exit, analysts see 25-35% upside in the stock",2023-03-15 10:28:00
35, F&O manual | Some recovery is visible but traders suggest to wait for long addition,2023-03-15 10:28:00
36, Electronics manufacturing gets a fresh Rs 765-crore PLI scheme: Report,2023-03-15 10:13:00
37," Titagarh Wagons, Ramkrishna Forgings gain after consortium bags forged wheels order",2023-03-15 14:46:00
38," CPI: If the Fed fails to raise rates, it will be a sign of panic",2023-03-15 09:56:00
39," PNC Infratech bids Rs 1,260 crore for highway project, shares gain 5%",2023-03-15 09:43:00
40, RailTel Corp races 5% on bagging Rs 287.57-crore contract,2023-03-15 09:36:00
41, Why we see Persistent Systems emerging as a winner,2023-03-15 09:35:00
42," Asian shares gain as fears about rapid Fed hikes, bank crisis fade",2023-03-15 09:35:00
43," Hospitals' defensive credentials on display, but investment risks abound",2023-03-15 09:57:00
44, Daily Voice | Why this strategist is alert on FIIs amid fresh financial uncertainty triggered by SVB,2023-03-15 09:22:00
45," The Day After: Of bank runs, failures and bailouts",2023-03-15 11:20:00
46," Stock Market Live: Will IT stocks stage a bounce back? Nifty defends 17,000 mark | Opening Bell",2023-03-15 09:00:00
47, The defunct economics that drives US monetary policy,2023-03-15 08:44:00
48," Market Live: Nifty in oversold zone? US Core CPI still hot; What will Fed do? | RIL, Cipla in focus",2023-03-15 08:26:00
49," Oil prices bounce back, helped by stronger OPEC outlook for China",2023-03-15 07:45:00
50," Closing Bell: Nifty ends below 17,000, Sensex falls 344 pts; PSU banks drag, metals gain",2023-03-15 16:15:00
51," Mutual funds added IT and new-age tech stocks in February, sold banks",2023-03-15 07:18:00
52, Stock Market Today: Top 10 things to know before the market opens today,2023-03-15 07:07:00
53, Cash Market | DLF can be a medium term buy,2023-03-15 07:00:00
54," Buzzing Stocks: Cipla, RailTel Corporation, LIC Housing Finance, and others in news today",2023-03-15 07:00:00
55, Commodity Futures | Consolidation breached in Crude Oil,2023-03-15 06:59:00
56, Cash Market | A high probability buying trade in United Spirits (Mcdowell),2023-03-15 06:59:00
57, Options Trade | A non-directional options strategy in Power Grid Corporation of India,2023-03-15 06:58:00
58," Trade Spotlight | How should you trade in EIH, Mahindra CIE Automotive, NMDC today?",2023-03-15 06:46:00
59," Hot Stocks | Bet on Sonata Software, Cigniti Tech, Poly Medicure for up to 18% return",2023-03-15 06:31:00
60," Wall Street ends green as inflation cools, bank jitters ebb",2023-03-15 06:04:00
61," Quant MF, Sageone Investment Managers pick shares worth Rs 37 crore in Divgi Torqtransfer Systems; Morgan Stanley exits",2023-03-14 23:14:00
62, Trade setup for today: Top 15 things to know before the opening bell,2023-03-15 06:07:00
63,"Global markets: US, European stocks drop as Credit Suisse renews banking crisis fears",2023-03-16 02:37:00
64,T-bill yields fall back below 10-year bond,2023-03-15 22:14:00
65,Fed traders price in 100 basis points of rate cuts from May peak,2023-03-15 21:15:00
66,Board of JSW Energy authorizes issuance of NCDs to raise  ₹250 Cr,2023-03-15 20:58:00
67,Regional bank chaos clouds outlook for markets,2023-03-15 20:37:00
68,Realty stock hit 5% lower circuit post record date revised for 1:1 bonus issue,2023-03-15 20:18:00
69,Multibagger stock hit 52-week-high as Board sets record date for 3:1 bonus share,2023-03-15 19:27:00
70,"LIC sells 2% stake in NMDC, garners over  ₹700 crore",2023-03-15 19:22:00
71,"Wednesday trade: FIIs pull out  ₹1271 cr from equities, DIIs offset losses",2023-03-15 19:17:00
72,Why paint stocks are rallying?,2023-03-15 18:52:00
73,Black Wednesday? Credit Suisse stock nosedives 78% from 1-year high,2023-03-15 20:15:00
74,Credit Suisse shares slide 24% after bank's top shareholder rules out support,2023-03-15 18:08:00
75,"Federal Bank to consider fund raising up to  ₹1,000 crore through Tier 2 bonds",2023-03-15 17:53:00
76,"Markets extend losses; Sensex dips 2,792 pts, Nifty slips 782 pts in 5 days",2023-03-15 17:31:00
77,"Sun TV Network declares interim dividend, FIIs raise stake in Q3",2023-03-15 17:28:00
78,PVR shares gain as brokerages see up to 63% upside potential. Should you buy?,2023-03-15 17:23:00
79,Navratna CPSE Hindustan Aeronautics declares  ₹20 per share dividend,2023-03-15 16:38:00
80,Balu Forge Ind gains after securing order from middle east tractor manufacturer,2023-03-15 15:43:00
81,"Multibagger stock: Varun Beverages shares can rally up to 24%, says analyst",2023-03-15 15:38:00
82,Paytm share price: Citi recommends buying for long-term growth,2023-03-15 15:03:00
83,Why Paras Defence share price is skyrocketing - explained,2023-03-15 13:38:00
84,"Brokerage remains bullish on this IT stock, sees 24% upside potential",2023-03-15 12:44:00
85,Multibagger stock rises nearly 2% after promoters releases pledged shares,2023-03-15 12:10:00
86,Top stocks under  ₹200 to add to your watchlist,2023-03-15 11:34:00
87,Why Shaily Engineering shares are falling,2023-03-15 11:30:00
88,Sona BLW shares:Jefferies initiates coverage with Buy post Blackstone stake sale,2023-03-15 10:42:00
89,"Adani Enterprises, Adani Green shares rise; 3 Group stocks hit lower circuit",2023-03-15 10:06:00
90,Quant MF buys Divgi TorqTransfer Systems shares while Morgan Stanley sells,2023-03-15 09:26:00
91,"Global market: SGX Nifty to US inflation, all that will drive stock market today",2023-03-15 08:12:00
92,"Stocks to Watch: RIL, M&M, ONGC, GMR Airports, Cipla",2023-03-15 07:17:00
93,"Day trading guide: Titan, Coal India, Indian Hotels among stocks to buy today",2023-03-15 07:04:00
94,"Global markets: US, European stocks rebound as inflation data offsets  banking crisis fears",2023-03-15 03:00:00
95,"Sensex slips 0.58% to close below 58,000",2023-03-15 01:03:00
96,"Metal stock is up 120% from 52-week-low, record date fixed for stock split",2023-03-15 18:00:00
97,Credit Suisse appeals to Swiss National Bank for show of support - FT,2023-03-15 22:12:00
98,Ahead of Market: 10 things that will decide D-Street action on Thursday,2023-03-15 22:09:00
99,"These 5 large-cap stocks slip to a new 52-week low, do you own any?",2023-03-15 21:12:00
100,"Stock Radar: Buy Hindustan Unilever for a target of Rs 2490-2540, says Ruchit Jain",2023-03-15 22:00:00
101,"Fed may pause next week, traders bet, with cuts to follow",2023-03-15 21:59:00
102,"SVB collapse set to have knock-off effects on venture capital world, warns Ray Dalio",2023-03-15 21:40:00
103,"Collapse of Silicon Valley Bank: An opportunity for IFSC, GIFT City?",2023-03-15 20:52:00
104,Promoter Sumitomo Wiring likely to sell 3.4% stake in Samvardhana Motherson via block deal on Thursday,2023-03-15 20:48:00
105,Bourses freeze Patanjali Foods promoter shares on not meeting public shareholding norm,2023-03-15 20:36:00
106,US stocks: Dow down over 400 points as Credit Suisse renews bank worries,2023-03-15 20:14:00
107,JSW Energy board approves allotment of NCDs to raise Rs 250 cr,2023-03-15 19:55:00
108,"Credit Suisse CEO said bank's liquidity basis is ""very very strong""",2023-03-15 19:50:00
109,"Amid choppy market conditions, SIP discontinuance increases in February",2023-03-15 19:46:00
110,Credit Suisse hits new record low as top shareholder Saudi National Bank rules out assistance,2023-03-15 19:41:00
111,Futures sink as Credit Suisse woes weigh on banks,2023-03-15 19:31:00
112,Wall Street tumbles; Dow Jones down 586 pts as Credit Suisse sparks fresh bank selloff,2023-03-15 22:32:00
113,"​Trading Guide: Petronet LNG, BPCL among 5 stock recommendations for Thursday",2023-03-15 19:16:00
114,LIC pares stake in NMDC for about Rs 705 crore,2023-03-15 22:17:00
115,Credit Suisse unease sparks selloff in world stocks,2023-03-15 18:11:00
116,European banks battered as Credit Suisse drops over 20%,2023-03-15 19:51:00
117,Tech View: Nifty charts throw up long bearish candle. What should traders do on Thursday expiry,2023-03-15 17:36:00
118,Nifty down 10% from record high! Tips from Shankar Sharma on how to navigate current market,2023-03-15 16:47:00
119,Mutual Fund SIP Screener: Top 5 schemes with over 10% annual returns,2023-03-15 16:31:00
120,Profit or loss on sale of stocks! How to set off capital losses to reduce your tax liability?,2023-03-15 16:15:00
121,Credit Suisse shares sink 20% to historic low after top shareholder rules out more assistance,2023-03-15 17:39:00
122,Sensex declines 344 points; Nifty slips below 17K,2023-03-15 16:10:00
123,"Sensex falls for 5th straight session, ends 344 pts lower; Nifty slips below 17K",2023-03-15 15:57:00
124,Small-cap multibagger stock to trade ex-split this week. Do you own it?,2023-03-15 15:50:00
125,Stocks that top 5 mutual funds bought and sold in February,2023-03-15 15:31:00
126,"Jefferies initiates coverage on this auto stock, sees 34% upside potential",2023-03-15 15:20:00
127,Nifty Bank lost Rs 1.33 lakh crore in 3 sessions on US' twin bank crises,2023-03-15 16:32:00
128,"Asian Paints shares gain 4% on oil price slump, breaks 6-session losing streak",2023-03-15 14:20:00
129,European shares open lower as fashion retailers slide after results,2023-03-15 14:13:00
130,Nikkei snaps 3-day losing run as Japan banks rise on easing contagion fears,2023-03-15 13:35:00
131,"SVB fall: Nazara Tech says Rs 60 cr shifted to other bank accounts, Rs 4 cr remains for unrestricted operational use",2023-03-15 13:31:00
132,5 stocks which benefit from the government focus on increasing rural income; with upside potential of up to 43%,2023-03-15 13:34:00
133,"Muted market hurts analyst sentiment barometer, but Adani Ports, 2 others remain top buys",2023-03-15 13:08:00
134,"Airtel, Vi fall in morning trade a day after Jio’s postpaid move",2023-03-15 13:05:00
135,Quantitative investing; 5 stocks with difference in trailing P/E and forward P/E with an upside potential of 38 %,2023-03-15 13:01:00
136,Shriram Finance looking to sell 15% stake in housing arm - sources,2023-03-15 12:16:00
137,Mukesh Ambani's attempt to crack a hard nut new headache for Airtel investors,2023-03-15 19:20:00
138,Smallcap PSU stock rises 5% on Rs 287 crore-order win,2023-03-15 11:38:00
139,Neelkanth Mishra resigns from Credit Suisse; set to head Axis Bank's research business,2023-03-15 11:36:00
140,Credit Suisse veteran Neelkanth Mishra poised to exit for Axis Bank,2023-03-15 11:27:00
141,Retail investor puzzled by mkt volatility? SIP flows slow down but stay above Rs 13K cr in Feb,2023-03-15 12:56:00
142,March 31: Two deadlines that demat account holders must keep in mind,2023-03-15 11:18:00
143,"Chart Check: Up 50% in 3 months, should you buy, sell or hold this iron & steel product maker?",2023-03-15 11:08:00
144,Divgi TorqTransfer shares soar 5% a day after muted D-Street debut,2023-03-15 10:59:00
145,Mindpsace REIT raises Rs 550 cr through green bonds to refinance loans,2023-03-15 00:00:00
146,Stock exchanges freeze promoter shareholding of Patanjali Foods,2023-03-15 00:00:00
147,Indices dip for fifth session as Credit Suisse woes weigh on investor minds,2023-03-15 00:00:00
148,Mindspace raises Rs 550 cr through green bond to finance projects,2023-03-15 00:00:00
149,IPO filings halve in FY23 as outlook for new share sales worsens,2023-03-15 00:00:00
150,"MFs keep the powder dry as Nifty nears 'correction', cash holdings rise",2023-03-15 00:00:00
151,Technocraft Industries hits record high; stock zooms 40% in 5 weeks,2023-03-15 00:00:00
152,GMR Airports surges 6% on heavy volumes after arm raises funds via NCDs,2023-03-15 00:00:00
153,"Varun Beverages surges 5%, nears record high on strong growth outlook",2023-03-15 00:00:00
154,"RIL, Mphasis: 45 stocks hit fresh 52-week lows; charts show more pain ahead",2023-03-15 00:00:00
155,Ramkrishna Forgings surges 9% on emerging lowest bidder for Railways order,2023-03-15 00:00:00
156,Maruti Suzuki gains 2% after promoter buys 3.45 lakh shares via open market,2023-03-15 00:00:00
157,This Chris Wood owned stock hit a 52-week low. What's worrying the Street?,2023-03-15 00:00:00
158,"Sensex falls for 5th straight day, ends 344 pts down; Nifty breaks 17,000",2023-03-15 00:00:00
159,"Stocks to watch: Cipla, Axis Bank, PNC Infratech, RailTel, Glenmark Pharma",2023-03-15 00:00:00
