,Headline,Date
0, FMCG Q4 Preview | No signs of rural demand recovery; volume growth to stay muted,2023-04-07 22:23:00
1," The Reading List: April 7, 2023",2023-04-07 18:43:00
2, Three indicators which show the US economy may be slowing down,2023-04-07 18:42:00
3, Investors' wealth jumps over Rs 10.43 lakh cr in last 5 days of market rally,2023-04-07 22:47:00
4," Business in the Week Ahead April 10-14, 2023",2023-04-07 16:02:00
5, Unauthorised investment advisory services: Sebi bans 4 entities from securities markets for 6 months,2023-04-07 11:33:00
6," Motilal Oswal initiates coverage on Max Healthcare with 'buy', sees 27% upside",2023-04-07 09:47:00
7, The RBI’s rate hike pause is flattering to deceive,2023-04-07 09:04:00
8," These 3 stock ideas can give decent short-term returns as Nifty persists above 17,500",2023-04-07 07:50:00
9," Post RBI policy, Ambit maintains positive outlook on BFSI with rate hike cycle reaching the peak",2023-04-07 07:38:00
10," Daily Voice | Focus on businesses that capture these 4 broad themes, says Ritwick Ghoshal of Bay Capital",2023-04-07 07:34:00
11, Here are the top stocks ideas by KRChoksey for April 2023,2023-04-07 07:24:00
12," Market Holiday: BSE, NSE shut today on account of Good Friday",2023-04-07 07:19:00
13, Wall Street ends higher as investors eye upcoming jobs data,2023-04-07 06:02:00
14,"‘Nifty could hit 18,000 level as FPIs turn upbeat’",2023-04-08 01:07:00
15,Investors' wealth jumps over  ₹10.43 lakh cr in last 5 days of market rally,2023-04-07 17:33:00
16,Your long-term investing checklist,2023-04-07 17:01:00
17,SME IPO gives multibagger return in 4 months despite 45% dip from record high,2023-04-07 14:14:00
18,Buy or sell: Anuj Gupta of IIFL Securities recommends 5 stocks to buy next week,2023-04-07 13:20:00
19,"Power Finance Corp (PFC) dividend declared in FY23 beats PPF, bank FD returns",2023-04-07 12:17:00
20,₹0.34 to  ₹15.62: Multibagger penny stock gives 4500% return in 4 years,2023-04-07 09:52:00
21,Are stock markets open on Good Friday today?,2023-04-07 08:30:00
22,"Vijay Kedia portfolio stock jumps over 100% in one year. Buy, hold or sell?",2023-04-07 07:17:00
23,"Stock market holiday: NSE, BSE to remain closed today on Good Friday",2023-04-07 08:04:00
24,"Global markets: US, European stocks rise; investors eye jobs data",2023-04-07 02:40:00
25,RBI’s surprise move boosts markets amid global woes,2023-04-07 01:05:00
26,Robinhood to pay as much as $10.2 million for technical failures,2023-04-06 22:54:00
27,"How did banking, realty and NBFC stocks perform today after RBI repo rate decision? Stocks to buy ahead",2023-04-06 22:15:00
28,Investors' wealth jumps over Rs 10.43 lakh cr in last 5 days of market rally,2023-04-07 16:12:00
29,Decoded: Whom to Call during different interest rate climates,2023-04-07 15:34:00
30,"HDFC Bank, Indian Hotels among 6 stock picks from Motilal Oswal's model portfolio",2023-04-07 10:37:00
31,"Infosys, TCS & more: Q4 earnings to watch out for next week",2023-04-07 14:33:00
32,Weekly Top Picks: These stocks scored 10 on 10 on Stock Reports Plus,2023-04-07 13:22:00
33,PSUs to outshine private banks in Q4; which stocks should investors bet on?,2023-04-07 12:46:00
34,5 stocks from B2B of manufacturing sector with upside potential of up to 62%,2023-04-07 12:32:00
35,Unauthorised investment advisory services: Sebi bans 4 entities from securities markets for 6 months,2023-04-07 11:29:00
36,Nifty Financial Services Index stocks that analysts suggest buying for up to 40% potential upside,2023-04-07 11:20:00
37,Airline industry has had a ‘bad century’ since the Wright brothers; 3 reasons why it is a tough business,2023-04-07 10:46:00
38,"'Powell's curve' plunges to new lows, flashing US recession warning",2023-04-07 10:27:00
39,"Portfolio Management Talks: Why Manish Sonthalia positive on tech, banks, auto, capex-led sector",2023-04-07 14:20:00
40,Chart Check: Channel breakout could take this infra stock to fresh record highs,2023-04-07 09:27:00
41,"Stellar run! This smallcap multibagger that gave 35000% return in 10 years turned Rs 10,000 to Rs 35 lakh",2023-04-07 09:00:00
42,"FMCG margins improve, but rural stress weighs",2023-04-07 08:51:00
43,"Macrotech’s FY23 pre-sales jump 34% to over Rs 12,000 cr",2023-04-07 08:34:00
44,A monetary policy review that didn't happen,2023-04-07 08:32:00
45,Jindal steel promoters clear loans taken against shares,2023-04-07 08:24:00
46,"'Jio, Airtel's revenue growth March to continue, Vi to lag'",2023-04-07 12:37:00
47,Nifty50 companies likely to report double-digit sales and profit growth in Q4,2023-04-07 08:04:00
48,NY Fed index shows global supply chain pressures eased further in March,2023-04-06 21:21:00
49,"​These 5 healthcare stocks touch their new 52-week highs, do you own any?",2023-04-06 21:17:00
50,"Sebi asks investment advisers, research analysts to display their info prominently in advertisements",2023-04-07 12:08:00
51,RBI slaps Rs 6.77-crore penalty on M&M Fin Services over interest rate disclosure norms,2023-04-06 22:22:00
