,Headline,Date
0, Trade setup for Thursday: Top 15 things to know before the opening bell,2023-04-06 00:17:00
1, Outlook worsening for bank stocks as Street awaits RBI policy rate decision,2023-04-05 21:52:00
2, Stock market Cassandras and Pollyannas are stuck in limbo,2023-04-05 17:45:00
3, A $15 billion buyout? Take the money and run,2023-04-05 17:32:00
4, 2021-30: Lost decade for the world economy?,2023-04-05 17:21:00
5, Kotak AMC expects change in monetary policy stance to neutral with last repo rate hike for 2023,2023-04-05 17:15:00
6," Technical View | Bulls lift Nifty above 200 EMA; key resistance area would be 17,600-17,800",2023-04-05 17:12:00
7, Contrarian Calls | Tech Mahindra's management rejig stirs analysts' optimism despite weak price action,2023-04-05 17:00:00
8, Gainers & Losers: 10 stocks that moved the most on April 5,2023-04-05 16:46:00
9," Taking Stock: Sensex up 582 points, Nifty around 17,550 ahead of RBI policy",2023-04-05 16:30:00
10, Moneycontrol Pro Panorama | Market reaction to MPC moves temporary,2023-04-05 15:06:00
11," Zaggle Prepaid, Cyient DLM, Healthvista India, Rashi Peripherals IPOs get go ahead from SEBI",2023-04-05 14:59:00
12," Mahanagar, Indraprastha shares surge on forecast of robust demand from gas distributors",2023-04-05 15:06:00
13, Godrej Consumer Products expects mid-single digit volume growth for Q4,2023-04-05 14:25:00
14," Banking risks need to be managed better, says JPMorgan chief Jamie Dimon in annual letter",2023-04-05 14:00:00
15, Varun Beverages rallies 4% to hit record high after major block deal,2023-04-05 13:47:00
16, Commodities Live: Gold prices hit an all-time high in India; Silver prices touch one-year high,2023-04-05 13:09:00
17, PNB Housing shares correct 18% to adjust for 29:54 rights issue,2023-04-05 12:56:00
18," With ChatGPT plugins, OpenAI could revolutionise web browsing, challenge Google’s dominance",2023-04-05 12:49:00
19," Markets trade in the green for fourth straight day, financials rally on loan boosters",2023-04-05 13:08:00
20, Federal Bank falls as Q4 CASA ratio hits multi-quarter low,2023-04-05 12:19:00
21, Poonawalla Fincorp gains 4% after posting highest ever disbursements,2023-04-05 12:08:00
22, Gold Prices Today: Firm safe-haven demand takes yellow metals closer to record high on COMEX,2023-04-05 12:04:00
23, SEBI’s new requirement for independent assurance and regulated rating will enhance the credibility of ESG disclosure,2023-04-05 11:47:00
24, RBI’s real interest rate goal just got higher with OPEC’s output cut,2023-04-05 11:42:00
25, Bharat Dynamics shares fall as FY23 provisional revenue declines,2023-04-05 11:36:00
26, Composite PMI data bolster case for rate hike,2023-04-05 12:54:00
27, Martin Wolf: Waging war on trade will be costly,2023-04-05 11:20:00
28, L&T shares jump 2.5% on wining 'mega order' for hydrocarbon business,2023-04-05 11:13:00
29," F&O Manual: Market on recovery mode, say traders, as Nifty rises for another day",2023-04-05 11:06:00
30, Hindustan Zinc shares gain 2% as refined metal output hits record high in FY23,2023-04-05 11:06:00
31, Bajaj Finance spurts 4% on strong Q4 business update,2023-04-05 15:31:00
32," M&M Finance jumps 3% on strong disbursements, collection efficiency",2023-04-05 12:15:00
33, Bharat Forge down 2% as North America Class 8 truck orders decline,2023-04-05 10:40:00
34," Indigo Paints gains on waterproofing business foray; to compete with Pidilite, Asian Paints",2023-04-05 10:25:00
35, Cash Market: Ircon International is breaking out of a descending triangle pattern,2023-04-05 10:20:00
36, Cash Market: Trendline resistance breakout suggests upside in Titan,2023-04-05 10:19:00
37, CHART OF THE DAY: Passenger vehicles zoom past new milestones,2023-04-05 10:36:00
38, Commodity Futures: Price action is positive for Kapas in short term,2023-04-05 10:17:00
39, Cash Market: Potential low risk opportunity in Laurus Labs,2023-04-05 10:16:00
40, ONGC shares rise over 2% as Centre scraps windfall tax on crude production,2023-04-05 10:15:00
41, Options Trade | A non-directional options strategy in BHEL,2023-04-05 10:14:00
42, Hindalco down 2% as co sees headwinds for arm Novelis in FY24,2023-04-05 10:14:00
43," Analysts Call Tracker: Bajaj Finance, Infosys, and M&M top list of most downgraded companies in March",2023-04-05 09:54:00
44," HDFC Bank shares gain 2% as advances, deposits surge",2023-04-05 09:52:00
45, Power Grid flexes its muscles in competitive bids,2023-04-05 09:55:00
46, NBCC shares gain 4% on winning Rs 448-crore order for border road development,2023-04-05 09:25:00
47, Market Live: Financials in focus & IT to hog the limelight | Opening Bell,2023-04-05 09:05:00
48, Is a supercycle coming in oil markets?,2023-04-05 08:58:00
49," Expect RBI to take a pause, forward guidance by the MPC may be open ended",2023-04-05 08:49:00
50," Market Live: HCL Tech, ONGC, RIL & Bajaj Fin in focus; decoding travel demand trends with EaseMyTrip",2023-04-05 08:30:00
51," MPC caught in tri-junction of rates, liquidity and electoral politics",2023-04-05 08:50:00
52," Stocks struggle as US jobs dry up, kiwi leaps on RBNZ surprise",2023-04-05 08:04:00
53," Buzzing Stocks: NBCC, IndusInd Bank, RailTel Corp, Indigo Paints & others in news today",2023-04-05 12:13:00
54," Closing Bell: Sensex rises 582 pts, Nifty around 17,550; all eyes on RBI meeting",2023-04-05 15:54:00
55, Stock Market Today: Top 10 things to know before the market opens today,2023-04-05 07:27:00
56," Trade Spotlight | Your game plan for Rail Vikas Nigam, Oil India, Sonata Software today",2023-04-05 07:02:00
57," Hot Stocks | Kirloskar Oil Engines, Union Bank of India, Zensar may deliver healthy returns",2023-04-05 06:58:00
58," Oil edges up as OPEC cuts, US inventories brighten outlook",2023-04-05 06:40:00
59," Daily Voice | This fund manager is overweight on autos with EV capabilities, and underweight on FMCG",2023-04-05 08:52:00
60," Interview | RBI might deliver last repo rate hike on April 6, says equity head at Canara Robeco AMC",2023-04-05 06:23:00
61, Wall Street ends down as weak economic data fuels recession fears,2023-04-05 06:11:00
62, Trade setup for today: Top 15 things to know before the opening bell,2023-04-05 07:31:00
63,"Global stocks: S&P 500, Nasdaq drops on recession fears; Gold hits record 1-year high",2023-04-06 02:21:00
64,"Stocks up almost 1% on robust credit, tax data",2023-04-06 00:46:00
65,"Sugar stock declares interim dividend, FIIs stake down in Q3, scrip trading at a dividend yield of 2.54%",2023-04-05 18:46:00
66,"Nykaa shares gain 8% on block deal, extend gains for second day",2023-04-05 18:15:00
67,"After rallying over 1800% in 3 years, multibagger stock Tips Industries sets record date for 1:10 stock split",2023-04-05 18:06:00
68,Q4 numbers of financials with windfall tax cut lifts market; RBI policy in focus,2023-04-05 17:36:00
69,"Britannia declares 7200% interim dividend to  ₹72 per share, sets record date",2023-04-05 17:48:00
70,"Federal Bank, Ashok Leyland, PNC Infra, Praj Ind among top picks of brokerage",2023-04-05 16:01:00
71,A billionaire recommends his 'two newspaper' strategy for the current market,2023-04-05 14:49:00
72,OMC stocks in red after windfall tax cut. What to expect,2023-04-05 14:58:00
73,HDFC Bank share price up over 2% on healthy deposit growth,2023-04-05 13:50:00
74,Multibagger stock: Ashish Kacholia portfolio share jumps 525% in 3 years,2023-04-05 12:59:00
75,Adani Ports shares jump after FY23 business update. Should you buy?,2023-04-05 10:28:00
76,PNB Housing Finance rights issue record date today. Share nosedives 18%,2023-04-05 09:50:00
77,Global market: SGX Nifty to US dollar — key triggers for stock market today,2023-04-05 07:55:00
78,"Stocks to Watch: RIL, Grasim, IndusInd Bank, Maruti Suzuki, LIC, Airtel",2023-04-05 07:32:00
79,Buy or sell: Vaishali Parekh recommends 3 stocks to buy today — April 5,2023-04-05 06:27:00
80,Day trading guide for today: 6 stocks to buy or sell on Wednesday — 5th April,2023-04-05 05:55:00
81,"Global stocks: S&P 500, Dow Jones fall over 0.6% on weak US economic data",2023-04-05 02:44:00
82,FPI shorts may be hit by dovish MPC,2023-04-05 01:05:00
83,"ICICI, SBI, Infosys, ITC and 3 other stocks are top picks for April in largecaps",2023-04-04 21:34:00
84,Tata Steel Q4 Update: Output grows 3%; sales fall 3.43%,2023-04-06 00:12:00
85,"Stock Radar: Buy Bajaj Auto for a target of Rs 4050-4120, says Ruchit Jain",2023-04-05 22:00:00
86,"​These 6 consumer discretionary stocks record their new 52-week highs, gain up to 20% in a month",2023-04-05 20:14:00
87,Nykaa expects over 30% growth in FY23 revenue on better conversion rates,2023-04-05 21:53:00
88,Ahead of Market: 10 things that will decide D-Street action on Thursday,2023-04-05 21:49:00
89,NSE cautions investors against two individuals,2023-04-05 21:43:00
90,"Sebi issues advertisement code for investment advisers, research analysts",2023-04-05 21:39:00
91,ITC stock likely to sustain momentum amid improving business momentum,2023-04-05 20:59:00
92,Goldman Sachs fined $3 mln by FINRA over mismarking short sale orders,2023-04-05 20:53:00
93,"Knicks travel to Pacers, won't go quietly into playoffs",2023-04-05 20:37:00
94,"Turning a corner? FPIs remain net buyers for five straight days, pump in Rs 5,700 cr",2023-04-05 20:34:00
95,RBI Policy Preview: Will MPC deliver the final rate hike on Thursday?,2023-04-05 20:31:00
96,Newest Entrants! Zerodha's Kamath brothers make it to Forbes' billionaires list 2023,2023-04-05 20:25:00
97,Dollar mired near two-month low after jobs jolt; RBNZ boosts kiwi,2023-04-05 20:18:00
98,"Expect Nifty to reach 20,000 in the next 12 months: Goldman Sachs' Timothy Moe",2023-04-05 20:10:00
99,"S&P, Nasdaq fall as recession worries mount on weak economic data",2023-04-05 22:27:00
100,J&J rises as $8.9 bln talc lawsuit settlement eases overhang on consumer unit spinoff,2023-04-05 19:36:00
101,Fed's Mester says too soon to tell if rate hike needed in May: Report,2023-04-05 19:30:00
102,"​Market Trading Guide: Can Fin Homes, Pricol are 2 stock recommendations for Thursday",2023-04-05 21:12:00
103,ET Money Show: Should you consider investing in US equities amid the volatility in Indian markets?,2023-04-05 18:51:00
104,What are price trends? Techniques to spot price trends in stock market,2023-04-05 17:51:00
105,Tech View: Nifty creates long bull candle. What should traders do on Thursday expiry,2023-04-05 17:12:00
106,Vardhman Special Steels to consider bonus issue on April 12,2023-04-05 16:05:00
107,Top 5 index funds which have given over 25% returns to investors in last 3 years,2023-04-05 15:59:00
108,"Sensex gains for 4th straight session, up 583 pts, Nifty tops 17,550; Nykaa rallies 8%",2023-04-05 15:55:00
109,Nifty50 crosses 200-DMA; what should Dalal Street bulls do?,2023-04-05 15:40:00
110,Mukul Agarwal picks up 1.91% stake in this infra stock during Q4,2023-04-05 15:25:00
111,5 consumer electricals companies surge 15-100% in 1 year; likely to see further upside,2023-04-05 15:25:00
112,European shares fall as data signals slower economic recovery,2023-04-05 15:08:00
113,"What could push crude towards USD 100/bbl, Fereidun Fesharaki of Facts Global Energy explains",2023-04-05 15:01:00
114,Delivery volume shows an uptick as higher margin requirement affects trading activities,2023-04-05 14:27:00
115,"Sensex rallies over 2,000 points in 4 days. 7 key factors driving bulls",2023-04-05 16:03:00
116,"Multibagger stock, with over 260% return in 1 year, announces 1:2 stock split",2023-04-05 14:00:00
117,"5 companies from consumer space, having ‘strong buy’ and ‘buy’ ratings can offer up to 42% returns",2023-04-05 14:34:00
118,Ideas for risk takers in new financial year: Top 5 smallcap stocks with an upside potential of 52%,2023-04-05 12:28:00
119,These bank stocks can offer 20-50% returns to investors,2023-04-05 12:09:00
120,Reliance Retail hires ex-Amul chief Sodhi to build grocery business,2023-04-05 12:00:00
121,Can metal companies get back lost sheen in FY24? Here’s what experts say,2023-04-05 11:36:00
122,Bajaj Finance shares rally up to 4%. What's the good news?,2023-04-05 10:53:00
123,Chart Check: Breakout from an inverted head & shoulder pattern makes UltraTech Cement an attractive buy,2023-04-05 10:45:00
124,"Nifty to scale 20,000 in 12 months, says Goldman Sachs; remains overweight on banks",2023-04-05 10:26:00
125,"Valuation check: Atleast 173 stocks trading below 5-yr P/E, what should investors do?",2023-04-05 10:19:00
126,"Hot Stocks: Brokerage views on ICICI Bank, United Spirits and Aarti Industries",2023-04-05 10:08:00
127,"TCS, HCL Tech, Infosys or midcaps? Investors eyeing these IT stocks ahead of Q4 results",2023-04-05 10:05:00
128,Death Crossovers: These 6 stocks signal further bearishness,2023-04-05 09:53:00
129,"Sensex gains over 100 points, Nifty above 17,400; Bajaj twins rise 2% each",2023-04-05 09:42:00
130,"Sensex jumps 250 pts in early trade; Nifty tests 17,450; Bajaj twins lead gains",2023-04-05 11:49:00
131,New Zealand's central bank hikes key interest rate to 5.25%,2023-04-05 09:37:00
