,Headline,Date
0, NSE removes Adani Enterprises from short-term additional surveillance framework,2023-03-06 23:20:00
1, Trader's Mela 2023: Sentiment seen cautiously optimistic this week,2023-03-06 23:44:00
2," F&O Manual: Buy calls on dips as Nifty regains its mojo, say analysts",2023-03-06 18:52:00
3, Demat account openings hit a three-month low in February as retail investors lie low,2023-03-06 18:30:00
4," MC A10 index up 5%, gains for fifth straight session; Adani Enterprises shines again",2023-03-06 17:42:00
5, What does the Unison Enviro acquisition mean for Mahanagar Gas?,2023-03-06 17:28:00
6," Nova Agritech files IPO papers with Sebi, Nutalapati Venkatasubbarao to exit company",2023-03-06 17:19:00
7," Technical View | Nifty forms Shooting Star kind of pattern, further sharp upmove possible only above 17,800",2023-03-06 16:57:00
8, These two Nifty50 stocks have only Buy calls. What drives the optimism?,2023-03-06 16:51:00
9, Gainers & Losers: 10 stocks that moved the most on March 6,2023-03-06 16:14:00
10," Jaguar Land Rover sales jump 33% in UK market, Tata Motors stock climbs",2023-03-06 16:46:00
11," Taking Stock | It's Happy Holi on D-Street as Sensex gains 415 points, Nifty tops 17,700",2023-03-06 16:39:00
12," Jindal Stainless hits record high, experts see another 14% rally",2023-03-06 15:45:00
13, We now know how much the coal surge set us back,2023-03-06 15:44:00
14," Live: Nifty, Sensex in the green before Holi | HDFC AMC, MGL & Nykaa in focus",2023-03-06 15:34:00
15, Your local solar panel plant may be holding back net zero,2023-03-06 15:37:00
16, ICRA upgrades outlook on Indian aviation industry to 'stable' from 'negative',2023-03-06 15:22:00
17, Moneycontrol Pro Panorama | China's modest growth target a red flag for commodities,2023-03-06 14:52:00
18, Yes Bank still getting a no from investors as lock-in period of bailout players ends,2023-03-06 14:38:00
19, Investors get richer by Rs 5.7 lakh cr as bull run continues for second day,2023-03-06 14:17:00
20," Bajaj Finserv gains nearly 3% on financial ecosystem expansion plans, improving operating metrics",2023-03-06 12:39:00
21, Hero MotoCorp zooms after EV deal with US-based Zero Motorcycles,2023-03-06 12:34:00
22," Market LIVE: Nifty tops 17,750; Metals shine | Adani stocks, Britannia in focus | Mid-day Mood Check",2023-03-06 12:26:00
23, Rally in Adani Group stocks keeps up market rally for the second session,2023-03-06 12:19:00
24, America is toppling the EU from its regulatory throne,2023-03-06 12:16:00
25, PV sales may be hit by regulatory norms despite lower domestic HRC prices: Nomura,2023-03-06 11:47:00
26, Bajaj Electricals shares gain on bagging order worth Rs 564 crore,2023-03-06 11:39:00
27, Neogen Chemcials surges nearly 4% on plans to acquire BuLi Chemicals,2023-03-06 11:08:00
28, Stock market’s fate comes down to the next 13 trading sessions,2023-03-06 11:07:00
29," Cookie may crumble for Britannia as soaring wheat, milk prices to crimp margins: CLSA",2023-03-06 10:50:00
30, Gold Prices Today: Yellow metal likely to consolidate in broader range with positive bias,2023-03-06 10:34:00
31," F&O Manual: String momentum brings bulls bank on Street, traders see Nifty moving to 18,000",2023-03-06 10:22:00
32, Central Banks: Asia’s very complicated interest-rate pause,2023-03-06 10:16:00
33, Olectra Greentech stock gains on bagging electric buses order,2023-03-06 10:11:00
34," Mahanagar Gas hits 52-week high on Unison Enviro acquisition, Ashoka Buildcon up 3%",2023-03-06 11:10:00
35, Easy Trip Planners rises 2% after tourism deal with Andhra Pradesh,2023-03-06 09:56:00
36," Power Grid becomes top bidder for 2 projects in Chhattisgarh, shares head north",2023-03-06 11:12:00
37, Bank of Baroda shares gain after lender cuts home loan rate by 40 bps,2023-03-06 09:38:00
38, Should food delivery partner fees be under GST?,2023-03-06 09:38:00
39, SEBI's Youtube Pump And Dump Case: Arshad Warsi and family beneficiaries or victims?,2023-03-06 09:20:00
40, The need for a consumption-led growth strategy,2023-03-06 09:07:00
41, LIVE: Markets set for a positive start in holiday truncated week? Adani Group in focus,2023-03-06 09:03:00
42," As Tech Mahindra bets big on Products & Platforms business, here's what brokerages say",2023-03-06 10:08:00
43, Why the RBI’s ‘higher for longer’ strategy may stoke inflation in the longer-term,2023-03-06 08:39:00
44, Citibank’s exit: Not easy to do business in India?,2023-03-06 12:19:00
45, Trading in March: Top 10 ideas from experts as bulls charge Nifty to new highs,2023-03-06 08:34:00
46," Market LIVE: Metal stocks shining again; should you buy now? RIL, Britannia, Adani stocks in focus",2023-03-06 08:20:00
47, Cash Trade: GAIL has stood its ground in the last month,2023-03-06 08:11:00
48," Closing Bell: Nifty ends above 17,700, Sensex up 415 pts; IT, auto, oil & gas, power gain",2023-03-06 16:16:00
49, Oil prices open lower on modest Chinese growth forecast,2023-03-06 07:36:00
50, Forget peak oil demand: A thirst for barrels puts $100 in view,2023-03-06 07:33:00
51, Stock Market Today: Top 10 things to know before the market opens today,2023-03-06 07:23:00
52," Trade Spotlight | What's your strategy for Varun Beverages, State Bank of India, PB Fintech?",2023-03-06 07:18:00
53," Interview | Bounce till 17,800-18,000 on Nifty possible, but record high unlikely in March, says this technical chartist",2023-03-06 07:06:00
54," Buzzing Stocks: HDFC, Hindustan Aeronautics, Power Grid, others in news today",2023-03-06 07:11:00
55," Hot Stocks | Here's why you should buy Suprajit Engineering, RITES for short term",2023-03-06 06:48:00
56," Daily Voice | Softening demand environment a key challenge for Indian economy, says Unmesh Kulkarni of Julius Baer India",2023-03-06 06:45:00
57," Rising rates to hit net interest income, el niño may hit loan kitty: Vivek Karve of M&M Financial",2023-03-06 06:33:00
58, Commodity Trade | Minor range breakout in crude oil,2023-03-06 06:30:00
59, Cash Trade | Price and volume breakouts seen in TD Power Systems,2023-03-06 06:28:00
60, Cash Trade | Punjab National Bank shows a breakout for a downsloping wedge,2023-03-06 06:24:00
61," Currency Options | A low-risk, high probability options strategy in USD-INR",2023-03-06 06:21:00
62, Options Trade | A non-directional options strategy in Tech Mahindra,2023-03-06 06:18:00
63," Asia stocks edge up, China sets lower bar on growth",2023-03-06 08:11:00
64, Trade setup for today: Top 15 things to know before the opening bell,2023-03-06 08:46:00
65,Trade restrictions on Adani Ent stock set to be lifted,2023-03-07 00:11:00
66,Adani Ent to exit NSE's short-term ASM framework from 8 March after a month,2023-03-06 22:46:00
67,"NSE rejigs indices, excludes 4 Adani stocks from Nifty Alpha 50 index",2023-03-06 23:00:00
68,"FIIs infuse over  ₹721 cr, invest for third day in row; DIIs buy  ₹757 cr",2023-03-06 21:27:00
69,Adani Group's market value rises over  ₹2 lakh cr in 5 days rally,2023-03-06 19:48:00
70,Ajanta Pharma Board to consider buyback of shares on 10 March,2023-03-06 17:42:00
71,Markets extend winning streak; Adani stocks rise for fourth day,2023-03-06 16:48:00
72,Two-day market rally adds  ₹5.5 lakh crore of wealth to investors' kitty,2023-03-06 16:29:00
73,"Sensex target at 70,000 levels, up to 17% potential upside: Analyst",2023-03-06 15:16:00
74,Money making ideas: Top 16 stocks to buy this month,2023-03-06 15:17:00
75,Multibagger stock to buy: Axis Securities sees 10% rise in this stock,2023-03-06 14:14:00
76,Nykaa shares plunge 2% after Macquarie sees 23% downside in stock,2023-03-06 13:27:00
77,Dividend paying stock: Hindustan Zinc shares yield 15.5% in FY23,2023-03-06 13:08:00
78,"As Tech Mah bets big on organic growth, key triggers that could drive IT stock",2023-03-06 12:39:00
79,Stocks aren't the inflation hedge you think they are,2023-03-06 12:37:00
80,"Top picks: RIL, L&T among stocks to buy today as recommended by ICICI Direct",2023-03-06 12:16:00
81,From Pakistan to Sri Lanka: Why world’s riskiest markets stumble into crisis?,2023-03-06 11:46:00
82,Here's why SBI is still buy-on-dip stock,2023-03-06 11:16:00
83,Why Sensex surged 1600 points in two days? Experts list out 5 reasons,2023-03-06 11:13:00
84,"5 beaten down stocks with strong fundamentals, poised to make a comeback in 2023",2023-03-06 10:38:00
85,"Yes Bank share opens flat as SBI's 3-year lock-in ends today. Buy, hold or exit?",2023-03-06 10:09:00
86,"Adani Enterprises shares extend rally, 4 group stocks hit upper circuit",2023-03-06 11:22:00
87,Multibagger stock that has surged 2300% in 5 years to foray into e-scooter space,2023-03-06 08:07:00
88,Global market today: SGX Nifty to US dollar — key factors that may dominate D-St,2023-03-06 07:30:00
89,"Stocks to Watch: Adani Ports, Maruti, HDFC, PGCL, Kansai Nerolac, MGL",2023-03-06 07:28:00
90,Buy or sell: Vaishali Parekh recommends 3 stocks to buy today — March 6,2023-03-06 06:37:00
91,Day trading guide for today: 5 stocks to buy or sell on Monday — 6th March,2023-03-06 05:58:00
92,Two traders built big Adani Ent positions as GQG stepped in,2023-03-06 00:55:00
93,Centre may ease AT-I bond valuation rules,2023-03-06 06:21:00
94,"Power stock is up 133% from 52-week-low, record date fixed for 1:2 stock split",2023-03-05 22:59:00
95,US stocks: 4 key events over the next 13 trading sessions to decide market’s fate,2023-03-05 22:42:00
96,FMCG stock approves 54.66 lakh convertible warrants at an issue price of  ₹360,2023-03-05 22:28:00
97,Feb marks third consecutive downtrend of market. What to expect in March?,2023-03-05 21:51:00
98,"NSE removes 5 Adani Group stocks from Nifty Alpha 50, Nifty100 Alpha 30 indices",2023-03-06 23:27:00
99,Buy Apple after years on sidelines of 300% advance: Goldman,2023-03-06 22:07:00
100,"Sensex rally propels 4 commodities, 3 IT stocks to 52-week highs",2023-03-06 18:21:00
101,"Stock Radar: Buy IRFC for a target of Rs 35, says Gaurav Bissa",2023-03-06 22:00:00
102,Setting wrong expectations to onboard investors detrimental: Nithin Kamath,2023-03-06 21:42:00
103,60% women investors in US markets are recurring depositors: Vested Finance,2023-03-06 20:25:00
104,Wall St climbs as lower Treasury yields lift megacap stocks,2023-03-06 21:00:00
105,Unison’s acquisition brightens MGL’s prospects,2023-03-06 20:00:00
106,"After a month, NSE removes Adani Enterprises from additional surveillance framework",2023-03-06 19:57:00
107,"Only 27% women make own financial decisions, majority still depend on others: Study",2023-03-06 22:26:00
108,"Dollar dips, Powell testimony and jobs data in focus",2023-03-06 21:04:00
109,"Gainers and Losers: Aptus, Hinduja Global among top stocks in spotlight on Monday",2023-03-06 18:13:00
110,Asian Paints among 5 stocks that can add a dash of colour to your portfolio this Holi,2023-03-06 17:57:00
111,Tech View: Nifty forms shooting star candle. What should traders do on Wednesday,2023-03-06 17:09:00
112,"Sensex ends 415 pts higher; Nifty tops 17,700; JSW Energy jumps 11%, GSPL 6%",2023-03-06 16:05:00
113,Sensex rises for 2nd straight day on improved risk sentiment; investors gain Rs 2.12L cr,2023-03-06 16:23:00
114,This multibagger rallies over 6% after announcing entry into e-scooter space,2023-03-06 15:48:00
115,82% AUM managed by women fund managers outperformed peers in 5 yrs: Report,2023-03-06 22:10:00
116,Well ahead of the curve! Uday Kotak hails India's fight against inflation,2023-03-06 15:21:00
117,Viewing markets in dynamic equilibrium resolves conundrums,2023-03-06 15:19:00
118,"Grasim poised for re-rating; 12-month target seen at Rs 1,888: Abhimanyu Kasliwal",2023-03-06 14:52:00
119,Is the market closed tomorrow for Holi?,2023-03-06 14:49:00
120,Multibagger Bajaj stock climbs 5% after firm wins Rs 565 cr contract,2023-03-06 14:35:00
121,Watch: Kiara Advani shares her investment mantra,2023-03-06 14:30:00
122,Stock bulls richer by Rs 5.5 lakh crore in 2 days. Is it just about Adani?,2023-03-06 15:53:00
123,"Sensex to cross 70,000 mark in next 3 months: Axis My India survey",2023-03-06 14:10:00
124,European shares open higher on Telecom Italia boost,2023-03-06 14:13:00
125,Yes Bank lock-in period ends next week; know what to expect from this stock,2023-03-06 21:39:00
126,Japan's Nikkei scales 3-month peak on Wall Street's lead; tech paces gains,2023-03-06 13:38:00
127,Britannia shares fall 2% after CLSA slams 'sell',2023-03-06 13:19:00
128,"Sectoral Spotlight: PSU bank stocks set for short term rally; SBI, BoB in focus",2023-03-06 13:17:00
129,Mahanagar Gas shares jump over 8% to hit 52-week high. Here's why,2023-03-06 12:02:00
130,Top Picks of the week: 4 stocks with consistent score improvement and upside potential of up to 42%,2023-03-06 11:59:00
131,Chart Check: Flag breakout on daily charts makes ABB an attractive buy; likely to hit fresh record highs,2023-03-06 11:44:00
132,"Hot Stocks: Brokerage view on Nykaa, Britannia, GCPL and SBI",2023-03-06 11:29:00
133,Top Nifty50 stocks analysts suggest buying this week,2023-03-06 14:46:00
134,This real estate stock can rally 5-6% in short term,2023-03-06 11:19:00
135,"Rs 12,600 cr-windfall gains! SBI made big bucks in 3 yrs of its investment in YES Bank",2023-03-06 11:00:00
136,Buzzing Stock: Nykaa shares drop 3% after Macquarie report,2023-03-06 10:54:00
137,NRI effect! Adani stocks rally up to 10% as bull party extends to 5th day,2023-03-06 10:34:00
138,Gautam Adani's new investor is an ITC fan looking for arbitrage between perception & reality,2023-03-06 12:41:00
139,Stocks to buy: 10 short-term trading ideas by experts for 6 March 2023,2023-03-06 10:12:00
140,"Sensex gains over 450 points; Nifty reclaims 17,700; Adani stocks rally up to 8%",2023-03-06 09:41:00
141,"Sensex rallies over 600 pts tracking Asian markets, Nifty tops 17,750",2023-03-06 10:17:00
142,Trader's Guide: 2 stocks with up to 7% potential upside,2023-03-06 09:09:00
143,38 stocks turn multibaggers since last Holi; at least 32 double investor wealth,2023-03-06 09:42:00
144,"Buy or Sell: Stock ideas by experts for March 06, 2023",2023-03-06 08:46:00
145,"Stocks in focus: Anant Raj, IEX and more",2023-03-06 08:43:00
146,Stock exchanges remove Adani Enterprises from short-term ASM framework,2023-03-07 00:00:00
147,Sebi issues framework for cloud services adoption by stock exchanges,2023-03-06 00:00:00
148,"Buoyed by $1.9 bn investment by GQG Partners, Adani rally enters 2nd week",2023-03-06 00:00:00
149,NSE removes Adani Enterprises from short-term additional surveillance,2023-03-06 00:00:00
150,"Sensex reclaims 60,000 mark, up 1,315 points in two trading sessions",2023-03-06 00:00:00
151,Mahanagar Gas' Unison Enviro acquisition lights up its growth prospects,2023-03-06 00:00:00
152,"Sebi frowns on assured returns, asks MFs to remove related ads, brochures",2023-03-06 00:00:00
153,Explained: How sensitive is the issue of pledge of shares by promoters?,2023-03-06 00:00:00
154,Strong data on US economy fuels bull-run in European and Asian markets,2023-03-06 00:00:00
155,Indian shares extend rally for 2nd time after strong economic data from US,2023-03-06 00:00:00
156,"ONGC, Oil India gain 3%; hit over 8-month highs",2023-03-06 00:00:00
157,YES Bank share price flat as SBI's three-year lock-in period ends this week,2023-03-06 00:00:00
158,"Power Grid Corp, NTPC gain 3% each to hit their respective 3-month highs",2023-03-06 00:00:00
159,Global mkts fully pricing in Fed hike to 5.5%; Indian equities at risk: UBS,2023-03-06 00:00:00
160,5 Nifty 500 stocks to accumulate if market breadth continues to improve,2023-03-06 00:00:00
161,"Wonderla scales record high; Imagicaaworld at 52-wk peak, up 44% in 3 days",2023-03-06 00:00:00
162,MF inflow in equities crosses Rs 1.5-trn for second straight fiscal,2023-03-06 00:00:00
163,Stock of this company hits over 3-decade high; zooms 55% in one month,2023-03-06 00:00:00
164,Mahanagar Gas surges 7% to hit 52-week high on acquisition of Unison Enviro,2023-03-06 00:00:00
165,"Home construction: Analysts bet on pipe makers; wary on tile, paint segment",2023-03-06 00:00:00
166,"Sensex up 415 pts, ends above 60K; Nifty tops 17,700; IT, auto stocks rally",2023-03-06 00:00:00
167,"Stocks to Watch: Power Grid, HDFC, Mahanagar Gas, Naukri, IEX, Zydus Life",2023-03-06 00:00:00
168,"India's market capitalisation-to-GDP ratio slips to 95 in FY23, shows data",2023-03-06 00:00:00
169,"Street Signs: Nifty50 rises, Whirlpool of India may face F&O axe, and more",2023-03-06 00:00:00
170,Only one woman for every eight on India Inc payroll: CFA study,2023-03-06 00:00:00
171,"Improving outlook, upgrades to keep wheels turning for auto companies",2023-03-06 00:00:00
