,Headline,Date
0, IRB Infrastructure Trust gets listed on NSE,2023-04-03 18:27:00
1, No spring in the step: Street cautiously optimistic about Bata India while LIC ups stake,2023-04-03 18:05:00
2, Kotak Equities sees more pain for OMCs after OPEC shocks market with production cut,2023-04-03 17:53:00
3, Even a recession might not tame inflation,2023-04-03 17:34:00
4," Analyst Call Tracker | Adani Ports, Hindalco top optimism list for second straight month",2023-04-03 17:27:00
5," Global economy on the verge of a 2008-like financial crisis, warns Peter Schiff",2023-04-03 17:10:00
6, Gainers & Losers: 10 stocks that moved the most on April 3,2023-04-03 17:00:00
7," Technical View: Nifty likely to consolidate, immediate target is 17,500",2023-04-03 16:56:00
8," Three factors will drive auto-stock prices in FY24, according to Morgan Stanley",2023-04-03 16:21:00
9," Taking stock: A choppy day for market, Sensex gains 115 points, Nifty nears 17,400",2023-04-03 18:18:00
10," 17-year production high fires up Coal India, stock gains 3%",2023-04-03 15:50:00
11, NTPC stock gains on record power generation in FY23,2023-04-03 15:41:00
12, Conditions ideal for a modified call butterfly to flit across the Nifty: Shubham Agarwal,2023-04-03 15:09:00
13, Moneycontrol Pro Panorama | OPEC+ delivers a sucker punch,2023-04-03 14:35:00
14, Oil buyers reel from OPEC+ cuts as they explore alternatives,2023-04-03 14:18:00
15, Piramal Pharma zooms 5% on zero observations from US FDA,2023-04-03 14:15:00
16," MC Exclusive: UCO Bank MD & CEO speaks on lending to Adani, global banking crises | LIVE",2023-04-03 13:53:00
17, Dhanlaxmi Bank rallies 5% on the back of 23% growth in gold loan book,2023-04-03 14:52:00
18," Antique Broking bullish on Indian pharma market for FY24, stays negative on US generics",2023-04-03 13:09:00
19, SpiceJet shares fly 3% higher after hiving off cargo and logistics wing,2023-04-03 12:57:00
20," As MPC meet gets under way, PMI signals vigorous growth",2023-04-03 12:46:00
21, Karaikal Port deal to become value-accretive for Adani Ports in 2 years: Morgan Stanley,2023-04-03 12:38:00
22, Aeroflex Industries files draft IPO papers to raise Rs 350 crore from listing,2023-04-03 12:27:00
23, Tube Investments: Why does the market retain faith in it despite ‘puzzling’ healthcare forays?,2023-04-03 16:38:00
24, Adani Group stocks decline on report of Sebi probe into offshore deals,2023-04-03 12:23:00
25, M&M shares rise as automaker posts highest ever auto sales in March,2023-04-03 12:01:00
26," Maruti Suzuki rises on price hike, better UV sales in March",2023-04-03 13:58:00
27, PNB Housing Finance rises 4% as Morgan Stanley sees 32% upside in stock,2023-04-03 11:37:00
28, Karnataka Bank tumbles 5% after tepid Q4 provisional numbers,2023-04-03 11:33:00
29," The jobs market is not dead, it's just growing differently",2023-04-03 11:30:00
30," F&O Manual: Nifty trades flat, traders expect selling as day progresses",2023-04-03 11:21:00
31, Bajaj Auto vrooms on electric 3-wheeler launch plan this month,2023-04-03 11:01:00
32, Ashok Leyland shares gain on robust monthly sales,2023-04-03 11:00:00
33," IGL, MGL and Gujarat Gas shares fall as LPG price revision awaits Cabinet decision",2023-04-03 11:06:00
34," ONGC, Oil India gain as crude prices spike over 5%; OMCs take a beating",2023-04-03 11:35:00
35, CSB Bank rallies 3.5% as deposits grow 20 percent,2023-04-03 11:11:00
36," Atul Auto zooms 12% on sharp surge in March, FY23 sales",2023-04-03 10:42:00
37, The financial turmoil is not over,2023-04-03 10:41:00
38, Chart of the Day | Asia’s Dividend Kings rule the roost,2023-04-03 10:31:00
39, MMRFIC buy to help Sansera Engg expand hi-tech offerings: Nomura,2023-04-03 10:35:00
40, JM Financial initiates buy rating on Archean Chemical; target price at Rs 785,2023-04-03 10:21:00
41, Jim Rogers predicts sharp increase in crude and natural gas prices during next bull market,2023-04-03 10:15:00
42, Reliance shares gain as Jefferies hikes target price but erase gains on profit-booking,2023-04-03 10:07:00
43, Mahindra CIE gets 'add' tag from Kotak; target price raised to Rs 380,2023-04-03 10:01:00
44, Udayshivakumar Infra debuts at 14% discount at Rs 30,2023-04-03 10:13:00
45, HG Infra Engineering shares gain 3% on bagging 2 highway projects from NHAI,2023-04-03 09:50:00
46," Prashant Jain’s maiden fund said to get almost $1 bn in commitments, set to disrupt AIF space",2023-04-03 11:34:00
47, Rail Vikas Nigam share gain on winning multiple orders from NHAI,2023-04-03 09:44:00
48, $100 oil to tighter markets: Here’s what analysts see after OPEC+ shock cut,2023-04-03 09:44:00
49, Trapped short sellers can take oil prices higher after OPEC+ surprise output cut,2023-04-03 09:36:00
50, Eicher Motors share price rises 3% on robust domestic sales,2023-04-03 09:35:00
51," Hero MotoCorp shares gain on better sales data, board picks Niranjan Gupta as CEO",2023-04-03 09:31:00
52, Will Nifty hold up in green for third straight session? Auto makers hog the limelight | Opening Bell,2023-04-03 08:56:00
53, India’s $2 trillion export goal hinges on states and districts coming along,2023-04-03 08:37:00
54," Market Live: Auto sales a mixed bag in March but FY23 ends on a high; UltraTech, Bata India in focus",2023-04-03 08:27:00
55," Auto numbers, MPC meeting to dictate markets this week; Nifty may trade at 17,500–17,600: Experts",2023-04-03 08:07:00
56, Top fund manager makes contrarian bets on short-term bonds,2023-04-03 08:03:00
57," Interview | Focus on stocks in sectors that outperforming major indices & showing strong trend, says Prashant Shah of Definedge",2023-04-03 07:54:00
58," Daily Voice: Nifty should easily hit 15% EPS growth in FY24, says Sushant Bhansali of Ambit Asset Management",2023-04-03 07:45:00
59, Commodity Futures | Natural Gas is ready for a pull back,2023-04-03 07:37:00
60, Currency Options | A low-risk and high probability options strategy in currency pair USDINR,2023-04-03 07:35:00
61, Cash Market | A bull sash pattern suggests a reversal in PEL,2023-04-03 07:34:00
62, Cash Market | Demerger paves way for upside,2023-04-03 07:31:00
63, Top 10 things to know before the market opens today,2023-04-03 07:30:00
64, Options Trade | A non-directional options strategy in JSW Steel,2023-04-03 07:27:00
65," Closing Bell: Market ends with marginal gains amid volatility; auto, PSU banks rally",2023-04-03 15:51:00
66," Trade Spotlight | What's your strategy for ICICI Bank, Trent, Alkem Laboratories today?",2023-04-03 07:04:00
67," Buzzing Stocks: Auto stocks, JSW Energy, RVNL, Sterlite Tech, HG Infra & others in news today",2023-04-03 06:35:00
68, Top 10 trading ideas for April series as bulls take control over Dalal Street,2023-04-03 06:29:00
69," Hot Stocks | Here's why you should bet on TVS Motor, Axis Bank for short term",2023-04-03 06:22:00
70," Oil production cut could lift prices by $10 per barrel, analyst says",2023-04-03 06:20:00
71, OPEC+ announces surprise oil cuts; US calls move inadvisable,2023-04-03 06:18:00
72, Oil jumps $5/bbl as surprise OPEC+ output cuts jolt markets,2023-04-03 06:31:00
73, Avalon Technologies IPO | 10 key things to know before you subscribe to the issue,2023-04-03 06:40:00
74, Trade setup for today: Top 15 things to know before the opening bell,2023-04-03 07:44:00
75,Global stocks mixed as inflation fears arise after oil prices rally,2023-04-04 02:20:00
76,KPIT Technologies stock down by over 12% after JP Morgan report,2023-04-03 21:17:00
77,S&P 500’s Resilience in the Banking Crisis Is Largely Thanks to Tech,2023-04-03 18:52:00
78,Rising Rates Take Some Shine Off Private Markets,2023-04-03 18:43:00
79,"Markets rise as focus shifts to RBI policy, Q4 season; smallcap stocks shine",2023-04-03 17:36:00
80,Banking stocks start FY24 in green. Will it sail smoothly this fiscal?,2023-04-03 16:40:00
81,"Oil stocks show mix reactions to OPEC+ production cut; HPCL, BPCL down 4-5%",2023-04-03 15:47:00
82,These 5 Nifty PSU bank stocks surge up to 110% in FY23. Do you own any of them?,2023-04-03 13:59:00
83,"Udayshivakumar Infra shares list at discount. Buy, hold or exit?",2023-04-03 12:15:00
84,Madhusudan Kela portfolio: Top 4 stocks,2023-04-03 11:54:00
85,Top India fund manager makes contrarian bets on short-term bonds,2023-04-03 10:37:00
86,Udayshivakumar Infra shares list at discount to IPO issue price,2023-04-03 10:04:00
87,Sugar stock that has shed 60% in one year to consider interim dividend today,2023-04-03 09:25:00
88,Global market: SGX Nifty to OPEC+ output cut — key factors that you should know,2023-04-03 08:17:00
89,Buy or sell: Vaishali Parekh recommends 3 stocks to buy today — April 3,2023-04-03 07:29:00
90,"Stocks to Watch: Adani Group, Udayshivkumar Infra, HAL, Hero MotoCorp, Maruti",2023-04-03 07:25:00
91,Day trading guide for today: 6 stocks to buy or sell on Monday — 3rd April,2023-04-03 06:40:00
92,Would wait for more correction to invest in India says investor Jim Rogers,2023-04-03 12:32:00
93,"CDGS stock approves stock split, scrip at 5% lower circuit level",2023-04-02 22:24:00
94,"IOC market share climbs to 43%, posts 'stellar' performance in FY23",2023-04-04 00:25:00
95,Vedanta’s Ajay Goel joins Byju’s as CFO,2023-04-04 00:09:00
96,"​These 9 stocks record their new 52-week highs, do you own any?",2023-04-03 19:47:00
97,"Stock Radar: Buy Gail India for a target of Rs 124 in 1-2 months, says Ajit Mishra",2023-04-03 22:00:00
98,CCI approves Haldiram Group merger plan,2023-04-03 21:59:00
99,UFC parent Endeavor Group to acquire WWE in $9.3 bln deal,2023-04-03 21:39:00
100,US FTC orders Illumina to divest cancer detection test maker Grail,2023-04-03 21:35:00
101,"S&P 500, Nasdaq fall as inflation worries resurface; Tesla slides",2023-04-03 22:06:00
102,City gas distributors are well placed to take advantage of margin improvement,2023-04-03 18:56:00
103,​5 stocks held by only one MF scheme surge 10-48% in 3 months,2023-04-03 18:52:00
104,Is the stock market closed for Mahavir Jayanti tomorrow?,2023-04-03 18:38:00
105,Tech View: Nifty may remain range-bound. What should traders do on Wednesday,2023-04-03 18:24:00
106,"Rs 414 cr paid to 34,497 Karvy clients from NSE's investor protection fund",2023-04-03 18:14:00
107,"HDFC Bank Q4 update: Advances jump 17% to Rs 16 lakh crore, deposits up 21%",2023-04-03 17:30:00
108,Udayshivakumar Infra makes a muted debut on D-Street. What should investors do?,2023-04-03 16:00:00
109,"Sensex surges 115 pts after volatile trade; Nifty near 17,400",2023-04-03 16:05:00
110,​10 central banks that bought most gold over last two decades,2023-04-03 16:17:00
111,"Sensex gains 115 pts, Nifty near 17,400; Hero Moto rises 4%, Adani Ent sheds 2%",2023-04-03 15:55:00
112,5 moderately high risk funds which have given 9-21% returns to investors,2023-04-03 15:55:00
113,KPIT Tech shares tumble over 17%. Here's why,2023-04-03 15:51:00
114,Why it still makes sense to invest in debt funds post taxation tweaks,2023-04-03 15:48:00
115,What happened to SVB cannot happen to banks in India,2023-04-03 15:42:00
116,​These 8 stocks have surged over 25% in Q1 of last 3 fiscal years,2023-04-03 15:53:00
117,"8% off lifetime high! 4 factors that could help Nifty50 reclaim 18,000 this quarter",2023-04-03 15:08:00
118,"Vedanta pays a dividend of over Rs 100 in FY23, stock to trade ex-dividend this week",2023-04-03 15:03:00
119,Tips Industries fixes record date for proposed stock split,2023-04-03 14:51:00
120,"Attractive valuation! ITC shares can rally up to 18%, says Sharekhan",2023-04-03 14:29:00
121,European shares rise as OPEC+ output cuts boost oil majors,2023-04-03 13:55:00
122,Adani stocks lose up to 5%; 8 counters in red. Here's why,2023-04-03 12:56:00
123,"ITC, Titan and SBI among top 24 stocks to watch out for in FY24",2023-04-03 12:01:00
124,Tie-breaker? April likely to bring make-or-break moment for Dalal Street bulls,2023-04-03 16:25:00
125,"Auto stocks gain on robust FY23 sales; Hero MotoCorp, Maruti, Bajaj Auto rise over 2%",2023-04-03 11:50:00
126,Rail Vikas Nigam shares jump 7% on winning multiple orders,2023-04-03 11:46:00
127,"Oil stocks in focus: ONGC, OIL gain up to 6% on OPEC+’s production cut; HPCL, BPCL plunge 4%",2023-04-03 11:35:00
128,Chart Check: Paytm on verge of a breakout from inverse head & shoulder pattern; time to buy?,2023-04-03 12:37:00
129,"Tata Elxsi and LTTS on the sell list, will analysts be right?",2023-04-03 11:35:00
130,Top picks of the week: 5 large cap stocks with consistent ROCE and High ROE,2023-04-03 10:55:00
131,"Stock market holidays: BSE, NSE to remain shut for these 3 days in April",2023-04-03 10:51:00
132,"Hot Stocks: Brokerages on Zydus Life, PB Fintech, GAIL India and Bharat Electronics",2023-04-03 10:45:00
133,Top Nifty50 stocks analysts suggest buying this week,2023-04-03 10:30:00
134,"Tech Picks: ICICI Bank, TVS Motor among 5 stocks that can rally up to 6% in short term",2023-04-03 10:40:00
135,Sectoral spotlight: Brokerages see potential in cement sector; pick stocks for long-term gains,2023-04-03 10:23:00
136,"Momentum Pick: 34% gains in 1 year, Bosch poised for next round of rally?",2023-04-03 10:18:00
137,Udayshivakumar Infra shares list at 14% discount to IPO price,2023-04-03 09:58:00
138,Hindustan Unilever among 6 stocks that jumped above their 200 DMAs,2023-04-03 10:15:00
139,At multi-year highs: These 7 stocks gave 5-year breakouts,2023-04-03 09:56:00
140,"Sensex, Nifty start FY24 on volatile note; BPCL drops 4%, Maruti up 3%",2023-04-03 09:49:00
141,"Sensex gains 120 points, Nifty above 17,350; BPCL falls 3%",2023-04-03 09:34:00
